Event Name,Event Code,Event Type,Instructor,Course Languages,Component of Module
TOEFL test preparation B2-C2 (semester weeks 1-7) (English),_E_TOEF1,Language Course,Davide Camorani,English,TOEFL test preparation B2-C2 (semester weeks 1-7) (English)
Presentation skills B2.2-C1 (semester weeks 1-7)(English),_E_PS1,Language Course,Davide Camorani,English,Presentation skills B2.2-C1 (semester weeks 1-7)(English)
Writing and speaking B2-C1 (English),_E_WrSBC,Language Course,Davide Camorani,English,Writing and speaking B2-C1 (English)
Writing your master's thesis C1-C2 (English),_E_WM,Language Course,Davide Camorani,English,Writing your master's thesis C1-C2 (English)
Advanced academic writing C1-C2 (English),_E_AdvWr,Language Course,Kimberly Lewis,English,Advanced academic writing C1-C2 (English)
Advanced academic writing C1-C2 (English),_E_AdvWr,Language Course,Kimberly Lewis,English,Advanced academic writing C1-C2 (English)
Advanced speaking C1-C2 (English),_E_ZAdSC,Language Course,Kimberly Lewis,English,Advanced speaking C1-C2 (English)
Advanced writing workshop C1-C2 (7 sessions) (English),_E_AWrW,Language Course,Kimberly Lewis,English,Advanced writing workshop C1-C2 (semester weeks 1-7) (English)
Doctoral and research writing C1-C2 (English),_E_ZWdr,Language Course,Kimberly Lewis,English,Doctoral and research writing C1-C2 (English)
Applying for jobs in English B2-C2 (semester weeks 1-7),_E_AJE1,Language Course,Michelle Norgate,English,Applying for jobs in English B2-C2 (semester weeks 1-7)
Cambridge C1 Advanced test preparation B2.2-C1 (English),_E_C1AE,Language Course,Michelle Norgate,English,Cambridge C1 Advanced test preparation B2.2-C1 (English)
Basic German 3; A2,_D_ZB_23,Language Course,Corinna Lorena Viviani,German,Basic German 3; A2
Basic German 3; A2,_D_ZB_23,Language Course,Ursina Tones,German,Basic German 3; A2
Basic German 2; A1,_D_ZB_12,Language Course,Anja Gredig,German,Basic German 2; A1
Basic German 2; A1,_D_ZB_12,Language Course,Ursina Tones,German,Basic German 2; A1
Basic German 2; A1,_D_ZB_12,Language Course,Ursula Bolliger Allain,German,Basic German 2; A1
Basic German A2: Hi-speed,_D_ZA2hi,Language Course,Petra Blöchlinger,German,Basic German A2: Hi-speed
Einblicke in die ausseruniversitäre Berufspraxis,506-069a,Practical Training,Natalie Sabrina Borsy,German,Traineeship
Bachelorkolloquium,506-098a,Colloquium,Meret Fehlmann,German,Bachelor Colloquium
Writing a Research Proposal,506-539a,Independent Study,Mischa Elias Gallati Zimmermann,German,Writing a Research Proposal
"Auf den Spuren des ""Black Gold"" – Kohle, Kultur und Krise in Wales (Exkursion)",506-546a,Field Trip,Moritz Peter Ege,German,Research on the Move
Current Debates in Cultural Studies,506-550a,Colloquium,Friedrich Ernst von Bose,German,Current Debates in Cultural Studies
New Public? Ästhetisch-kollaborative Vernetzungen zwischen Wissenschaften und,506-552a,Seminar,Silvy Chakkalakal,German,Study Project: Research and Outreach
Knowledge Transfer,506-559a,Independent Study,Mischa Elias Gallati Zimmermann,German,Knowledge Transfer
Universitäre Berufspraxis,506-563a,Practical Training,Natalie Sabrina Borsy,German,Traineeship
Vertiefung universitäre Berufspraxis,506-566a,Practical Training,Natalie Sabrina Borsy,German,Traineeship
Basic German 3; A2,_D_ZB_23,Language Course,Olga Martin,German,Basic German 3; A2
"Basic German 4; A2: Listening, reading, and discussing",_D_Z24Li,Language Course,Sabine Buchmann Llanaj,German,"Basic German 4; A2: Listening, reading, and discussing"
Basic German 4; A2: Small Talk with ease,_D_Z24SM,Language Course,Ursula Bolliger Allain,German,Basic German 4; A2: Small Talk with ease
German 5; A2-B1: Einstieg ins Niveau B1,_D_Z25Ei,Language Course,Corinna Lorena Viviani,German,German 5; A2-B1: Einstieg ins Niveau B1
German 5; A2-B1: Einstieg ins Niveau B1,_D_Z25Ei,Language Course,Miriam Vorbrugg,German,German 5; A2-B1: Einstieg ins Niveau B1
Deutsch verstehen und sprechen; B1,_D_Zvesp,Language Course,Miriam Vorbrugg,German,Deutsch verstehen und sprechen; B1
Deutsch verstehen und sprechen; B1 (Teil b),_D_Zvptb,Language Course,Cornelia Steinmann,German,Deutsch verstehen und sprechen; B1 (Teil b)
Diskutieren und Präsentieren auf Deutsch; B2-C1,_D_ZDisB,Language Course,Corinna Lorena Viviani,German,Diskutieren und Präsentieren auf Deutsch
Schweizerdeutsch für Deutschsprachige ab C1; Teil b:Fokus Sprechen,_D_Zsch2,Language Course,Ursula Bolliger Allain,German,"Schweizerdeutsch für Deutschsprachige ab C1; Teil b, Fokus Sprechen"
German B1,_D_ZGeB1,Language Course,Corinna Lorena Viviani,German,German B1
"Theatrale Improvisation in der Fremdsprache Deutsch, B1-C1 (German)",_D_Theat,Language Course,Frank Kauffmann,German,"Theatrale Improvisation in der Fremdsprache Deutsch, B1-C1 (German)"
Basic German A2: Hi-speed,_D_ZA2hi,Language Course,Petra Blöchlinger,German,Basic German A2: Hi-speed
Writing and speaking B2-C1 (English),_E_WrSBC,Language Course,Michelle Norgate,English,Writing and speaking B2-C1 (English)
Cambridge C2 Proficiency test preparation C1-C2 (English),_E_C2PE,Language Course,Paschal Maher,English,Cambridge C2 Proficiency test preparation C1-C2 (English)
English for work B2-C1,_E_ZWork,Language Course,Paschal Maher,English,English for work B2-C1
Legal English 1 (C1-C2),_E_Law1,Language Course,Paschal Maher,English,Legal English 1 (C1-C2)
Legal English 2 (C1-C2),_E_Law2,Language Course,Paschal Maher,English,Legal English 2 (C1-C2)
Academic English C1 (Part2),-E-Ac2,Language Course,Rupert Taylor,English,Academic English C1 (Part2)
Academic English foundation for UZH - B1,_E_AEF,Language Course,Rupert Taylor,English,Academic English foundation for UZH - B1
Advanced English for academic purposes C1-C2,_E_AdvE,Language Course,Rupert Taylor,English,Advanced English for academic purposes C1-C2
Advanced English for academic purposes C1-C2,_E_AdvE,Language Course,Rupert Taylor,English,Advanced English for academic purposes C1-C2
Advanced pronunciation and speaking,_E_PrAdv,Language Course,Rupert Taylor,English,Advanced pronunciation and speaking (semester weeks 1-7) (English)
Pronunciation and speaking basics (semester weeks 8-14) (English),_E_PrBa2,Language Course,Rupert Taylor,English,Pronunciation and speaking basics (semester weeks 8-14) (English)
Grammar consolidation and progress B1- B2.1 (English),_E_GrCPB,Language Course,Rupert Taylor,English,Grammar consolidation and progress B1- B2.1 (English)
Writing your master's thesis: Natural science and engineering C1-C2 (English),_E_WMNat,Language Course,Rupert Taylor,English,Writing your master's thesis: Natural science and engineering C1-C2 (English)
Academic writing for UZH B2 (English),_E_AcWrB,Language Course,Kate Elizabeth Schwendimann,English,Academic writing for UZH B2 (English)
TOEFL test preparation B2-C2 (semester weeks 1-7) (English),_E_TOEF1,Language Course,Kate Elizabeth Schwendimann,English,TOEFL test preparation B2-C2 (semester weeks 1-7) (English)
Writing and speaking B2-C1 (English),_E_WrSBC,Language Course,Kate Elizabeth Schwendimann,English,Writing and speaking B2-C1 (English)
Writing research papers for publication: Natural science and engineering C1-C2 (English),_E_ZWpNa,Language Course,Kate Elizabeth Schwendimann,English,Writing research papers for publication: Natural science and engineering C1-C2
Ausseruniversitäre Berufspraxis,506-569a,Practical Training,Natalie Sabrina Borsy,German,Traineeship
Colloquium,506-598a,Colloquium,Christine Suzanne Lötscher,German,Master Colloquium
Bachelorarbeit,506-BAa,Student Work,N/A,German,Bachelor's Thesis
Masterarbeit,506-MAa,Student Work,N/A,German,Master's Thesis
Visuelle Anthropologie - populäre Bilder erkennen und verstehen,506k001a,Seminar,Bernhard Tschofen,German,Visual Anthropology
Kulturen der Arbeit. Ethnografische und theoretische Zugänge,506k002a,Seminar,Laura Bäumel,German,Cultures of Work. Ethnographic and Theoretical Approaches
Cambridge C1 Advanced test preparation for UZH B2.2-C1 (English),_E_C1AEU,Language Course,Kate Elizabeth Schwendimann,English,Cambridge C1 Advanced test preparation for UZH B2.2-C1 (English)
Gruppe 01: Freiheit und Zwang,600-007a,Seminar,Omar El Manfalouty,German,Introductory Course I
"Gruppe 02: Gesundheit, Krankheit und Medizin / Health, illness and medicine",Medizin,Seminar,Yvan Craig Prkachin,"German, English",Introductory Course I
Gruppe 03: Haus und Häuslichkeit,600-007a,Seminar,Moe Omiya,"German, English",Introductory Course I
Gruppe 01: Schreibübung,600-009a,Exercise Group,Leila Valeria Girschweiler,German,Introductory Course II
Gruppe 01: Proseminar 3,600-009a,Seminar,Sarah-Maria Schober,German,Introductory Course II
Gruppe 02: Schreibübung,600-009a,Exercise Group,Ursula Kunnert,German,Introductory Course II
Gruppe 02: Proseminar 3,600-009a,Seminar,Livia Sabina Merz,German,Introductory Course II
Gruppe 03: Schreibübung,600-009a,Exercise Group,Frank Schubert,German,Introductory Course II
Gruppe 03: Proseminar 3,600-009a,Seminar,Gesine Krüger,German,Introductory Course II
Gruppe 04: Schreibübung,600-009a,Exercise Group,Nadine Stephanie Zberg,German,Introductory Course II
Gruppe 04: Proseminar 3,600-009a,Seminar,Zoé Louise Camille Kergomard,German,Introductory Course II
Gruppe 05: Schreibübung,600-009a,Exercise Group,Leila Valeria Girschweiler,German,Introductory Course II
Gruppe 05: Proseminar 3,600-009a,Seminar,Silvia Negri,German,Introductory Course II
"Sinophone Artikulationen in Südostasien und Europa: Literatur, Film, Kulturproduktion",280k121a,Seminar,Helen Hess,German,"Sinophone Articulations in Southeast Asia and Europe: Literature, Film, Cultural"
Classics on Television: Reassembling Our Stories,280k513a,Seminar,Lionel Sven Fothergill,English,Classics on Television: Reassembling Our Stories
Grundlagen der Japanologie: Sozialwissenschaft,290-001a,Exercise Group,Chiara Fusari,German,Introduction to Japanese Studies
Modernes Japanisch 2,290-004a,Language Course,Guido Gefter,"German, Japanese",Modern Japanese 2
Modernes Japanisch 4,290-006a,Language Course,Mariko Vontobel-Kishimoto,"German, Japanese",Modern Japanese 4
Modernes Japanisch 6,290-008a,Language Course,Guido Gefter,"Japanese, German",Modern Japanese 6
Japanische Lektüre 2,290-011a,Exercise Group,Guido Gefter,"German, Japanese",Japanese Readings 2
Literatur und Quellen zur japanischen Gesellschaft,290-013a,Exercise Group,Nora Gilgen,German,Reading Japanese Scholarship
Japanischer klassischer Lektürekanon,290-015a,Independent Study,Raji Carl Ludwig Steineck,German,Reading List Classical Japanese
Japanischer moderner Lektürekanon,290-016a,Independent Study,Guido Gefter,German,Reading List Modern Japanese
Japanische Mythologie,290-018a,Seminar,Sarah Rebecca Schmid,German,Issues in Research on Japan (Proseminar)
Vertiefung Themen der japanischen Gesellschaft (Proseminararbeit),290-101a,Independent Study,Chiara Fusari,German,Issues of Japanese Society: Consolidation (Proseminar Paper)
Einzelprobleme der Politik/Wirtschaft Japans (Seminararbeit),290-103a,Independent Study,Chiara Fusari,German,Specific Issues of Politics / Economics of Japan (Seminar Paper)
Diversity in Contemporary Japan,290-104a,Seminar,Chiara Fusari,English,Sociology of Japan (Seminar)
Einzelprobleme der Soziologie Japans (Seminararbeit),290-105a,Independent Study,Chiara Fusari,German,Specific Issues of Sociology of Japan (Seminar Paper)
Japanische Gesellschaft nach 1945,290-106a,Course,Helena Brigitte Hof,German,Japanese Society after 1945
Vertiefung Themen der japanischen Philologie (Proseminararbeit),290-109a,Independent Study,Raji Carl Ludwig Steineck,German,Issues of Japanese Philology: Consolidation (Proseminar Paper)
Hospitationspraktikum,090BPEP,Practical Training,N/A,German,Lesson Shadowing
"Übungslektionen im Unterrichtsfach (10 Lektionen, davon 5 unterrichtet)",090BPUE,Exercise Group,N/A,German,Lessons training
"Übungslektionen, 1. Unterrichtsfach (10 Lektionen, davon 5 unterrichtet)",090BPUZ1,Practical Training,N/A,German,Lessons training as part of the 1st subject didactics
"Übungslektionen, 2. Unterrichtsfach (10 Lektionen, davon 5 unterrichtet)",090BPUZ2,Exercise Group,N/A,German,Lessons training as part of the  2nd subject didactics
"Übungslektionen im zusätzlichen Unterrichtsfach (10 Lektionen, davon 5 unterrichtet)",090BPUZ,Exercise Group,N/A,German,Lessons training
"Übungslektionen W (20 Lektionen, davon 10 unterrichtet)",090WRUe,Exercise Group,N/A,German,Lessons training
"Unterrichtspraktikum I (50 Lektionen, davon 30 unterrichtet)",090BPP1,Practical Training,N/A,German,Teaching Internship I
"Unterrichtspraktikum II-E (40 Lektionen, davon 25 unterrichtet)",090BPP2,Practical Training,N/A,German,Teaching Internship II-E
Praktikumsjournal im Rahmen des Unterrichtspraktikums,90BPPJ,Practical Training,N/A,German,Internship journal as part of the 1st teaching internship
Zwischen Leben und Fiktion: Das literarische Werk von Ōe Kenzaburō (1935–2023),290-110a,Seminar,Sebastian Balmes,German,Japanese Literature (Seminar)
Einzelprobleme der Japanischen Literatur (Seminararbeit),290-111a,Independent Study,Raji Carl Ludwig Steineck,German,Specific Issues of Japanese Literature (Seminar Paper)
Einzelprobleme der japanischen Geistesgeschichte (Seminararbeit),290-113a,Independent Study,Raji Carl Ludwig Steineck,German,Specific Issues of Japanese Intellectual History (Seminar Paper)
Einführung in die japanische Geistesgeschichte,290-114a,Lecture with Practical Exercises,Paulus Bastian Kaufmann,German,Introduction to Japanese Intellectual History
Japanologische Forschungsliteratur (Ba- Prüfung),290-400a,Independent Study,Raji Carl Ludwig Steineck,German,Japanese Research Literature (Oral Exam)
Sprachpraktikum Japanisch 1,290-401a,Practical Training,Guido Gefter,German,Internship Japanese Language 1
Sprachpraktikum Japanisch 2,290-402a,Practical Training,Guido Gefter,German,Internship Japanese Language 2
Wissenschaftliches Arbeiten mit japanischen Quellen (Hausarbeit),290-405a,Independent Study,Raji Carl Ludwig Steineck,German,Working with Japanese Sources (Written paper)
Wissenschaftliches Präsentieren Japanisch,290-501a,Exercise Group,Mariko Vontobel-Kishimoto,"Japanese, German",Japanese Scientific Presentation
Forschungsthemen der japanischen Philologie (Seminararbeit),290-603a,Independent Study,Raji Carl Ludwig Steineck,German,Research Subjects of Japanese Philology (Seminar Paper)
Themen der sozialwiss. Japanforschung (Seminararbeit),290-700a,Independent Study,Nora Gilgen,German,Issues in Social Science of Japan (Seminar Paper)
Reading Japanese Academic Texts,290-702a,Exercise Group,Chiara Fusari,English,Lecture of Japanese Research Publications
Introduction to Research Methods in the Social Sciences,290-703a,Exercise Group,Helena Brigitte Hof,"English, German",Introduction to Research Methods (in Social Sciences)
Schwerpunktlektüre Fachtexte,290-704a,Independent Study,Helena Brigitte Hof,German,Focus Readings
Fachwissen Japanologie im Überblick (Ma- Prüfung),290-801a,Independent Study,Raji Carl Ludwig Steineck,German,Advanced Survey of Japanology (Ma-Exam)
Einzelprobleme der japanologischen Forschung (Seminararbeit),290-802a,Independent Study,Raji Carl Ludwig Steineck,German,Research Problems in Japanology (Seminar Paper)
Einzelthemen der japanologischen Forschung (Seminararbeit),290-803a,Independent Study,Raji Carl Ludwig Steineck,German,Research Issues in Japanology (Seminar Paper)
Bachelorarbeit,290-BAa,Student Work,N/A,German,Bachelor's Thesis
Masterarbeit,290-MAa,Student Work,N/A,German,Master's Thesis
"Unterrichtspraktikum II-Z (30 Lektionen, davon 20 unterrichtet)",090BPUP2,Practical Training,N/A,German,Teaching Internship II-Z
"Unterrichtspraktikum im Zusatzfach (30 Lektionen, davon 20 unterrichten)",090BPUPZ,Practical Training,N/A,German,Teaching Internship
"Unterrichtspraktikum II-W (30 Lektionen, davon 20 unterrichtet)",090BPPW2,Practical Training,N/A,German,Teaching Internship II-W
Unterrichtspraktikum Z-WI im Zusatzfach Wirtschaft und Recht an einem Gymnasium (30,090BPZW1,Practical Training,N/A,German,Teaching Internship Z-W1
Unterrichtspraktikum Z-W2 im Zusatzfach Wirtschaft und Recht an einem Gymnasium (30,090BPZW2,Practical Training,N/A,German,Teaching Internship Z-W2
"Übungslektionen im Zusatzfach «Wirtschaft und Recht» (15 Lektionen, davon 8",M090BPUW,Exercise Group,N/A,German,"Übungslektionen im Zusatzfach «Wirtschaft und Recht» (15 Lektionen, davon 8"
Gruppe 06: Schreibübung,600-009a,Exercise Group,Omar El Manfalouty,German,Introductory Course II
Gruppe 06: Proseminar 3,600-009a,Seminar,Riccarda Schmid,German,Introductory Course II
Gruppe 07: Schreibübung,600-009a,Exercise Group,Nikolas Thomas Hächler,German,Introductory Course II
Gruppe 07: Proseminar 3,600-009a,Seminar,Claudia Zey,German,Introductory Course II
Gruppe 08: Schreibübung,600-009a,Exercise Group,Jakob Valentin Odenwald,German,Introductory Course II
Gruppe 08: Proseminar 3,600-009a,Seminar,Riccardo Enzo Rossi,"German, English",Introductory Course II
Gruppe 09: Schreibübung,600-009a,Exercise Group,Lucas Federer,German,Introductory Course II
Gruppe 09: Proseminar 3,600-009a,Seminar,Franziska Leonie Rüedi,German,Introductory Course II
Einführungsvorlesung: Antike und Mittelalter,600-010a,Course,Anne Kolb,German,Introductory Lecture Spring
Kassandra's World. Geschichte und Fiktion in Assassin's Creed Odyssey,600-033a,Seminar,Andreas Victor Walser,German,Ancient History 5
Die grossen Kriege Roms und ihr Beitrag zu Aufstieg und Niedergang des Imperium,Romanum600-034a,Seminar,Michael Alexander Speidel,German,Ancient History 6
Antike Geschichte digital erleben,600-035a,Seminar,Felix Klaus Maier,German,Ancient History 7
Griechen und Barbaren: Die Weltgeschichte Herodots,600-036a,Seminar,Jens Bartels,German,Ancient History 8
Wissenskulturen im Spätmittelalter. Schwerpunkt Schweiz,600-041a,Seminar,Silvia Negri,German,Medieval History 5
"Heilige, Wunder und Mirakel im frühen Mittelalter",600-042a,Seminar,Sebastian Scholz,German,Medieval History 6
Denn sie lieben die Freiheit so sehr - Die Entstehung der Kommunen im mittelalterlichen,Europa600-043a,Seminar,Claudia Zey,German,Medieval History 7
"Geld, Geist und Gewalt. Inner- und transalpiner Kontakt und Austausch im Spätmittelalter",600-044a,Seminar,Paolo Ostinelli,German,Medieval History 8
Rote Ukraine: Sowjetische Geschichte aus ukrainischer Perspektive,600-045a,Seminar,Fabian Marc Baumann,German,Modern History 13
"Konsum, Politik und Geschlecht in der Schweiz nach 1945",600-046a,Seminar,Zoé Louise Camille Kergomard,German,Modern History 14
"Massengräber, Gräuelbilder und Zeugenaussagen: Forensik und Massengewalt im 20. und",Jahrhundert600-047a,Seminar,Alexa Stiller,"German, English",Modern History 15
Art as a Means of Historical Inquiry,600-048a,Seminar,Jonas Manuel Rüegg,"German, English",Modern History 16
Bis aufs Blut: Reformation/en in Europa,600-049a,Seminar,Francisca Loetz,German,Modern History 17
Das Recht auf den eigenen Körper. Frauenbewegung und die Initiative für den straflosen,Schwangerschaftsabbruch600-050a,Seminar,Ruben Marc Hackler,German,Modern History 18
«Our neutral». Die Schweiz und die USA 1942–1992,600-051a,Seminar,Sacha Roberto Zala,German,Modern History 19
Tiere im Anthropozän. Zur gesellschaftlichen Natur von Mensch- Tier-Umwelt-,ltnissen600-052a,Seminar,Beat Bächi,German,Modern History 20
Mapping Pacific History,600-053a,Seminar,Jonas Manuel Rüegg,"German, English",Modern History 21
Crises of Globalization,600-054a,Seminar,Damian Lionel Clavel,English,Modern History 22
"Mündliche Masterprüfung, Alte Geschichte",600-501a,Independent Study,N/A,German,Oral Exam (Master's)
"Mündliche Masterprüfung, Geschichte des Mittelalters",600-501a,Independent Study,N/A,German,Oral Exam (Master's)
Die Edo-Zeit,290k612a,Seminar,Paulus Bastian Kaufmann,German,The Edo Period
Forschungsseminar: Herausforderungen im gegenwärtigen japanischen Arbeitsmarkt,290k715a,Seminar,Nora Gilgen,"German, English",Research Seminar: Challenges in the Contemporay Japanese Labour Market
Praktikum,290k717a,Practical Training,Helena Brigitte Hof,German,Traineeship
Umfassendes Praktikum,290k718a,Practical Training,Helena Brigitte Hof,German,Comprehensive Traineeship
Arabisch 2,306-003a,Language Course,Natalia Bachour,German,Arabic 2
Arabisch 2: Tutorat,306-003a,Tutorial,Natalia Bachour,German,Arabic 2
Lektüre moderner arabischer Texte,306-005a,Exercise Group,Felix Konrad,"German, English",Readings in Modern Arabic Texts
Lektüre klassischer arabischer Texte,306-006a,Exercise Group,James Weaver,English,Readings in Classical Arabic Texts
Allgemeine Didaktik: Lehren und Lernen an Maturitätsschulen,222EinfE,Course,Dominik Petko,German,General Didactics: Teaching and Learning at Upper Secondary Schools
Pädagogische Psychologie: Konzepte und Bedingungen von Lern- und,Jugendlichen22244m0,Course,Yves Karlen,German,Educational Psychology
"Leistungsmessung und -bewertung: Prüfen, Beurteilen, Bewerten (PBB) / Educational",Measurement22261m0,Course,Doreen Flick-Holtsch,German,Educational Testing and Measurement
Kolloquium für Diplomkandidatinnen und Diplomkandidaten (DK),222DKo,Colloquium,Dominik Petko,German,Colloquium for Exam Candidates
Kolloquium für Diplomkandidatinnen und Diplomkandidaten (DK),222DKo-2,Colloquium,Yves Karlen,German,Colloquium for Exam Candidates
Fachdidaktik Englisch I,090Mo1,Lecture with Practical Exercises,Martin Moling,English,Subject Didactics English I
Aktuelle Forschungen in Umwelt- und Medizingeschichte - current research in,history600-517a,Colloquium,Flurin Condrau,"German, English",Research Colloquium 1
Masterkolloquium (Bhattacharyya / Dommann),Bhattacharyya,Colloquium,Monika Dommann,German,Research Colloquium 1
Fachdidaktik Englisch II,090Ma2,Lecture with Practical Exercises,Nomsa Frances Mabona,English,Subject Didactics English II
Master-/Doktoratskolloquium (Dusinberre),600-517a,Colloquium,Martin Dusinberre,English,Research Colloquium 1
Forschungskolloquium 1+2 (Kolb/Maier/Walser),600-517a,Colloquium,Anne Kolb,German,Research Colloquium 1
Fachdidaktik Englisch II,090Ze2,Lecture with Practical Exercises,Franziska Zeller,English,Subject Didactics English II
Master-/DoktorandInnenkolloquium (Koller),600-517a,Colloquium,Christian Koller,German,Research Colloquium 1
Master / Diss Kolloquium (Krüger),Master,Colloquium,Gesine Krüger,German,Research Colloquium 1
Fachdidaktik Englisch III: Young Adult Fiction and Beyond,090Ze3,Course,Franziska Zeller,English,Subject Didactics English III
Werkstatt Sozial- und Wirtschaftsgeschichte,600-517a,Colloquium,Tobias Straumann,"German, English",Research Colloquium 1
Masterkolloquium (Lieberman/Scholz/Zey),600-517a,Colloquium,Sebastian Scholz,German,Research Colloquium 1
Forschungskolloquium 1+2 (Loetz),600-517a,Colloquium,Francisca Loetz,German,Research Colloquium 1
"Mündliche Masterprüfung, Geschichte der Neuzeit",600-501a,Independent Study,N/A,German,Oral Exam (Master's)
Mediterrane Hafenstädte als Migrationsknotenpunkte der Vormoderne,600-503a,Seminar,Roberto Zaugg,German,Migration History of the Modern Era
Family History and Global History,600-505a,Seminar,Martin Dusinberre,English,Perspectives of Global History
"Wissen, Recht und Gelehrsamkeit im frühen Mittelalter",600-512a,Seminar,Sebastian Scholz,German,Politics and Societies in the Medieval Period
Ablagerungen mittelalterlicher Diskriminierungspraktiken im Archiv,600-514a,Seminar,Simon Teuscher,German,Social History and Economic History of the Medieval Period
Interviews - mündliche Quellen in der Geschichtswissenschaft,600-516a,Seminar,Frank Schubert,German,Methods and Theories
Menschheitsgeschichte und die Frage der Ungleichheit,600-516a,Seminar,Roberto Zaugg,German,Methods and Theories
Geschichte des Neoliberalismus,600-601a,Seminar,Tobias Straumann,German,Social History and Economic History of the Modern World
Übungen im Haftpflichtrecht Gruppe 1-7,120PM1-7,Exercise Group,Gian Andri Capaul,German,"Privatrecht II, 2. Teil Pflichtmodul (keine Prüfungsanmeldung)"
Übungen im Sachenrecht Gruppe 1-7,120PM2-4,Exercise Group,Ruth Arnet,German,"Privatrecht III, 2. Teil Pflichtmodul (keine Prüfungsanmeldung)"
FD III: Can Learning Grammar Be Fun - and Effective?,090Mo3,Course,Martin Moling,English,Subject Didactics English III
Masterkolloquium (Meier),600-517a,Colloquium,Marietta Meier,German,Research Colloquium 1
Forschungskolloquium 1+2 OEG/iOES (Perovic/Collmer),600-517a,Colloquium,Jeronim Perovic,German,Research Colloquium 1
Forschungskolloquium (Straumann B.),600-517a,Colloquium,Benjamin Straumann,"German, English",Research Colloquium 1
Forschungskolloquium 1+2 (Teuscher/Zaugg),600-517a,Colloquium,Simon Teuscher,German,Research Colloquium 1
Bachelorarbeit,600-BAa,Student Work,N/A,German,Bachelor's Thesis
Die griechische Archaik verstehen: Homers Ilias und Odyssee,600k001a,Course,Felix Klaus Maier,German,Ancient History 1 (Lecture)
"Apostel, Märtyrer, Häretiker - Das Christentum von den Anfängen bis zum Ende der",Verfolgungen600k002a,Colloquium,Andreas Victor Walser,German,Ancient History 1 (Colloquium)
Geschichte in der Praxis: YouTube macht Geschichte(n) - Alte Geschichte im Videoformat,600k003a,Colloquium,Sandro Raphael Andreatta,German,Ancient History 2 (Colloquium)
Geschichte der Schweiz im Mittelalter,600k004a,Course,Simon Teuscher,German,Medieval History 1 (Lecture)
Memoria und Totengedenken im Mittelalter,600k005a,Course,Sebastian Scholz,German,Medieval History 2 (Lecture)
Digitale Methoden für mittelalterliche Quellen,600k006a,Colloquium,Christine Natalie Grundig,German,Medieval History 1 (Colloquium)
Migration und Integration im europäischen Frühmittelalter,600k007a,Colloquium,Philip Zimmermann,German,Medieval History 2 (Colloquium)
Projektseminar zur Vorlesung: Berufsbildung in der Schweiz; Gruppe 3,222EGB3,Seminar,Jennifer Mazzarella,German,Educational Foundations of Vocational Education and the Swiss Vocational Education
