Event Name,Event Code,Event Type,Instructor,Course Languages,Component of Module
Soziale und politische Erkenntnistheorie,160k525a,Seminar,Dominique Kuenzle,German,Social and Political Epistemology
Animal Minds,160k526a,Seminar,Hans-Johann Glock,English,Animal Minds
Berechenbarkeit und Entscheidbarkeit,160k527a,Seminar,Romain Büchi,German,Computability and Decidability
"Ästhetische Werte, ästhetische Pflichten",163k505a,Seminar,Christoph Halbig,German,"Aesthetic values, aesthetic duties"
"Ethics, Sustainability and Financial Markets",163k506a,Seminar,Friedemann Rudolf Herbert Bieber,English,"Ethics, Sustainability and Financial Markets"
The Latest from Thomas Kuhn,164k505a,Seminar,William Clifford Bausman,English,The Latest from Thomas Kuhn
Propädeutischer Kurs in kieferorthopädischer Diagnostik,Z_KO4,Exercise Group,Spyridon Papageorgiou,German,Propaedeutic Course in Orthodontic Diagnostics
Klinischer Kurs in kieferorthopädischer Triage,ZKO_M2.1,Exercise Group,Raphael Patcas,German,Clinical Course in Orthodontics
Klinisch-propädeutischer Kurs der Endodontologie (Phantomkurs FS),ZPHENDO,Exercise Group,Matthias Zehnder,German,"Clinical Propaedeutic Course in Periodontology, Cariology and Endodontology"
"Kurs 2 in Präventivzahnmedizin, klinischer Befundung und Diagnostik",Z_PPK3.2,Exercise Group,Tobias Tauböck,German,"Preventive Dentistry, Clinical Assessment and Diagnostics, Course 2"
"Klinischer Kurs in Präventivzahnmedizin, Kariologie und Endodontologie",ZPPKM1,Exercise Group,Florian Just Wegehaupt,German,"Clinical Course in Preventive Dentistry, Cariology and Endodontology"
Klinischer Kurs in Parodontologie,ZPARM1,Exercise Group,Patrick Schmidlin,German,Clinical Course in Periodontology
Repetitorium Zahnerhaltung,P_PPK,Revision Course,Thomas Attin,German,"Revision, Lectures of 5th Study Year of Dental Medicine"
Interdisziplinäres Seminar zur Planung komplexer zahnärztlicher Behandlungen,FALLP2.2,Colloquium,Andreas Ender,German,"Interdisciplinary Course, Planning of Complex Dental Treatments, Part 2"
Restaurative Zahnerhaltung fortgeschrittenen Kurs 2. Master SJ,ZPPKM2,Exercise Group,Thomas Attin,German,Advanced Course in Restaurative Conservative Dentistry
Theorie zum klinischen Kurs in rekonstruktiver Zahnmedizin,EKO1.2,Course,Tonino Di Bello,German,Clinical Course in Reconstructive Dentistry
Rekonstruktive Zahnmedizin III,Z_REKO,Course,Elena Mühlemann-Kazanchian,German,"Individual Examination Master 1.2, theoretical, dental and medical Basics"
Français A2 : Mise à niveau,_F_MA2,Language Course,Manon Huguenot,French,Français A2 : Mise à niveau
Français A2-B1 : Cours de base,_F_CAB,Language Course,Cyril Destefani,French,Français A2-B1 : Cours de base
Français B2 : Mise à niveau,_F_MB2,Language Course,Cyril Destefani,French,Français B2 : Mise à niveau
Français C1 (partie II),-F-2,Language Course,Cyril Destefani,French,Français C1 (partie II)
Kernbereich Politik und Recht,721-103a,Course,Olivia Killias,German,Core field: Political Anthropology
Kernbereich Religion,721-105a,Course,Johannes Quack,German,Core field: Anthropology of Religion
"Anthropology of Possession, Ownership and Property",721k146a,Seminar,Désirée Ruth Gmür,English,"Anthropology of Possession, Ownership and Property"
Klinisch propädeutischer Kurs in rekonstruktiver Zahnmedizin - Phantom,REKO1,Exercise Group,Marc Balmer,German,Propaedeutic Course in Reconstructive Dentistry
Rekonstruktive Zahnmedizin V,KO2.4,Course,Damiano Marco C. Frigerio,German,Clinical Course in Reconstructive Dentistry
Synoptischer Kurs in rekonstruktiver Zahnmedizin,EKO2.2,Exercise Group,Ronald Ernst Jung,German,Clinical Course in Reconstructive Dentistry
Kolloquium zum synoptischen Kurs in rekonstruktiver Zahnmedizin,EKO2.3,Colloquium,Daniel Stefan Thoma,German,Clinical Course in Reconstructive Dentistry
Live-Demo in rekonstruktiver Zahnmedizin,EKO2.0,Exercise Group,Ronald Ernst Jung,German,Propaedeutic Course in Reconstructive Dentistry
EN.S440.2 English Literature II,440x440a,PHZH SEK I Module,Gabriela Frey,English,EN.S440 English Literature II
EN.S440.3 English Literature II,440x440a,PHZH SEK I Module,Nicole Frey Büchel,English,EN.S440 English Literature II
"GGP.S430.1 Grundkurs Geschichte 2, Gruppe 1",600x430a,PHZH SEK I Module,Daniel Furrer,German,GGP.S430 Basic Course History 2
"GGP.S430.2 Grundkurs Geschichte 2, Gruppe 2",600x430a,PHZH SEK I Module,Kijan Malte Espahangizi,German,GGP.S430 Basic Course History 2
"GGP.S430.3 Grundkurs Geschichte 2, Gruppe 3",600x430a,PHZH SEK I Module,Daniel Furrer,German,GGP.S430 Basic Course History 2
"GGP.S430.4 Grundkurs Geschichte 2, Gruppe 4",600x430a,PHZH SEK I Module,Kijan Malte Espahangizi,German,GGP.S430 Basic Course History 2
"GGP.S450.1 Schweizer Geschichte, Gruppe 1",600x450a,PHZH SEK I Module,Brigitta Monika Bernet,German,GGP.S450 History of Switzerland
"GGP.S450.2 Schweizer Geschichte, Gruppe 2",600x450a,PHZH SEK I Module,Kijan Malte Espahangizi,German,GGP.S450 History of Switzerland
"GGP.S470.1 Europäische und Aussereuropäische Geschichte, Gruppe 1",600x470a,PHZH SEK I Module,Judith Monica Vitale,German,GGP.S470 European and Non-European History
"GGP.S470.2 Europäische und Aussereuropäische Geschichte, Gruppe 2",600x470a,PHZH SEK I Module,Judith Monica Vitale,German,GGP.S470 European and Non-European History
Political Ecology,GEO425.1,Seminar,Norman Backhaus,English,GEO 425 Political Ecology: from critique to transformation
Hydrological field measurements and calculations; Field days,GEO471.2,Lecture with Practical Exercises,Jan Martin Rudolf Seibert,English,GEO 471 Hydrological field measurements and calculations
Human Geography Field Course 5: Researching the Vibe of urban places,GEO725.1,Seminar,Math.-naturwiss. Fakultät N.N.-Dozent,English,GEO725: Human Geography Field Course 5: Making Sense of Urban Places
"Making Humans, Reproducing the Future",721k148a,Seminar,Molly Jess Fitzpatrick,English,"Making Humans, Reproducing the Future"
Dekoloniale Ansätze in der Ethnologie,721k149a,Seminar,Gabriel Scheidecker,German,Decolonial Approaches in Social and Cultural Anthropology
Einführung in die Ethnologie Chinas,721k240a,Seminar,Mareile Flitsch,German,Anthropology of East Asia
Anthropology of Mesoamerica,721k210a,Seminar,Werner Bergamin Hertzog,English,Anthropology of Latin America
"Forschungsforum Wasser, Kryosphäre und Klima",GEODIPL,Seminar,Jan Martin Rudolf Seibert,German,"Research Forum on Water, Cryosphere and Climate"
Promotionsseminar II,GEODIPL,Seminar,Maria J. Santos,German,Promotion seminar II
Principles and Theory,GEODIPL,Seminar,Christian Berndt,German,Principles and Theory
Zürcher Geographisches Kolloquium,GEODIPL,Colloquium,Math.-naturwiss. Fakultät N.N.-Dozent,German,Zurich's geographical colloquium
Ethische Reflexionen zur Teilnehmenden Beobachtung,721k326a,Seminar,Eva Keller,German,Ethical Reflections on Participant Observation
Schreiben in der Ethnologie,721k327a,Seminar,Tanja Michaela Luchsinger,German,Writing in Anthropology
Visuelle Anthropologie: Ethnographisches Filmfestival Regard Bleu 2024,721k453a,Seminar,Miriam Saada Elabed,German,Visual Anthropology: Ethnographic Filmfestival Regard Bleu 2024
Methodenvertiefung: Einführung in die Visuelle Anthropologie,721k403a,Exercise Group,N/A,German,Methodological Extension: Introduction to Visual Anthropology
Introduction to Quantum Chemistry,CHE747.1,Lecture with Practical Exercises,Sandra Erika Luber,English,CHE 747 Introduction to Quantum Chemistry
Computational Materials Science and Advanced Quantum Chemistry,CHE748.1,Lecture with Practical Exercises,Sandra Erika Luber,English,CHE 748 Computational Materials Science and Advanced Quantum Chemistry
Modernes Koreanisch 2,290k412a,Exercise Group,Yeongeun Choi,"German, Korean",Modern Corean 2
The Shī�a in Early Islam,306k711a,Seminar,James Weaver,English,The Shī�a in Early Islam
Utopische Texte in der Epoche der arabischen Nahḍa,306k309a,Seminar,Patric Schaerer,German,Utopian Texts in the Era of the Arabic Nahḍa
Sanskrit-Seminar: Politik und politisches Handeln im klassischen Indien,330k017a,Seminar,Angelika Malinar,German,Sanskrit Seminar: Political Theory and Practice in Classical India
Hindi-Seminar: Die Teilung Indiens in der Hindi-Literatur des 20.Jhs.,330k022a,Seminar,Mirella Lingorska,German,Hindi Seminar: The Partition in 20th Century Hindi Literature
History of Modern India,330k309a,Course,Angelika Malinar,English,History of Modern India
ExPra (G18),200-102a,Practical Training,Rahel Christina Bachem,"German, English",Introduction to Experimental Psychology
ExPra (G19),200-102a,Practical Training,Louisa Antonia Maria Anna Jagmetti,German,Introduction to Experimental Psychology
ExPra (G37),200-102a,Practical Training,Peter Martin Hähner,German,Introduction to Experimental Psychology
Wie gestalte ich meinen Unterricht didaktisch abwechslungsreich?,222Uda,Seminar,N/A,German,How do I design my lessons didactically varied? Implementing different methods of
ExPra (G42),200-102a,Practical Training,Larissa Behnke,German,Introduction to Experimental Psychology
ExPra (G43),200-102a,Practical Training,Martin Götz,German,Introduction to Experimental Psychology
Kognitive Neurowissenschaften,200-201a,Course,Paul Sauseng,German,Cognitive Neuroscience
Arbeits- und Organisationspsychologie 2,200-302a,Course,Martin Kleinmann,German,Work and organizational psychology 2
Ausgewählte Themen der Psychopathologie (Teil 2),200-402b,Exercise Group,Myriam Thoma,German,Psychopathology Taught Online (PTO)
Seminar: Comparative Law - The Rule of Law in developing countries,120BA-2,Seminar,Juan Carlos Botero Navia,English,Bachelor's Thesis
How Did That Get Here? Museum Provenance in Colonial Collections,721k707a,Seminar,Alice Mercia Louise Hertzog-Fraser,English,How Did That Get Here? Museum Provenance in Colonial Collections
Doing Ethnography,721k400a,Exercise Group,Anne Kukuczka,English,Doing Ethnography
Praxismodul Museumsethnologie,721k450a,Practical Training,Mareile Flitsch,German,Museum Internship
Rassismus in der Schweiz,721k150a,Seminar,Juliane Neuhaus,German,Racism in Switzerland
Uzbekistan: Historical heritage and contemporary challenges,721k442a,Field Trip,Peter Finke,German,Uzbekistan: Historical Heritage and Contemporary Challenges
Language Course: Tzotzil-Maya (Bats'i k'op),721k056a,Language Course,Werner Bergamin Hertzog,English,Language Course: Tzotzil-Maya (Bats'i k'op)
Ba-Kolloquium,721-481a,Colloquium,Meltem Sancak Finke,German,Bachelor-Colloquium
Lecture Series in Social Anthropology Spring Semester 2024,721k509a,Colloquium,Christine Giulia Schenk,English,Lecture Series in Social Anthropology Spring Semester 2024
Methods and Research Design,721-550a,Seminar,Esther Leemann,English,Methods and Research Design
Master-Colloquium I + II,721-551a,Colloquium,Ann Elisabeth Derks,English,Master-Colloquium I
Our Common Future? Anthropological Perspectives on Sustainability,721k605a,Seminar,Ann Elisabeth Derks,English,Our Common Future? Anthropological Perspectives on Sustainability
"Research Seminar on Ethics, Religion and Knowledge",721-650a,Seminar,Stefan Binder,English,"Research Seminar on Ethics, Religion and Knowledge"
Field Course in Biodiversity Assessment and Monitoring,EEE353,Block Course,Florian Altermatt,English,EEE 353 Field Course in Biodiversity Assessment and Monitoring
Philosophy of Science with a Focus on Biology,BIO402,Course,Anna Deplazes Zemp,German,BIO 402 Philosophy of Science with a Focus on Biology
From bench to bedside – examples from immunology and beyond,BME333,Course,Nicole Christine Joller,English,BME 333 From Bench to Bedside – Examples from Immunology and Beyond
BIO 144 Data analysis in biology,BIO144,Lecture with Practical Exercises,Owen L. Petchey,"German, English",BIO 144 Data Analysis in Biology
Datenanalyse Praktikum,BIO144,Practical Training,Owen L. Petchey,"German, English",BIO 144 Data Analysis in Biology
Datenanalyse Praktikum,BIO144,Practical Training,Owen L. Petchey,"German, English",BIO 144 Data Analysis in Biology
Seminar: Financial Regulation - Principles and Policy,120BA-2,Seminar,Samuel Kern Alexander,English,Bachelor's Thesis
Seminar: Schweizerisches und Europäisches Vertrags- und Konsumrecht,120BA-2,Seminar,Yesim M. Atamer,German,Bachelor's Thesis
Seminar: Tabulae testamenti. Erscheinungsformen und Funktionen des Testaments in der,Kaiserzeit120BA-2,Seminar,Ulrike Babusiaux,German,Bachelor's Thesis
Seminar: Staatlicher Zugriff auf das Individuum zwischen Prävention und Repression,120BA-2,Seminar,Felix Bommer,German,Bachelor's Thesis
Seminar: Völkerrecht und internationales Konfliktmanagement,120BA-2,Seminar,Oliver Diggelmann,German,Bachelor's Thesis
Seminar: Aktuelle Entwicklungen im schweizerischen und deutschen Privatrecht,120BA-2,Seminar,Tanja Domej,German,Bachelor's Thesis
Seminar zu Grundfragen des Verwaltungsrechts,120BA-2,Seminar,Andreas Glaser,German,Bachelor's Thesis
Seminar zum Europäischen Wirtschaftsrecht,120BA-2,Seminar,Andreas Heinemann,German,Bachelor's Thesis
Seminar: Wein &amp; Recht,120BA-2,Seminar,Dominique Hans Jakob,German,Bachelor's Thesis
Seminar: Communicated cases and their solutions before the ECtHR,120BA-2,Seminar,Helen Keller,English,Bachelor's Thesis
Seminar: Territorial Conflicts and International Law: Current Challenges,120BA-2,Seminar,Lorenz Langer,English,Bachelor's Thesis
Seminar: Animal Law,120BA-2,Seminar,Margot Regula Michel,English,Bachelor's Thesis
Seminar: An den Grenzen der Grundrechte: Aktuelle Fragen der Grundrechtsträgerschaft,120BA-2,Seminar,Daniel Moeckli,German,Bachelor's Thesis
Seminar im Europarecht,120BA-2,Seminar,Matthias Oesch,German,Bachelor's Thesis
Seminar: Alternative Dispute Resolution in IP and Competition Matters – Recent,Challenges120BA-2,Seminar,Peter Georg Picht,English,Bachelor's Thesis
Seminar: Aktuelle Entwicklungen im Finanzmarktrecht,120BA-2,Seminar,Rolf Sethe,German,Bachelor's Thesis
Seminar: Grundfragen der Besteuerung von Unternehmen und Privatpersonen im,ltnis120BA-2,Seminar,Madeleine Simonek,German,Bachelor's Thesis
Seminar: Strafe als Vergeltung,120BA-2,Seminar,Marc Thommen,German,Bachelor's Thesis
Seminar: Staatsschutz- und Terrorismusdelikte,120BA-2,Seminar,Stefan Heimgartner,German,Bachelor's Thesis
Seminar: Financial Regulation - Principles and Policy,90MA-2,Seminar,Samuel Kern Alexander,English,Master's Thesis
Seminar: Schweizerisches und Europäisches Vertrags- und Konsumrecht,90MA-2,Seminar,Yesim M. Atamer,German,Master's Thesis
Seminar: Tabulae testamenti. Erscheinungsformen und Funktionen des Testaments in der,Kaiserzeit90MA-2,Seminar,Ulrike Babusiaux,German,Master's Thesis
Seminar: Staatlicher Zugriff auf das Individuum zwischen Prävention und Repression,90MA-2,Seminar,Felix Bommer,German,Master's Thesis
Seminar: Sustainability &amp; Technology Corporate Governance and Capital Markets,90MA-2,Seminar,Marco Dell'Erba,English,Master's Thesis
Seminar: Völkerrecht und internationales Konfliktmanagement,90MA-2,Seminar,Oliver Diggelmann,German,Master's Thesis
Seminar: Aktuelle Entwicklungen im schweizerischen und deutschen Privatrecht,90MA-2,Seminar,Tanja Domej,German,Master's Thesis
Seminar im Sozialversicherungsrecht,90MA-2,Seminar,Thomas Gächter,German,Master's Thesis
Seminar zu Grundfragen des Verwaltungsrechts,90MA-2,Seminar,Andreas Glaser,German,Master's Thesis
Seminar: Cancel Culture,90MA-2,Seminar,Christoph Beat Graber,German,Master's Thesis
Seminar zum Europäischen Wirtschaftsrecht,90MA-2,Seminar,Andreas Heinemann,German,Master's Thesis
Seminar: Wein &amp; Recht,90MA-2,Seminar,Dominique Hans Jakob,German,Master's Thesis
Seminar: Communicated cases and their solutions before the ECtHR,90MA-2,Seminar,Helen Keller,English,Master's Thesis
Seminar: Territorial Conflicts and International Law: Current Challenges,90MA-2,Seminar,Lorenz Langer,English,Master's Thesis
Seminar: Animal Law,90MA-2,Seminar,Margot Regula Michel,English,Master's Thesis
Seminar: An den Grenzen der Grundrechte: Aktuelle Fragen der Grundrechtsträgerschaft,90MA-2,Seminar,Daniel Moeckli,German,Master's Thesis
Seminar im Europarecht,90MA-2,Seminar,Matthias Oesch,German,Master's Thesis
Seminar: Alternative Dispute Resolution in IP and Competition Matters - Recent,Challenges90MA-2,Seminar,Peter Georg Picht,English,Master's Thesis
Seminar: Transnational Organised Crime,90MA-2,Seminar,Christian Schwarzenegger,English,Master's Thesis
Seminar: Aktuelle Entwicklungen im Finanzmarktrecht,90MA-2,Seminar,Rolf Sethe,German,Master's Thesis
Seminar: Grundfragen der Besteuerung von Unternehmen und Privatpersonen im,ltnis90MA-2,Seminar,Madeleine Simonek,German,Master's Thesis
Seminar: Strafe als Vergeltung,90MA-2,Seminar,Marc Thommen,German,Master's Thesis
Seminar: Staatsschutz- und Terrorismusdelikte,90MA-2,Seminar,Stefan Heimgartner,German,Master's Thesis
Seminar: Strafrecht in der Digitalwirtsc,90MA-2,Seminar,Lukas Staffler,German,Master's Thesis
Irregular Migration in Europe,721k328a,Seminar,Michelle von Dach,English,Irregular Migration in Europe
(Wiederholungsprüfung) Basistheorien der Kommunikationswissenschaft,254-002a,Examination,Mike Steffen Schäfer,German,Basic Theories of Communication Science
Poesie als Musik im Lied des 19. Jahrhunderts,760k014a,Seminar,Laurenz Lütteken,German,Poesie als Musik im Lied des 19. Jahrhunderts
Music in South Asia,760k016a,Exercise Group,Svanibor Hubert Pettan,English,Music in South Asia
"Immersive Teaching Materials: Video, AR and VR",222ITM,Seminar,Juliette Clémentine Marguerite Desiron,English,"Immersive Teaching Materials: Video, AR and VR"
Überfachliche Kompetenzen und digitale Medien,fK,Seminar,Carmen Nadja Hirt,German,Cross-curricular competencies and digital media
Leben Schreiben: Ethnologische und literaturwiss. Perspektiven,721k758a,Seminar,Christine Suzanne Lötscher,German,Writing Lives: Perspectives from Anthr. and Literary Studies
Qualitative Methoden,721-556a,Seminar,Dorothea Lüddeckens,German,Qualitative Methods
Fachdidaktik Wirtschaft und Recht II: Didaktik der einzelnen Fächer,090WiRe2,Lecture with Practical Exercises,Beda Alexander Riklin,German,Subject Didactics Economy and Law II
Psychiatrie,ZPSYM1.2,Course,Philipp Homan,German,"Individual Examination Master 1.2, theoretical, dental and medical Basics"
Innere Medizin II,Z_IM3.2,Course,Alexander Imhof,German,"Individual Examination Bachelor 3.2, theoretical, dental and medical Basics"
Innere Medizin IV,ZIM4,Course,Alexander Imhof,German,"Individual Examination Master 1.2, theoretical, dental and medical Basics"
Erkenntnistheorie (Dolby-Rathgeb),160-017a,Other,Nicole Corinne Dolby-Rathgeb,German,Epistemology
Theoretical Philosophy,160-503a,Colloquium,Hans-Johann Glock,"German, English",Research Colloquium
Epistemology and Metaethics Colloquium,160-503a,Colloquium,Anne Meylan,"German, English",Research Colloquium
Politische Philosophie (Vertiefung) (Reichling),160-510a,Other,Philipp Reichling,German,Political philosophy (advanced)
Digital Transformation - Overview &amp; Reflection,DSI_DTOR,Seminar,Michael Coors,English,Digital Transformation - Overview &amp; Reflection
Teamwork on Digital Transformation Challenges (3ECTS),DSI_DTC1,Seminar,Titus Mangham-Neupert,English,Teamwork on Digital Transformation Challenges (3ECTS)
(Wiederholungsprüfung) Statistik und Datenanalyse: Einführung,254-014a,Examination,Werner Wirth,German,Introduction to Statistics and Data Analysis
(Wiederholungsprüfung) Einführung in die griechische Metrik,321k014a,Examination,Fabian Zogg,German,Introduction to Greek Metre
(Wiederholungsprüfung) Klassisches Ägyptisch II,322-006a,Examination,Hanna Jenni,German,Classical Egyptian II
"(In)Stabilität - Krisen und Krisenbewältigung, in der Antike und heute",322k003a,Course,José Luis Alonso,German,Lecture Series of the Zurich Center for the Study of the Ancient World
(Wiederholungsprüfung) Christentum und Wissenschaft in Mittelalter und Früher Neuzeit,324k501a,Examination,Philipp Roelli,German,Christianity and Science in the Middle Ages and Early Modern Times (Lecture
Virology: Biology of Virus Infection and Evolution,BIO374,Block Course,Huldrych Günthard,English,BIO 374 Virology: Biology of Virus Infection and Evolution
Medical Immunology,BME366,Block Course,Cezmi A. Akdis,English,BME 366 Medical Immunology
BIO 617 Principles of biosafety in medical and biological research,BIO617,Lecture with Practical Exercises,Alexandra Trkola,English,BIO 617 Principles of biosafety in medical and biological research
Emotionen und Reflexionsprozesse als Einflussfaktoren für Entscheidungsfindung im,Unterricht222ERE,Seminar,Natalia Molina Otero,German,Emotionen und Reflexionsprozesse als Einflussfaktoren für Entscheidungsfindung im
Interdisciplinary Introduction to Machine Learning,ML,Lecture with Practical Exercises,Giacomo Indiveri,English,Interdisciplinary Introduction to Machine Learning
"Qualitative Methoden: analysieren, interpretieren, formulieren (Gruppe 3)",506-023a,Seminar,Todd Mitchell Sekuler,German,Qualitative Analysis and Interpretation
"Schriftliche Arbeit zum Proseminar ""Musik und Architektur in der Frühen Neuzeit: Theorie",760k019a,Independent Study,Tobias Christian Weissmann,German,"Schriftliche Arbeit zum Proseminar ""Musik und Architektur in der Frühen Neuzeit:"
Current trends in progressive schools and classrooms,222Ctp,Seminar,Eliana Maria Brianza,English,Current trends in progressive schools and classrooms
Postdigitale Ästhetik,360k547a,Colloquium,Jan Noël Thon,German,Postdigitale Ästhetik
"""Nichts"" schreiben: Literarische Einsätze der Negation",360-515a,Colloquium,Daniel Müller Nielaba,German,Rhetoric - Poetics - Performance
"""Nichts"" schreiben: Literarische Einsätze der Negation",360-515a,Seminar,Daniel Müller Nielaba,German,Rhetoric - Poetics - Performance
Digitale Religion(en) - Digitale Theologie(n),UZHI_4,Course,Thomas Schlag,"German, English",Digitale Religion(en) - Digitale Theologie(n)
"Interdisziplinärer Kurs ""Gesundheitswesen und Ethik in der Zahnmedizin""",Z_Ethik,Course,Bernd Stadlinger,German,Interdisciplinary Course in Healthcare and Ethics in Dentistry
"Fortpflanzung im Spannungsfeld von Medizin, Religion und Politik",UZHI_5,Course,Linda Alice Bosshart,"German, English","Fortpflanzung im Spannungsfeld von Medizin, Religion und Politik"
Ethical and reflective prompt engineering for ChatGPT and Co.,DSI_GPT,Seminar,Noah Bubenhofer,English,Ethical and reflective prompt engineering for ChatGPT and Co.
Demokratie und Care,245k620a,Seminar,Katrin Meyer,German,Democracy and Care
Moderne und zeitgenössische chinesische Literatur (Einführung),280-101a,Course,Sujie Jin,English,Modern and Contemporary Chinese Literature (Introduction)
OSINT 2: Technical Introduction and Operational Security,DSI_OSI2,Seminar,Markus Christen,English,OSINT 2: Technical Introduction and Operational Security
"Hospitation in der Klinik für Allgemein-, Behinderten- und Seniorenzahnmedizin",ZGER1.2,Exercise Group,Murali Srinivasan,German,"Clinical Propaedeutic Course in Clinic of General, Special Care and Geriatric Dentistry"
Grundlagen der Japanologie: Philologie,290-001b,Exercise Group,Raji Carl Ludwig Steineck,German,Introduction to Japanese Studies
Kanbun,290-502a,Lecture with Practical Exercises,Daniela Tan,German,Kanbun/Kundoku
Using language models to mine public opinion,DSI_ULM,Block Course,Christina Haag,English,Using language models to mine public opinion
Texte zum Naturverständnis in der japanischen Geschichte,290-601a,Exercise Group,Raji Carl Ludwig Steineck,German,Japanese Source Texts: Cursory Reading
Sozial-kognitive Entwicklung,200k202a,Seminar,Stephanie Wermelinger,German,Social-cognitive development
Cognitive and Motivational Development Across Adulthood,200k202b,Seminar,Jasmin Brummer,English,Cognitive and Motivational Development Across Adulthood
Healthy Longevity and Innovation,200k202c,Seminar,Burcu Demiray,English,Healthy Longevity and Innovation
Eine praktische Einführung in die Forschung neuronaler Entwicklungsstörungen,200k202d,Seminar,Nicolas Oliver Langer,German,A hands-on introduction to research of neurodevelopmental disorders
The Psychology of Human-Animal Intergroup Relations,200k303a,Seminar,Christopher James Hopwood,English,The Psychology of Human-Animal Intergroup Relations
"Dishonesty, corruption, and unethical behavior: An introduction to behavioral ethics",200k303d,Seminar,Jörg Alexander J. Gross,English,"Dishonesty, corruption, and unethical behavior: An introduction to behavioral ethics"
Motivation in der Partnerschaft,200k303y,Seminar,Julia Katharina Schäfer,German,Motivation in romantic relationships
Exhaustion and Recovery,200k303z,Seminar,Beatrice-Alexandra Tarapoanca,English,Exhaustion and Recovery
Arbeitsgemeinschaft in Codierungstheorie und Kryptographie,MAT076.1,Student Work,N/A,German,MAT 076 Neuchatel - St.Gallen - Zurich Seminar in Coding Theory and Cryptography
Analysis II,MAT122.1,Course,Corinna Ulcigrai,German,MAT 122 Analysis II
"Übungen Analysis II, Gr. 1",MAT122.2,Exercise Group,N/A,German,MAT 122 Analysis II
Stochastik,MAT901.1,Course,Jean Bertoin,German,MAT 901 Stochastics
Zahlentheorie (MA S420),MAT153.1,PHZH SEK I Module,Franz X. Müller,German,MAT 153 Number Theory
UE/TU Zahlentheorie (MA S420),MAT153.2,PHZH SEK I Module,Franz X. Müller,German,MAT 153 Number Theory
Stochastik für die Naturwissenschaften,MAT183.1,Course,Christoph Luchsinger,German,MAT 183 Stochastics for Natural Sciences
"Übungen Stochastik für die Naturwissenschaften, Gruppe Mi",MAT183.2,Exercise Group,N/A,German,MAT 183 Stochastics for Natural Sciences
"Übungen Stochastik für die Naturwissenschaften, Gruppe Fr (Englisch)",MAT183.2,Exercise Group,N/A,English,MAT 183 Stochastics for Natural Sciences
Talks in mathematical physics,MAT074.1,Seminar,N/A,German,MAT 074 Talks in mathematical physics
Seminar über stochastische Prozesse,MAT971.1,Seminar,N/A,German,MAT 971 Seminar on stochastic processes
