Event Name,Event Code,Event Type,Instructor,Course Languages,Component of Module
N/A,N/A,N/A,N/A,N/A,N/A
Virologie,.335_vr,Course,Cornel Fraefel,German,Virology
Anatomy Applied,.345_aa,Lecture with Practical Exercises,Mariusz Pawel Kowalewski,German,Anatomy applied
"Epidemiology, Biostatistics",.355_eb,Course,Paul Torgerson,"German, English","Epidemiology, Biostatistics"
Communication in Challenging Situations,.365_kk,Seminar,Thomas Lutz,German,Communication
"Endocrinology, Metabolism",.370_en,Lecture with Practical Exercises,Michael O. Hottiger,German,"Endocrinology, Metabolism"
"Reproduction, Mammary Gland",.360_gem,Lecture with Practical Exercises,Heinrich Bollwein,German,"Reproduction, Mammary Gland"
"Central Nervous System, Sensory Organs",.350_zsi,Lecture with Practical Exercises,Thomas Lutz,German,"Central Nervous System, Sensory Organs"
Propaedeutics Practically,.375_pro,Exercise Group,Christian Gerspach,German,Propaedeutics Practically
Vetsuisse Clinic Days,.385_kt2,Exercise Group,Thomas Lutz,German,Vetsuisse Clinic Days
Small Animal Anaesthesia: Stand by Duty,1,Practical Training,Simone Katja Ringer,German,Small Animal Anaesthesia: Stand by Duty
Mid-Term-Evaluation,HD_MID,Examination,N/A,English,Mid-Term-Evaluation
Functional Foot Trimming in Cattle,004,Block Course,Karl Nuss,German,Functional Foot Trimming in Cattle
Evidence Based Complementary Medicine,FWB80,Block Course,N/A,German,Evidence Based Complementary Medicine
Vetsuisse Farm Animal Evening,70,Course,Christian Gerspach,German,Vetsuisse Farm Animal Evening
"Seminar small animal internal medicine, case based presentations",77,Seminar,Toni Glaus,German,"Seminar small animal internal medicine, case based presentations"
Assistance in small animal surgery,78,Exercise Group,Antonio Pozzi,German,Assistance in small animal surgery
in-vitro techniques in animal nutrition,79,Seminar,Annette Liesegang,German,in-vitro techniques in animal nutrition
Colloquium in Pathology,FWB23,Colloquium,Anja Kipar,German,Colloquium in Pathology
Histopathology Seminar Joint Pathology Center,FWB24,Seminar,Anja Kipar,German,Histopathology Seminar Joint Pathology Center
Selected Topics of Food Safety,FWB29,Colloquium,Roger Stephan,German,Selected Topics of Food Safety
Specific Project Discussion at DMMD,FWB34,Colloquium,Michael O. Hottiger,German,Specific Project Discussion at DMMD
Journal Club Diagnostic Imaging,FWB37,Colloquium,Patrick Robert Kircher,German,Journal Club Diagnostic Imaging
Epidemiological Guidance,FWB41,Colloquium,Paul Torgerson,German,Epidemiological Guidance
Literature Seminar: Surgery and Internal Medicine of Exotic Animals,FWB42,Seminar,Jean-Michel Hatt,German,Literature Seminar: Surgery and Internal Medicine of Exotic Animals
Current Topics of Oncology,FWB47,Block Course,Franco Guscetti,German,Current Topics of Oncology
Exotic Animals: Case Reports,FWB51,Colloquium,Jean-Michel Hatt,German,Exotic Animals: Case Reports
Exotics Club,71,Exercise Group,Jean-Michel Hatt,German,Exotics Club
"Practicals, Trainings and Courses",p,Practical Training,Thomas Lutz,German,"Practicals, Trainings and Courses"
Night and Weekend Duties Small Animals,.491_kt,Exercise Group,Alessio Vigani,German,Night Duties and Weekend Duties
Night and Weekend Duties Large Animals,.492_nt,Exercise Group,Christian Gerspach,German,Night Duties and Weekend Duties
Night and Weekend Duties Horses,.493_pf,Exercise Group,N/A,German,Night Duties and Weekend Duties
Rotation Pathology,.510_pat,Exercise Group,Anja Kipar,German,Rotation Pathology
"Rotations Anesthesiology, Diagnostic Imaging, Ophthalmology",.520_cls,Exercise Group,Regula Bettschart-Wolfensberger,German,"Rotations Anesthesiology, Diagnostic Imaging, Ophthalmology"
Rotations Small Animal Clinic,.530_kt,Exercise Group,Jean-Michel Hatt,German,Rotations Small Animal Clinic
Rotations Farm Animal Clinic,.540_nt,Exercise Group,Heinrich Bollwein,German,Rotations Farm Animal Clinic
Rotations Equine Clinic,.550_pf,Exercise Group,Anton Fürst,German,Rotations Equine Clinic
"Rotations Small Animal Clinic, Farm Animal Clinic, Equine Clinic",.572_knp,Exercise Group,Colin Schwarzwald,German,"Rotations Small Animal Clinic, Farm Animal Clinic, Equine Clinic"
"Rotations Farm Animal Clinic, Equine Clinic",.574_np,Exercise Group,Colin Schwarzwald,German,"Rotations Farm Animal Clinic, Equine Clinic"
"Rotations Small Animal Clinic, Equine Clinic",.576_kp,Exercise Group,Colin Schwarzwald,German,"Rotations Small Animal Clinic, Equine Clinic"
"Rotations Small Animal Clinic, Farm Animal Clinic",.578_kn,Exercise Group,Christian Gerspach,German,"Rotations Small Animal Clinic, Farm Animal Clinic"
Journal Club Equine Surgery,FW101,Seminar,Anton Fürst,German,Journal Club Equine Surgery
Book Club Equine Surgery,FW102,Seminar,Jan Kümmerle,German,Book Club Equine Surgery
Field diagnostics - Knowledge transfer,W73,Block Course,Jean-Michel Hatt,German,Field diagnostics - Knowledge Transfer
Introduction to SPSS,W76,Exercise Group,Sonja Sybille Hartnack,English,Introduction to SPSS
Journal Club Anaesthesiology,FW95,Seminar,Simone Katja Ringer,German,Journal Club Anaesthesiology
Book Club Anaesthesiology,FW96,Seminar,Simone Katja Ringer,German,Book Club Anaesthesiology
Journal Club Equine Medicine,FW97,Seminar,Colin Schwarzwald,German,Journal Club Equine Medicine
Book Club Equine Medicine,FW98,Seminar,Colin Schwarzwald,German,Book Club Equine Medicine
Topic Rounds Equine Medicine,FW99,Seminar,Colin Schwarzwald,German,Topic Rounds Equine Medicine
Current Problems in Pharmacology,FWB04,Colloquium,Hanspeter Nägeli,German,Current Problems in Pharmacology
Further Training Seminaries Horses,FWB100,Seminar,Colin Schwarzwald,German,Further Training Seminaries Horses
Journal Club Pathology,FWB103,Seminar,Anja Kipar,German,Journal Club Pathology
Further Training Pathology: Dermatology,FWB104,Seminar,Paula Grest,German,Further Training Pathology: Dermatology
Further Training Pathology: Equine Medicine,FWB107,Seminar,Anja Kipar,German,Further Training Pathology: Equine Medicine
Further Training Pathology: Zoo Animals,FWB108,Seminar,Anja Kipar,German,Further Training Pathology: Zoo Animals
Journal Club Cardiology,FWB111,Colloquium,Toni Glaus,German,Journal Club Cardiology
Specific Project Discussion at DMMD,FWB112,Meeting,Matthias Altmeyer,German,Specific Project Discussion at DMMD
Book Club Oncology,FWB114,Colloquium,Carla Rohrer Bley,German,Book Club Oncology
Current Aspects of Parasitological Research,FWB12,Seminar,Adrian Hehl,German,Current Aspects of Parasitological Research
Further Training: Small Animal Surgery: Morbidity and Mortality Rounds,FWB125,Colloquium,Antonio Pozzi,German,Further Training: Small Animal Surgery: Morbidity and Mortality Rounds
Further Training: Small Animal Surgery and Oncology: Case Discussion,FWB126,Colloquium,Carla Rohrer Bley,German,Further Training: Small Animal Surgery and Oncology: Case Discussion
Further Training: Small Animal Surgery and Radiology: Case Discussion,FWB127,Colloquium,Antonio Pozzi,German,Further Training: Small Animal Surgery and Radiology: Case Discussion
Journal Club Small Animal Surgery,FWB128,Colloquium,Antonio Pozzi,German,Journal Club Small Animal Surgery
Wednesday Seminar on Small Animal Surgery,FWB129,Colloquium,Antonio Pozzi,German,Wednesday Seminar on Small Animal Surgery
Parasitological-Diagnostic Case Discussions,FWB13,Seminar,Manuela Schnyder Gasparoli,German,Parasitological-Diagnostic Case Discussions
Professional ethics in veterinary medicine,FWB134,Seminar,Sonja Sybille Hartnack,German,Professional ethics in veterinary medicine
Intensive review session small animal internal medicine,FWB136,Seminar,Toni Glaus,German,Intensive review session small animal internal medicine
Further Training Parasitology,FWB137,Seminar,Manuela Schnyder Gasparoli,German,Further Training Parasitology
Von der Laborbank zum Pult und zurück ins Labor,FWB138,Seminar,Adrian Hehl,German,From bench to desk and back to the bench
Further Training Seminar: Parasitology,FWB14,Seminar,Adrian Hehl,German,Further Training Seminar: Parasitology
Current Problems in Biochemistry and Molecular Biology (Joint Research Meeting),FWB16,Colloquium,Michael O. Hottiger,German,Current Problems in Biochemistry and Molecular Biology  (Joint Research Meeting)
Literature Seminar on Biochemistry and Molecular Biology,FWB18,Seminar,Michael O. Hottiger,German,Literature Seminar on Biochemistry and Molecular Biology
Virology Seminaries,FWB2,Seminar,Cornel Fraefel,German,Virology Seminaries
"Repair, Recombination, Replication",FWB5,Seminar,Michael O. Hottiger,German,"Repair, Recombination, Replication"
Literature Seminar: Laboratory Medicine and Clinical Research,FWB56,Seminar,Regina Hofmann-Lehmann,German,Literature Seminar: Laboratory Medicine and Clinical Research
Current Problems of Laboratory Medicine and Clinical Research,FWB57,Seminar,Regina Hofmann-Lehmann,German,Current Problems in Laboratory Medicine and Clinical Research
Seminaries on Farm Animals and Reproduction,FWB6,Seminar,Heinrich Bollwein,German,Seminaries on Farm Animals and Reproduction
Literature Colloquium Clinic for Farm Animals,FWB62,Seminar,Ulrich T. Bleul,German,Literature Colloquium Clinic for Farm Animals
Practical Biomedical Research,FWB64,Practical Training,Michael O. Hottiger,German,Practical Biomedical Research
Further Training Pathology: Ophthalmology,FWB85,Seminar,Franco Guscetti,German,Further Training Pathology: Ophthalmology
Journal Club Oncology,FWB88,Colloquium,Carla Rohrer Bley,German,Journal Club Oncology
Seminar in interdisciplinary life science,WB141,Seminar,Michael O. Hottiger,English,Seminar in interdisciplinary life science
"Genetics, General Animal Breeding",.151_kg,Course,Claude Schelling,German,"Genetics, General Animal Breeding"
"Animal Welfare, Animal Ethics, Ethology, Animal Husbandry",.152_tet,Course,Hanno Würbel,German,"Animal Welfare, Animal Ethics, Ethology, Animal Husbandry"
Biochemestry I,.161_bc,Course,Matthias Altmeyer,German,Biochemistry and Molecular Biology II
Molecular Biology II,.161_bm,Course,Michael O. Hottiger,German,Biochemistry and Molecular Biology II
Developmental Biology,.162_eb,Lecture with Practical Exercises,Max Gassmann,German,Developmental Biology
Foundations of Physiology,.164_gp,Lecture with Practical Exercises,Max Gassmann,German,Foundations of Physiology
"Clinical Activities, External Clinic Day",.170_kt,Practical Training,Anton Fürst,German,"Clinical Activities, External Clinic Day"
"Bacteriology, Mycology II",.240_bm,Lecture with Practical Exercises,Sophia Johler-Ilic,German,"Bacteriology, Mycology"
Immunology,.251_im,Course,Nicole Borel,German,"Immunology, Pathology"
"Pathology, Immunopathology",.252_pa,Lecture with Practical Exercises,Anja Kipar,German,"Immunology, Pathology"
"Metabolism, Intermediary Metabolism, Water-Soluble Vitamins",.260_bc,Course,Michael O. Hottiger,German,Biochemistry II
Heart,.271_hz,Lecture with Practical Exercises,Thomas Lutz,German,"Heart, Circulatory System, Respiratory System"
Respiratory System,.273_rsp,Lecture with Practical Exercises,Christian Gerspach,German,"Heart, Circulatory System, Respiratory System"
"Skin, Thermoregulation",.280_ht,Lecture with Practical Exercises,Hanspeter Nägeli,German,"Skin, Thermoregulation"
Parasiitology I,.285_p1,Lecture with Practical Exercises,Manuela Schnyder Gasparoli,German,Parasitology
Vetsuisse Clinic Days,.290_kt,Practical Training,N/A,German,Vetsuisse Clinic Days
Communication Basis,.295_km,Seminar,N/A,German,Kommunication Basis
Endocrinology,.462_end,Course,Felicitas Sigrun Boretti Schär,German,Endocrinology
"Prophylactic Measures, Herd Health, Swine Medicine",.470_pr,Lecture with Practical Exercises,Heinrich Bollwein,German,"Prophylactic Measures, Herd Health, Swine Medicine"
Acute Abdomen,.481_aa,Tutorial,Hanspeter Nägeli,German,"Chief Complaints: Acute Abdomen, Lameness, Performance Weakness, Ataxia/"
Lameness,.482_lf,Tutorial,Antonio Pozzi,"German, English","Chief Complaints: Acute Abdomen, Lameness, Performance Weakness, Ataxia/"
Performance Weakness,.483_sw,Tutorial,Toni Glaus,German,"Chief Complaints: Acute Abdomen, Lameness, Performance Weakness, Ataxia/"
Ataxia / Seizure Disorders,Ataxia,Tutorial,Christian Gerspach,German,"Chief Complaints: Acute Abdomen, Lameness, Performance Weakness, Ataxia/"
Polyuria / Polydipsia,Polyuria,Tutorial,Felicitas Sigrun Boretti Schär,German,"Chief Complaints: Acute Abdomen, Lameness, Performance Weakness, Ataxia/"
Pruritus / Alopecia,Pruritus,Tutorial,Claude Favrot,German,"Chief Complaints: Acute Abdomen, Lameness, Performance Weakness, Ataxia/"
Focus Small Animals,.494_skt,Block Course,Jean-Michel Hatt,"German, English",Focus Small Animals
Focus Farm Animals,.495_snt,Block Course,Heinrich Bollwein,German,Focus Farm Animals
Focus Horses,.496_spf,Block Course,Heinrich Bollwein,German,Focus Horses
"Laboratory, career profiles",.498_1lb,Block Course,Max Gassmann,German,Introduction in focus pathobiology and veterinary public health
"Basics of animal disease diagnostics, laboratory work, animal nutrition",.498_2lt,Block Course,Annette Liesegang,German,Introduction in focus pathobiology and veterinary public health
"Basics in laboratory methods, data analysis",.498_3ld,Block Course,Roger Stephan,German,Introduction in focus pathobiology and veterinary public health
Veterinary research and diagnostic topics,.498_4fd,Block Course,Brigitta Wichert Gruber,German,Introduction in focus pathobiology and veterinary public health
Focus Biomedical Research,.499_bmf,Block Course,Thorsten Buch,"German, English",Focus Biomedical Research
Master Thesis,.500_ma,Student Work,N/A,German,Master Thesis
Specific Project Discussion at DMMD,FWB105,Colloquium,Raffaella Santoro,German,Specific Project Discussion at DMMD
FTVT-Course,FWB81,Exercise Group,Dolf Kümmerlen,German,FTVT-Course
CABMM Scientific Seminar,FWB82,Exercise Group,N/A,German,CABMM Scientific Seminar
Further Training Pathology: Oncology,FWB86,Seminar,Franco Guscetti,German,Further Training Pathology: Oncology
Further Training Pathology: Internal Medicine of Domestic Animals,FWB87,Seminar,Franco Guscetti,German,Further Training Pathology: Internal Medicine of Domestic Animals
Foundations of Anatomy,.163_ga,Lecture with Practical Exercises,Mariusz Pawel Kowalewski,German,Foundations of Anatomy
Mantelstudium: Gesundheitserfahrungen interprofessionell,22MAS012,Course,Nikola Biller-Andorno,German,Elective Module: Health Experiences Interprofessional
Literature Seminar on Small Animal Reproction,FWB94,Seminar,Sebastian Patrick Arlt,German,Literature Seminar on Small Animal Reproduction
"""Digital History"" - neue Methoden für die Geschichtswissenschaft? (Fortsetzung aus HS23)",600-001a,Seminar,N/A,German,Methods and Theories
"Lordship, kingship and empire in the central middle ages (Fortsetzung aus HS23)",600-001a,Seminar,N/A,English,Methods and Theories
Ganz oben. Top wealth and the 1% in Switzerland since 1890 (Fortsetzung aus HS23),600-601a,Seminar,N/A,German,Social History and Economic History of the Modern World
Dienst und Care im Spätmittelalter (Fortsetzung aus HS23),600-512a,Seminar,N/A,German,Politics and Societies in the Medieval Period
History Writing and the Anthropocene: Earth Archives and Deep Pasts (Fortsetzung aus,600-516a,Seminar,N/A,German,Methods and Theories
Islands of History: Hawai‘i as Method (Fortsetzung aus HS23),600-516a,Seminar,N/A,German,Methods and Theories
Imperien: Politik und Gesellschaft von den Persern bis zu den Arabern (Fortsetzung aus,602-501a,Seminar,Felix Klaus Maier,German,Politics and Societies in the Ancient World
"Kolloquium für anwendungsorientierte, gynäkologische Forschung",GYN23001,Seminar,Manuel Stucki,German,"Kolloquium für anwendungsorientierte, gynäkologische Forschung"
Modernchinesisch: Schrift und Schreiben (Intensivkurs),280-011b,Language Course,Xiaobin Hu,Chinese,Modern Chinese: Script and Writing
Dis/abled. Behinderung in der Moderne (Seminar mit begleitetem Forschungsprozess):,HS23600-023a,Seminar,Marietta Meier,German,Modern History 9
Soziologische Theorie (Teil 2),240-002a,Course,Jörg Rössel,German,Sociological Theory
(Wiederholungsprüfung) Soziologische Theorie,240-002a,Examination,Jörg Rössel,German,Sociological Theory
"Forschungsseminar Lebenslauf und Generationen (Teil 2, Fortsetzung aus HS23)",240-502a,Seminar,Marc Szydlik,German,Research Seminar Life Course and Generations
Masterprüfung,GEO512.1,Student Work,Christian Berndt,German,GEO 512 Master Exam
Übungen Gesellschaftliche und natürliche Ressourcen: Gruppe 1-4,GEO122.2,PHZH SEK I Module,Asebe Regassa Debelo,German,GEO 122 Human Geography II: Societal and natural resources
Geographie der Schweiz,GEO126.1,Lecture with Practical Exercises,Karin Schwiter,German,GEO 126 Geography of Switzerland
"Research Colloquium Space, Nature and Society (for MSc and PhD Students)",GEODIPL,Colloquium,Norman Backhaus,"German, English",GEO 511 Master Thesis
Spatial Algorithms,GEO877.1,Lecture with Practical Exercises,Ross Stuart Purves,English,GEO 877 Spatial Algorithms
Masterprüfung,GEO512.1,Student Work,Christian Berndt,German,GEO 512 Master Exam
Research Colloquium Physical Geography (for MSc and PhD Students),GEODIPL,Colloquium,Michael W.I. Schmidt,German,GEO 511 Master Thesis
Snow and Avalanches: Processes and Risk Management,GEO857.1,Course,N/A,English,GEO 857 Snow and Avalanches: Processes and Risk Management
Introduction to Cartography and Geovisualisation,GEO123.1,Course,Sara Irina Fabrikant,German,GEO 123  Geographic Information Science and Remote Sensing II
The high-mountain cryosphere: processes and risks,GEO856.1,Course,Christian Huggel,English,GEO 856 The high-mountain cryosphere: processes and risks
Colloquium in Remote Sensing,GEO441.1,Colloquium,Alexander Damm-Reiser,English,GEO 441 Remote Sensing A: Seminar
Praktikum Tree-Ring Ecophysiological Research,GEO818.2,Lecture with Practical Exercises,Paolo Cherubini,German,GEO 818 Dendro-Ecology
"Übungen Physische Geographie II, Gruppe 1",GEO121.4,Field Trip,Jan Martin Rudolf Seibert,German,GEO 121 Physical Geography II
"Übungen Physische Geographie II, Gruppe 2",GEO121.4,Field Trip,Jan Martin Rudolf Seibert,German,GEO 121 Physical Geography II
"Übungen Physische Geographie II, Gruppe 3",GEO121.4,Field Trip,Jan Martin Rudolf Seibert,German,GEO 121 Physical Geography II
Grundlagen Boden-Pflanze-Umwelt,GEO241.1,Course,Michael W.I. Schmidt,German,GEO 241 Physical Geography IV
Einführung in die Übungen: Humangeographische Methoden der Datenerhebung,GEO242.1,Course,Karin Schwiter,German,GEO 242 Human Geography IV
International Geochronolgy Summer School,GEODIPL,Block Course,Markus Egli,German,International Geochronolgy Summer School
"Übungen zu Humangeographischen Methoden der Datenerhebung, Gruppe 1",GEO242.2,Exercise Group,Karin Schwiter,German,GEO 242 Human Geography IV
Statistik in der Geographie,GEO246.1,Course,Maarten Eppinga,German,GEO 246 Statistics
"Übungen zur Statistik in der Geographie, Gruppe 1",GEO246.2,Exercise Group,Maarten Eppinga,German,GEO 246 Statistics
"Übungen zur Statistik in der Geographie, Gruppe 2",GEO246.2,Exercise Group,Maarten Eppinga,German,GEO 246 Statistics
"Übungen zur Statistik in der Geographie, Gruppe 3",GEO246.2,Exercise Group,Maarten Eppinga,German,GEO 246 Statistics
Research Colloquium for Geographic Information Science,GEODIPL,Colloquium,Sara Irina Fabrikant,German,GEO 511 Master Thesis
Small Group Teaching,GEO199.1,Seminar,Meredith Christine Schuman,German,GEO 199 Small Group Teaching
Field studies on high mountain processes: Preparatory seminar,GEO411.1,Practical Training,Andreas Vieli,English,GEO 411 Field studies on high mountain processes
Remote Sensing Seminar,GEO441.2,Lecture with Practical Exercises,David Small,English,GEO 441 Remote Sensing A: Seminar
Seminar plant-soil systems in a changing world. Stable isotop in geographical research,GEO820.1,Course,Guido Lars Bruno Wiesenberg,English,GEO 820 Stable isotopes in ecosystem science
Übungen zu Raumanalyse mit GIS; Gruppe 1,GEO243.2,Exercise Group,Robert Weibel,German,GEO 243 Remote Sensing and Geographic Information Science IV
Übungen zu Raumanalyse mit GIS; Gruppe 2,GEO243.2,Exercise Group,Robert Weibel,German,GEO 243 Remote Sensing and Geographic Information Science IV
Übungen zu Raumanalyse mit GIS; Gruppe 3,GEO243.2,Exercise Group,N/A,German,GEO 243 Remote Sensing and Geographic Information Science IV
"Exkursionen Physische Geographie II, Smartphone-Exkursion ""Hydrologie Zürich""",GEO121.3,Field Trip,Jan Martin Rudolf Seibert,German,GEO 121 Physical Geography II
"Exkursionen Physische Geographie II, => ....",GEO121.3,Field Trip,Jan Martin Rudolf Seibert,German,GEO 121 Physical Geography II
Gesellschaftliche und natürliche Ressourcen,GEO122.1,Course,Christian Berndt,German,GEO 122 Human Geography II: Societal and natural resources
Übungen Gesellschaftliche und natürliche Ressourcen: Gruppe 5-8,GEO122.2,PHZH SEK I Module,Asebe Regassa Debelo,German,GEO 122 Human Geography II: Societal and natural resources
"Exercises for Introduction to Cartography and Geovisualisation, Group 1",GEO123.2,Exercise Group,Sara Irina Fabrikant,German,GEO 123  Geographic Information Science and Remote Sensing II
"Exercises for Introduction to Cartography and Geovisualisation, Group 2",GEO123.2,Exercise Group,Sara Irina Fabrikant,German,GEO 123  Geographic Information Science and Remote Sensing II
"Exercises for Introduction to Cartography and Geovisualisation, Group 3",GEO123.2,Exercise Group,Sara Irina Fabrikant,German,GEO 123  Geographic Information Science and Remote Sensing II
Raumanalyse mit GIS,GEO243.1,Course,Robert Weibel,German,GEO 243 Remote Sensing and Geographic Information Science IV
"Übungen zu Humangeographischen Methoden der Datenerhebung, Gruppe 2",GEO242.2,Exercise Group,Karin Schwiter,German,GEO 242 Human Geography IV
"Übungen zu Humangeographischen Methoden der Datenerhebung, Gruppe 3",GEO242.2,Exercise Group,Karin Schwiter,German,GEO 242 Human Geography IV
"Vertiefung Wirtschaftsgeographie: Forschungsseminar, Gruppe 1",GEO362.1,Exercise Group,Xavier Balaguer Rasillo,German,GEO 362 Advanced Economic Geography
Bachelor-Arbeit,GEO386.1,Student Work,Christian Berndt,German,GEO 386 Bachelor Thesis
Forschungsforum Biogeochemistry and Landscape Dynamics (für Doktorierende),GEODIPL,Seminar,Michael W.I. Schmidt,German,Research Forum on Soil Science (for PhD)
Research Colloquium Economic Geography (for MSc and PhD Students),GEODIPL,Colloquium,Christian Berndt,"German, English",GEO 511 Master Thesis
Macugnaga Exkursion,GEO705.1,Field Trip,Christian Huggel,German,GEO 705 Macugnaga Excursion
"Hydrologie, Klima und Atmosphäre",GEO121.1,Lecture with Practical Exercises,Jan Martin Rudolf Seibert,German,GEO 121 Physical Geography II
Besprechung zu den Übungen und Exkursionen zu Physischen Geographie II,GEO121.4,Field Trip,Jan Martin Rudolf Seibert,German,GEO 121 Physical Geography II
"Übungen zu Humangeographischen Methoden der Datenerhebung, Gruppe 4",GEO242.2,Exercise Group,Karin Schwiter,German,GEO 242 Human Geography IV
Urban Geography: Research and Methods,GEO422.1,Seminar,Hanna Hilbrandt,"German, English",GEO 422 Urban Geography: Research and Methods
Computational Movement Analysis – Detecting Patterns and Trends in Environmental Data,GEO880.1,Lecture with Practical Exercises,Patrick Laube,English,GEO 880 Computational Movement Analysis – Detecting Patterns and Trends in
Selbstorganisiertes Seminar,GEO838.1,Seminar,Asebe Regassa Debelo,"German, English",GEO 838 Self-organised Seminar
Remote Sensing of Water Systems,GEO374.1,Lecture with Practical Exercises,Alexander Damm-Reiser,"German, English",GEO 374 Remote Sensing and Geographic Information Science V (Remote Sensing of
Uebungen zu Grundlagen Boden-Pflanze-Umwelt; Gruppe 4,GEO241.2,Exercise Group,Michael W.I. Schmidt,German,GEO 241 Physical Geography IV
"GGP.S460 Welt im Wandel, Vertiefung I Geographie, Gruppe A",GEO904.1,PHZH SEK I Module,Holger Rudolf Frey,German,"GGP.S460 A Changing World, Consolidation I in Geography"
Global Economic Geographies of Agriculture and Food Systems,GEO433.1,Seminar,Christian Berndt,English,GEO 433 Global Economic Geographies of Agriculture and Food Systems
Advanced Spatial Analysis II,GEO881.1,Lecture with Practical Exercises,Cheng Fu,English,GEO 881 Advanced Spatial Analysis II
Land Change Science,ESS246.1,Course,Maria J. Santos,English,ESS 246 Land Change Science
Remote Sensing of the Atmosphere,ESS367.1,Lecture with Practical Exercises,Gerrit Kuhlmann,"German, English",ESS 367 Remote Sensing of the Atmosphere
Earth System Science Field Course: Val Piora,ESS244.1,Field Trip,Maria J. Santos,German,ESS 244 Earth System Science Field Course
"GGP.S460 Welt im Wandel, Vertiefung I Geographie, Gruppe B",GEO904.1,PHZH SEK I Module,Holger Rudolf Frey,German,"GGP.S460 A Changing World, Consolidation I in Geography"
GEO 511 Masterarbeit,GEO511.1,Student Work,Christian Berndt,German,GEO 511 Master Thesis
Dynamische Erde II,ESS121.1,Lecture with Practical Exercises,N/A,German,ESS 121 Dynamic Earth II (with Exercise)
Dynamische Erde II; Übungen Gruppe 1,ESS121.2,Exercise Group,N/A,German,ESS 121 Dynamic Earth II (with Exercise)
Dynamische Erde II; Übungen Gruppe 2,ESS121.2,Exercise Group,N/A,German,ESS 121 Dynamic Earth II (with Exercise)
Dynamische Erde II; Übungen Gruppe 3,ESS121.2,Exercise Group,N/A,German,ESS 121 Dynamic Earth II (with Exercise)
Geologie der Schweiz,ESS122.1,Course,N/A,German,ESS 122 Geology of Switzerland
Geologische Exkursionen,ESS123.1,Practical Training,N/A,German,ESS 123 Field Trips Within the Lecture Dynamic Earth
Geologischer Feldkurs I,ESS129.1,Block Course,N/A,German,ESS 129 Geological Field Course I
Sedimentologie und Stratigraphie,ESS241.1,Lecture with Practical Exercises,N/A,German,ESS 241 Sedimentology and Stratigraphie
Paläontologie,ESS361.1,Lecture with Practical Exercises,N/A,German,ESS 361 Palaeontology
