Event Name,Event Code,Event Type,Instructor,Course Languages,Component of Module,Weekday,Daytime,Start Time,End Time
Grosse schriftliche Arbeit griechische Linguistik,321j012a,Independent Study,Florian Sommer,German,"Term Paper (Long, Greek Linguistics)",N/A,N/A,N/A,N/A
Psychotherapeutische Methoden im Vergleich: Praxisorientiertes Seminar,200j705m,Seminar,Ursula Galli-Michaletz,German,"Psychotherapeutic methods: models, discussions, therapeutic factors",Thursday,Afternoon,12,13
Anhaltende Trauerstörung und Anpassungsstörungen – neue Forschungs- und,tze200j705n,Seminar,Anais Aeschlimann,German,Prolonged grief disorder and adjustment disorders - new research and therapeutic,Monday,Morning,10,12
Digital Mental Health – Informationstechnologie in der psychosozialen Versorgung,200j705p,Seminar,Markus Wolf,German,Digital Mental Health – Information technology in mental health care,Thursday,Afternoon,12,13
Gehirn-Verhalten-Assoziationen im Kontext gesunden Alterns,200j706b,Seminar,"Pascal Frédéric Deschwanden, Susan Mérillat",German,Gehirn-Verhalten-Assoziationen im Kontext gesunden Alterns,Thursday,Afternoon,12,13
The Psychology of Pleasure: An Overview of Empirical Research From Different Fields of,Psychology200j706e,Seminar,Katharina Bernecker,English,The Psychology of Pleasure: An Overview of Empirical Research From Different Fields,Monday,Afternoon,14,15
Selbstführung: Kernkompetenz für Erfolg im Beruf,200j706f,Seminar,Andreja Wirz,German,Self-Leadership,Friday,Morning,9,12
MHealth: Gesundheit mit mobiler Technologie verändern,200j706g,Seminar,Pascal Marcel Küng,German,MHealth: Gesundheit mit mobiler Technologie verändern,Monday,Afternoon,14,15
Einführung in das Studium der Klassischen Philologie,323-001a,Exercise Group,Ulrich Eigler,German,Introduction to Studying Classics,Tuesday,Afternoon,14,15
Lateinische Sprachübungen I,323-002a,Exercise Group,Christian Utzinger,German,Latin Prose Composition I,Tuesday,Morning,10,12
Kleine schriftliche Arbeit griechische Linguistik,321j013a,Independent Study,Florian Sommer,German,"Term Paper (Short, Greek Linguistics)",N/A,N/A,N/A,N/A
DNA Next Generation Sequencing – from theory to practice,BIO680,Lecture with Practical Exercises,"Anna Bratus-Neuenschwander, Maria Domenica Moccia, Lennart Opitz, Weihong Qi, Ralph Schlapbach",English,BIO 680 DNA Next Generation Sequencing – from theory to practice,Monday,Morning,9,17
Augustinus: De civitate Dei,321j016a,Colloquium,"Felix Klaus Maier, Stefan Krauter",German,Colloquium Antiquity and Christianity,Friday,Morning,10,12
Forschungskolloquium,321j501a,Colloquium,"Carmen Cardelle, Ulrich Eigler",German,Research Colloquium,Monday,Afternoon,12,13
Griechische Sprachkompetenzprüfung für das Lehrdiplom,321j502a,Independent Study,Gunther Martin,German,Greek Language Skills for the Teaching Diploma,N/A,N/A,N/A,N/A
Wasser in der griechischen und römischen Antike,322-001a,Exercise Group,Ruth E. Harder,German,Basic Knowledge of Ancient Studies,Friday,Afternoon,16,18
Grundlagenlektüre Altertumswissenschaften,322-002a,Independent Study,Andreas Victor Walser,German,Basic Modern Readings in Ancient Studies,N/A,N/A,N/A,N/A
Grosse Ba-Seminararbeit,322-003a,Independent Study,Andreas Victor Walser,German,"Term Paper (Long, BA Seminar)",N/A,N/A,N/A,N/A
Kleine Ba-Seminararbeit,322-004a,Independent Study,Andreas Victor Walser,German,"Term Paper (Short, BA Seminar)",N/A,N/A,N/A,N/A
Klassisches Ägyptisch I,322-005a,Language Course,Hanna Jenni,German,Classical Egyptian I,Tuesday,Afternoon,14,15
Masterarbeit,322-MAa,Student Work,N/A,German,Master's Thesis,N/A,N/A,N/A,N/A
Transition vom Bildungssystem in den Arbeitsmarkt in Japan,290j714a,Seminar,"David Chiavacci, Nora Gilgen","German, English",Transition from School to Work in Japan,Wednesday,Morning,10,12
Praktikum,290j715a,Practical Training,David Chiavacci,German,Traineeship,N/A,N/A,N/A,N/A
Umfassendes Praktikum,290j716a,Practical Training,David Chiavacci,German,Comprehensive Traineeship,N/A,N/A,N/A,N/A
Grundlagen der Islamwissenschaft,306-001a,Exercise Group,Dominik Patrick Folger,German,Introduction to Islamic Studies,Monday,Morning,10,12
Arabisch 1,306-002a,Language Course,Natalia Bachour,"German, Arabic",Arabic 1,Wednesday,Morning,8,9
Arabisch 1: Tutorat,306-002a,Tutorial,Natalia Bachour,"German, Arabic",Arabic 1,Monday,Afternoon,14,15
Arabisch 3,306-004a,Language Course,Natalia Bachour,"German, Arabic",Arabic 3,Wednesday,Morning,10,12
Arabisch 3: Tutorat,306-004a,Tutorial,Natalia Bachour,"German, Arabic",Arabic 3,Tuesday,Afternoon,14,15
Arabisch 3: Tutorat Konversation,306-004b,Tutorial,N/A,"German, Arabic",Arabic 3,N/A,N/A,N/A,N/A
Advanced Readings in Arabic Texts,306-007a,Exercise Group,James Weaver,English,Advanced Readings in Arabic Texts,Thursday,Morning,10,12
Persisch 1,306-008a,Language Course,Hamid Hosravi,"German, Other",Persian 1,Monday,Afternoon,12,13
Persisch 1: Tutorat,306-008a,Tutorial,Hamid Hosravi,German,Persian 1,Tuesday,Morning,10,12
Lektüre moderner persischer Texte,306-010a,Exercise Group,Hamid Hosravi,German,Readings in Modern Persian Texts,Wednesday,Morning,10,12
Lektüre klassischer persischer Texte,306-011a,Exercise Group,Hamid Hosravi,German,Readings in Classical Persian Texts,Monday,Morning,10,12
Einführung: Geschichte der islamischen Welt bis 1800,306-100a,Course,Rebecca Sauer,German,History of the Islamic World to ca. 1800,Thursday,Afternoon,16,18
Thematische Ausarbeitung Geschichte (Seminararbeit),306-102a,Independent Study,"Bettina Dennerlein, Rebecca Sauer",German,Thematic Focus in History (Seminar Paper),N/A,N/A,N/A,N/A
Current trends in progressive schools and classrooms,222psc,Seminar,N/A,English,Current trends in progressive schools and classrooms,N/A,N/A,N/A,N/A
Praxis der psychologischen Gutachtenerstellung,200j706h,Seminar,Alexander Georg Stahlmann,German,The practice of psychological reporting,Wednesday,Afternoon,12,13
Kompetenztrainings bei Kindern/Jugendlichen und Paaren/Familien,200j706k,Seminar,Corinne Bodenmann-Kehl,German,Kompetenztrainings bei Kindern/Jugendlichen und Paaren/Familien,Thursday,Morning,8,9
Kognitive Verhaltenstherapie bei ausgewählten Störungsbildern,200j706l,Seminar,Ulrike Maria Barbara Ehlert,German,Cognitive Behavior Therapy: interventions for selected mental disorders,Thursday,Morning,10,12
Trauma-fokussierte kognitiv-behaviorale Therapie bei Kindern und Jugendlichen,200j706m,Seminar,Lasse Bartels,German,Trauma-focussed cognitive-behavioral therapy for children and adolescents,Wednesday,Afternoon,12,13
Fallbezogenes Lernen in der Psychopathologie - Gruppe 1,200j706n,Seminar,"Birgit Kleim, Stephanie Andrea Homan",German,Fallbezogenes Lernen in der Psychopathologie,Tuesday,Afternoon,16,17
"Schriftliche Arbeit zum Proseminar ""Händels Oratorien: Zwischen Bibel und",760j012a,Independent Study,Esma Cerkovnik,German,"Schriftliche Arbeit zum Proseminar ""Händels Oratorien: Zwischen Bibel und",N/A,N/A,N/A,N/A
"Schriftliche Arbeit zum Proseminar ""Die Geschichte der Messe: Vom Mittelalter bis zur",760j013a,Independent Study,N/A,German,"Schriftliche Arbeit zum Proseminar ""Die Geschichte der Messe: Vom Mittelalter bis zur",N/A,N/A,N/A,N/A
Guillaume Dufay,760j014a,Seminar,Laurenz Lütteken,German,Guillaume Dufay,Thursday,Afternoon,14,15
Die Chormusik von Johannes Brahms,760j015a,Seminar,Inga Mai Groote,German,Die Chormusik von Johannes Brahms,Tuesday,Afternoon,16,18
Giuseppe Verdi,760j016a,Course,Laurenz Lütteken,German,Giuseppe Verdi,Thursday,Morning,10,12
"Musik im 17. Jahrhundert: Hören, Lesen, Denken",760j017a,Course,Inga Mai Groote,German,"Musik im 17. Jahrhundert: Hören, Lesen, Denken",Wednesday,Morning,10,12
Fachwissen Islamwissenschaft im Überblick (Ma-Prüfung),306-801a,Independent Study,"Bettina Dennerlein, Rebecca Sauer",German,Advanced Survey of Islamic Studies (Ma- Exam),N/A,N/A,N/A,N/A
Bachelorarbeit,306-BAa,Student Work,N/A,German,Bachelor's Thesis,N/A,N/A,N/A,N/A
Masterarbeit,306-MAa,Student Work,N/A,German,Master's Thesis,N/A,N/A,N/A,N/A
Thematische Ausarbeitung Religion (Seminararbeit),306-202a,Independent Study,"Bettina Dennerlein, Rebecca Sauer",German,Thematic Focus in Religion (Seminar Paper),N/A,N/A,N/A,N/A
Thematische Ausarbeitung Kultur (Seminararbeit),306-302a,Independent Study,"Bettina Dennerlein, Rebecca Sauer",German,Thematic Focus in Culture (Seminar Paper),N/A,N/A,N/A,N/A
Der frühe Islam in der (post)modernen Rezeption,306-700a,Seminar,Rebecca Sauer,German,Traditions of Knowledge,Tuesday,Afternoon,14,15
Applied RNA Methodology,BIO446,Block Course,N/A,English,BIO 446 Applied RNA Methodology,N/A,N/A,N/A,N/A
Individuelle Projektarbeit Literaturen und ihre Sprachen,322-502a,Independent Study,N/A,German,Individual Project Work on Literatures and their Languages,N/A,N/A,N/A,N/A
Individuelle Projektarbeit historische Ereignisse und Entwicklungen,322-501a,Independent Study,N/A,German,Individual Project Work on Historic Events and Developments,N/A,N/A,N/A,N/A
Individuelle Projektarbeit materielle Kulturen,322-503a,Independent Study,N/A,German,Individual Project Work on Material Cultures,N/A,N/A,N/A,N/A
Vertiefungslektüre Altertumswissenschaften,322-504a,Independent Study,Andreas Victor Walser,German,Advanced Modern Readings in Ancient Studies,N/A,N/A,N/A,N/A
Fallbezogenes Lernen in der Psychopathologie - Gruppe 2,200j706n,Seminar,"Birgit Kleim, Johannes Simon Vetter",German,Fallbezogenes Lernen in der Psychopathologie,Tuesday,Afternoon,16,17
Transdiagnostische Interventionen in der Psychotherapie,200j706o,Seminar,Tanja Roth,German,Transdiagnostic Interventions in Psychotherapy,Monday,Morning,10,12
Psychotherapie und klinisch-psychologis. Interventionen in spezifischen Formaten und für,Zielgruppen200j706p,Seminar,Marie Drüge,German,Psychotherapy and interventions of clinical psychology delivered in specific formats,Wednesday,Afternoon,12,13
Multilevel models for longitudinal data,200j800h,Seminar,Zachary Joseph Roman,English,Multilevel models for longitudinal data,Tuesday,Afternoon,12,13
Psychometrische Analyse von psychologischen Tests mit dem Rasch- Modell - mit prakt.,R200j800j,Seminar,Carolina Saskia Fellinghauer,German,Psychometric analysis of psychological tests with the Rasch model – with practical,Monday,Morning,10,12
Dyadische Datenanalyse,200j800x,Seminar,Katharina Weitkamp,German,Dyadische Datenanalyse,Thursday,Afternoon,14,15
Persische Konversation für Fortgeschrittene,306j046a,Exercise Group,Hamid Hosravi,"German, Other",Advanced Persian Conversation,Monday,Afternoon,14,15
Grundlagen der Indologie,330-001a,Seminar,"Angelika Malinar, Nicolas Emilio Martin, Friederike Grenner, Annemarie Mertens-Dietrich",German,Introduction to Indian Studies,Wednesday,Afternoon,14,15
Hindi-Sprachkurs I,330-002a,Language Course,Friederike Grenner,German,Hindi Language Course I,Monday,Morning,10,12
Hindi-Sprachkurs I: Tutorat,330-002a,Tutorial,Sebastian Samuel Meier,German,Hindi Language Course I,Tuesday,Afternoon,16,18
"Der Roman Ret Samādhi („Ein Grab aus Sand"") von Geetanjali Shree",330-007a,Exercise Group,Friederike Grenner,German,Hindi Readings: Novels,Monday,Afternoon,14,15
Sanskrit-Sprachkurs I,330-008a,Language Course,Annemarie Mertens-Dietrich,German,Sanskrit Language Course I,Monday,Afternoon,16,18
Sanskrit-Sprachkurs I: Tutorat,330-008a,Tutorial,Annemarie Mertens-Dietrich,German,Sanskrit Language Course I,N/A,N/A,N/A,N/A
Die Śakuntalā-Geschichte,330-011a,Exercise Group,Annemarie Mertens-Dietrich,German,Sanskrit Readings: Epic Literature,Monday,Afternoon,14,15
Geschichte Indiens (bis 1800),330-050a,Course,Angelika Malinar,German,History of India / South Asia,Wednesday,Afternoon,12,13
Indische Religionen in der Praxis,330-054a,Seminar,Annemarie Mertens-Dietrich,German,Indian Religions in Practice,Tuesday,Afternoon,14,15
Caste in Contemporary India,330-251a,Seminar,Nicolas Emilio Martin,English,Social Transformation in Modern South Asia,Thursday,Afternoon,14,15
Forschungskompetenz Philologische Vertiefung I (Seminararbeit),330-505a,Independent Study,Angelika Malinar,German,Research Methods in Philology I (Seminar Paper),N/A,N/A,N/A,N/A
Forschungskompetenz Philologische Vertiefung II (Seminararbeit),330-506a,Independent Study,Angelika Malinar,German,Research Methods in Philology II (Seminar Paper),N/A,N/A,N/A,N/A
Forschungskompetenz Kultur I (Seminararbeit),330-507a,Independent Study,Angelika Malinar,German,Research Methods in Cultural Studies I (Seminar Paper),N/A,N/A,N/A,N/A
Forschungskompetenz Kultur II (Seminararbeit),330-508a,Independent Study,Angelika Malinar,German,Research Methods in Cultural Studies II (Seminar Paper),N/A,N/A,N/A,N/A
Forschungskompetenz Gesellschaft I (Seminararbeit),330-509a,Independent Study,Nicolas Emilio Martin,German,Research Methods in Social Sciences I (Seminar Paper),N/A,N/A,N/A,N/A
Get R_eady: Introduction to Data Analysis for Empirical Research,GETR,Course,"Ulrike Held, Monika Karin Hebeisen, Stefania Iaquinto",English,Get R_eady: Introduction to Data Analysis for Empirical Research,Thursday,Afternoon,14,17
Get R_eady: Dynamic Reporting &amp; Reproducibility in Research,GETR_2,Block Course,"Ulrike Held, Monika Karin Hebeisen",English,Get R_eady: Dynamic Reporting &amp; Reproducibility in Research,Thursday,Afternoon,14,17
Forschungskompetenz Gesellschaft II (Seminararbeit),330-510a,Independent Study,Nicolas Emilio Martin,German,Research Methods in Social Sciences II (Seminar Paper),N/A,N/A,N/A,N/A
Fachwissen Indologie im Überblick (Ma- Prüfung),330-801a,Independent Study,"Angelika Malinar, Nicolas Emilio Martin",German,Advanced Survey of Indian Studies (Ma- Exam),N/A,N/A,N/A,N/A
Einführung in die Neuere deutsche Literaturwissenschaft,360-104a,Course,"Daniel Müller Nielaba, Philipp Theisohn",German,Introduction to Modern German Literature,Friday,Morning,10,12
Ältere deutsche Literatur - Grundlagen und Methoden (Seminar 1),360-109a,Seminar,Jana Sophia Bersorger,German,Medieval and Early Modern German Literature - Basics and Methods,Wednesday,Afternoon,14,15
Ältere deutsche Literatur - Grundlagen und Methoden (Seminar 2),360-109a,Seminar,Thomas Martin Wismer,German,Medieval and Early Modern German Literature - Basics and Methods,Tuesday,Morning,10,12
Ältere deutsche Literatur - Grundlagen und Methoden (Seminar 4),360-109a,Seminar,Kathia Kohler,German,Medieval and Early Modern German Literature - Basics and Methods,Thursday,Morning,10,12
Literatur der Nacht,360-118a,Seminar,Mireille Schnyder,German,Medieval and Early Modern German Literature – Readings and Interpretations B,Tuesday,Afternoon,14,15
Literaturgeschichte der skandinavischen Moderne,360-201a,Seminar,Patrizia Huber,German,Modern Scandinavia: Literary and Cultural History,Tuesday,Morning,10,12
Queere Maskulinität(en),360-209a,Seminar,Sotirios Kimon Mouzakis,German,Modern Scandinavian Literature,Tuesday,Afternoon,16,18
Übung Niederländisch 1,360-303a,Exercise Group,Patrick Lennart Willebrord Schetters,"German, Dutch",Introduction to Dutch Linguistics,Friday,Afternoon,12,13
Praktikum Indologie,330-802a,Practical Training,Annemarie Mertens-Dietrich,German,Internship Indian Studies,N/A,N/A,N/A,N/A
Bachelorarbeit,330-BAa,Student Work,N/A,German,Bachelor's Thesis,N/A,N/A,N/A,N/A
Masterarbeit,330-MAa,Student Work,N/A,German,Master's Thesis,N/A,N/A,N/A,N/A
Hindi-Konversation in Alltags- und Forschungskontexten,330j021a,Exercise Group,Divyaraj Amiya,German,Hindi Conversation in the Contexts of Everyday Life and Research,Friday,Afternoon,12,13
Get R_eady: Prognostic &amp; Prediction Modeling in Research,GETR_3,Block Course,"Ulrike Held, Manja Elisabeth Deforth",English,Get R_eady: Prognostic &amp; Prediction Modeling in Research,Thursday,Afternoon,14,17
Raumanalysen interdisziplinär: GIS als digitale Methode,GIS,Seminar,"Daniel Ursprung, Eike von Lindern",German,Raumanalysen interdisziplinär: GIS als digitale Methode,Friday,Morning,10,17
Summer School: Changing India,330j260a,Seminar,"Nicolas Emilio Martin, Julien Levesque",English,Summer School: Changing India,N/A,N/A,N/A,N/A
Open Access Basics,OA_1,Block Course,"Melanie Röthlisberger, Regula Dorothea Zwicky",English,Open Access Basics,Thursday,Morning,9,17
Caste and Religion in India: Classical sources and modern interpretations,330j308a,Seminar,Angelika Malinar,English,Caste and Religion in India: Classical sources and modern interpretations,Tuesday,Afternoon,12,13
Making your data FAIR,OD_2,Block Course,"Elisabeth-Christine Gamer, Melanie Röthlisberger, Stefanie Strebel",English,Making your data FAIR,Thursday,Morning,9,17
"Summer School HS23 ""Language""",330j414a,Independent Study,Angelika Malinar,German,"Summer School 2023 ""Language""",N/A,N/A,N/A,N/A
Data Management Planning,OD_3,Block Course,"Elisabeth-Christine Gamer, Melanie Röthlisberger",English,Data Management Planning,Monday,Morning,9,17
Neuroimaging Block Course,BIO644,Seminar,Lars Michels,English,BIO 644 Neuroimaging Block Course,N/A,N/A,N/A,N/A
Kleine schriftliche Arbeit lateinische Linguistik,323j014a,Independent Study,Florian Sommer,German,"Term Paper (Short, Latin Linguistics)",N/A,N/A,N/A,N/A
Die Sprache der Magie: Textualität und Pragmatik lateinischer Fluchtafeln (Seminar,323j015a,Seminar,Florian Sommer,German,Textuality and Pragmatics of Latin Curse Tablets (Seminar Latin Linguistics),Monday,Afternoon,14,15
Lateinische Übersetzungsübungen,323j016a,Exercise Group,Cornelia Ritter Schmalz,German,Translating Class (from Latin),Monday,Afternoon,14,15
Lateinische Sprachkompetenzprüfung für das Lehrdiplom,323j501a,Independent Study,Ulrich Eigler,German,Latin Language Skills for the Teaching Diploma,N/A,N/A,N/A,N/A
Ma-Seminararbeit Mittellatein,324-501a,Independent Study,Carmen Cardelle,German,"Term Paper (Master, Medieval Latin)",N/A,N/A,N/A,N/A
Fachüberblick Altertumswissenschaften,322-505a,Independent Study,N/A,German,Overview of Ancient Studies,N/A,N/A,N/A,N/A
Fachüberblick mit Fokus Literaturen und ihre Sprachen,322-506a,Independent Study,N/A,German,Overview with a Focus on Literatures and their Languages,N/A,N/A,N/A,N/A
Fachüberblick mit Fokus materielle Kulturen,322-507a,Independent Study,N/A,German,Overview with a Focus on Material Cultures,N/A,N/A,N/A,N/A
Fachüberblick mit Fokus historische Ereignisse und Entwicklungen,322-508a,Independent Study,N/A,German,Overview with a Focus on Historic Events and Developments,N/A,N/A,N/A,N/A
Fachüberblick mit Fokus Religionen und philosophische Traditionen,322-509a,Independent Study,N/A,German,Overview with a Focus on Religions and Philosophical Traditions,N/A,N/A,N/A,N/A
Individuelle Projektarbeit Religionen und philos. Traditionen,322-510a,Independent Study,N/A,German,Individual Project Work on Religions and Philos. Traditions,N/A,N/A,N/A,N/A
Das R tsel Mensch in Byzanz: K rper und Seele im byzantinischen Denken,322j001a,Colloquium,Nikolaos Zagklas,German,The Riddle of Man in Byzantium: Body and Soul in Byzantine Thought,Monday,Afternoon,14,15
Königliche Unterweltstexte (Klassisch- ägyptische Lektüre),322j002a,Exercise Group,Barbara Lüscher,German,Royal Netherworld Texts (Classical Egyptian Reading),Tuesday,Morning,11,12
Das Tal der Könige: Ruheplatz (nicht nur) der Pharaonen,322j005a,Exercise Group,Barbara Lüscher,German,The Valley of the Kings: Resting Place (Not Only) of the Pharaohs,Tuesday,Afternoon,12,13
Basic German 1; A1,_D_B_11,Language Course,Zora Maria Naef,German,Basic German 1; A1,Wednesday,Afternoon,12,13
Master Thesis in Paleontology,BIO512,Student Work,"Marcelo R. Sanchez, Catalina Pimiento Hernandez, Christian Klug, Torsten Scheyer, Michael Hautmann, Gabriel Aguirre Fernandez, Jorge Domingo Carrillo Briceno, Elke Schneebeli",English,BIO 512 Master Thesis in Paleontology,N/A,N/A,N/A,N/A
Paleontological Colloquium,BIO571,Colloquium,Torsten Scheyer,English,BIO 571 Paleontological Colloquium,N/A,N/A,N/A,N/A
Illustrations in Natural History,BIO271,Course,Christian Klug,English,BIO 271 Illustrations in Natural History,Monday,Afternoon,16,17
Animal Domestication,BIO280,Course,"Marcelo R. Sanchez, Marcus Clauss",English,BIO 280 Animal Domestication,Tuesday,Morning,10,12
Paleontological Excursions (on weekends),BIO279,Field Trip,"Christian Klug, Torsten Scheyer, Michael Hautmann",English,BIO 279 Paleontological Excursions (on weekends),N/A,N/A,N/A,N/A
Marine Megafauna in deep time,BIO263,Block Course,Catalina Pimiento Hernandez,English,BIO 263 Marine Megafauna in deep time,Tuesday,Afternoon,13,17
Paleobiology and Evolution of Invertebrates,BIO264,Block Course,"Christian Klug, Michael Hautmann",English,BIO 264 Paleobiology and Evolution of Invertebrates,Tuesday,Afternoon,13,17
Paleobiology and Evolution of Vertebrates,BIO267,Block Course,"Marcelo R. Sanchez, Torsten Scheyer",English,BIO 267 Paleobiology and Evolution of Vertebrates,Thursday,Morning,8,17
Eine Einführung in Machine Learning,200j800y,Seminar,Rudolf Georg Debelak,German,An Introduction to Machine Learning,Monday,Afternoon,14,15
Fortgeschrittene Methoden Neuropsychologische Untersuchungsverfahren (EEG),200j800g,Seminar,Marius Franz Tröndle,English,Advanced Methods in Neuroscience (EEG),Tuesday,Afternoon,12,13
Inorganic Chemistry I: Chemistry of d- block elements,CHE201.1,Lecture with Practical Exercises,Felix Hubertus Zelder,German,CHE 201 Inorganic Chemistry I: Chemistry of d-block elements,Wednesday,Morning,8,9
Organic Chemistry I,CHE203.1,Lecture with Practical Exercises,Ilija Coric,English,CHE 203 Organic Chemistry I,Monday,Morning,8,9
Application of Spectroscopic Methods in Chemistry,CHE207.1,Lecture with Practical Exercises,"Laurent Bigler, Thomas Fox, Ulrike Wais",German,CHE 207 Application of Spectroscopic Methods in Chemistry,Monday,Morning,10,12
Additional tutorial for CHE 207,CHE294,Colloquium,"Laurent Bigler, Thomas Fox, Ulrike Wais",German,CHE 294 additional tutorial for CHE 207,Thursday,Afternoon,12,13
Physical Chemistry I: Thermodynamics,CHE205.1,Course,"Jürg Hutter, Stefan Seeger, Sandro Vicente Olveira",German,CHE 205 Physical Chemistry I: Thermodynamics,Tuesday,Morning,8,9
Exercises Physical Chemistry I,CHE205.2,Exercise Group,"Jürg Hutter, Stefan Seeger, Sandro Vicente Olveira","German, English",CHE 205 Physical Chemistry I: Thermodynamics,Friday,Morning,8,8
Practical course in Physical Chemistry,CHE211.1,Practical Training,Jan Helbing,"German, English",CHE 211 Practical course in Physical Chemistry,Thursday,Morning,10,12
Department of Chemistry Seminars,CHE800.1,Seminar,"Nina Hartrampf, Alexandria Deliz Liang",English,CHE 800 Department of Chemistry Seminars,Tuesday,Afternoon,16,17
Research Seminar in Inorganic Chemistry,CHE813.1,Seminar,"Greta R. Patzke, Roland K.O. Sigel, Eva Freisinger Sigel, Jason Philip Holland, Stanley David Tilley, Roger Alberto, Alexandria Deliz Liang, Bernhard Spingler, Felix Hubertus Zelder, Henrik Braband, Michal Mazal Shoshan",English,CHE 813 Research Seminar in Inorganic Chemistry,Monday,Afternoon,16,18
Research Seminar: Current Challenges in Organic Chemistry,CHE814.1,Seminar,"Karl Gademann, Cristina Nevado Blazquez, Pablo Marcelo Rivera Fuentes, Ilija Coric, Nina Hartrampf, Michal Juricek, Laurent Bigler, Oliver Zerbe, Peter Stacko",English,CHE 814 Research Seminar: Current Challenges in Organic Chemistry,Friday,Morning,8,9
Research Seminar in Chemical Biology,CHE815.1,Seminar,Pablo Marcelo Rivera Fuentes,English,CHE 815 Research Seminar in Chemical Biology,Thursday,Afternoon,16,17
Summer School HS23,330j415a,Independent Study,Angelika Malinar,German,Summer School 2023,N/A,N/A,N/A,N/A
Publishing personal and sensitive data,OD_4,Seminar,"Eva Maria Furrer, Melanie Röthlisberger, Stefanie Strebel",English,Publishing personal and sensitive data,Thursday,Afternoon,13,17
Forschungskolloquium,330j705a,Colloquium,"Angelika Malinar, Nicolas Emilio Martin","German, English",Research Colloquium,Tuesday,Afternoon,16,18
Türkisch 2,306-014a,Language Course,Tobias Heinzelmann,German,Turkish 2,Tuesday,Morning,10,12
Türkisch 2: Tutorat,306-014a,Tutorial,Tobias Heinzelmann,German,Turkish 2,Friday,Afternoon,12,13
Vielvölkerreiche am Limit: Osmanisch- russische Begegnungen im kaukasischen,Grenzgebiet306j111a,Seminar,Alexander Erich Balistreri,German,Multi-ethnic Empires at the Limit: Ottoman-Russian Encounters in the Caucasian,Wednesday,Afternoon,16,18
Averroes: The Philosopher vs. the State? Aristotle and the Almohads in the Work of Ibn,Rushd306j710a,Seminar,James Weaver,English,Averroes: The Philosopher vs. the State? Aristotle and the Almohads in the Work of,Tuesday,Morning,10,12
Projektseminar,640-522a,Seminar,Bärbel Küster,German,Project seminar,N/A,N/A,N/A,N/A
Biocatalysis,CHE722.1,Lecture with Practical Exercises,"Karl Gademann, Alexandria Deliz Liang, Rebecca Maria Ursula Buller",English,CHE 722 Biocatalysis,Thursday,Afternoon,15,17
Lateinische Sprachübungen II,323-003a,Exercise Group,Christian Utzinger,German,Latin Prose Composition II,Wednesday,Afternoon,12,13
Proseminararbeit lateinische Literatur,323-005a,Independent Study,Ulrich Eigler,German,"Term Paper (Proseminar, Latin Literature)",N/A,N/A,N/A,N/A
Ba-Seminararbeit lateinische Literatur,323-006a,Independent Study,Fabian Zogg,German,"Term Paper (BA Seminar, Latin Literature)",N/A,N/A,N/A,N/A
Proseminararbeit lateinische Linguistik,323-007a,Independent Study,Florian Sommer,German,"Term Paper (Proseminar, Latin Linguistics)",N/A,N/A,N/A,N/A
Übersetzungskompetenz (Akzess Latein),323-008a,Independent Study,Ulrich Eigler,German,Latin Translation Skills,N/A,N/A,N/A,N/A
Vertiefung lateinische Sprachgeschichte (grosser Aufwand),323-501a,Independent Study,Florian Sommer,German,Special Subject in Latin Linguistics (Increased Workload),N/A,N/A,N/A,N/A
Vertiefung lateinische Sprachgeschichte (mittlerer Aufwand),323-502a,Independent Study,Florian Sommer,German,Special Subject in Latin Linguistics (Moderate Workload),N/A,N/A,N/A,N/A
Lektürekompetenz in lateinischer Literatur,323-503a,Independent Study,Ulrich Eigler,German,Reading Skills in Latin Literature,N/A,N/A,N/A,N/A
