Event Name,Event Code,Event Type,Instructor,Course Languages,Component of Module,Weekday,Daytime,Start Time,End Time
Exercise: methods in the study of religion\s,57LB001,Exercise Group,Dorothea Lüddeckens,German,ERWA: methods in the study of religion\s,Friday,Afternoon,14,15
Methods: Exercises in religio-historical textual analysis and interpretation,57LB002,Exercise Group,Christoph Uehlinger,German,Methods: Exercises in religio-historical textual analysis and interpretation,Friday,Morning,10,12
HVRW Research colloquium: History of religions/Comparative religion,54SF009,Seminar,Christoph Uehlinger,German,HVRW Research colloquium: History of religions/Comparative religion,N/A,N/A,N/A,N/A
Fondamenti di linguistica diacronica e dialettologia (gruppo 1),410-004a,Seminar,Stefano Negrinelli,Italian,Introduction to Diachronic Linguistics and Dialectology,Monday,Afternoon,14,15
"Filmanalyse, Gruppe B",255-001a,Seminar,Jan Sahli,German,Introduction to the Methods in Film Studies,Tuesday,Morning,10,13
"Filmanalyse, Gruppe C",255-001a,Seminar,Till Brockmann,German,Introduction to the Methods in Film Studies,Wednesday,Morning,10,13
"Tutorat, Gruppe A (Durchführung im HS)",255-001a,Tutorial,Jan Sahli,German,Introduction to the Methods in Film Studies,Monday,Afternoon,14,15
"Tutorat, Gruppe B (Durchführung im HS)",255-001a,Tutorial,Jan Sahli,German,Introduction to the Methods in Film Studies,Wednesday,Afternoon,14,15
Einführung in die Methoden der Filmwissenschaft,255-001a,Lecture with Practical Exercises,Jan Sahli,German,Introduction to the Methods in Film Studies,Monday,Afternoon,16,18
"Temi, forme, modi, teorie e storie di letteratura italiana (gruppo 1)",410-006a,Seminar,Tatiana Crivelli Speciale,Italian,Introduction to Textual Analysis and Literary Criticism,Friday,Morning,10,12
Positionen der klassischen Filmtheorie,255-004a,Course,Daniel Johannes Wiegand,German,Concepts in Classical Film Theory,Thursday,Afternoon,16,20
Fachüberblick Filmwissenschaft,255-501a,Independent Study,Fabienne Liptay,German,Film Studies Overview,N/A,N/A,N/A,N/A
Fachüberblick Filmwissenschaft,255-501a,Independent Study,Daniel Johannes Wiegand,German,Film Studies Overview,N/A,N/A,N/A,N/A
Fachüberblick Filmwissenschaft,255-501a,Independent Study,Volker Pantenburg,German,Film Studies Overview,N/A,N/A,N/A,N/A
Fachüberblick Filmwissenschaft,255-501a,Independent Study,Philosophische Fakultät N.N.-Dozent,German,Film Studies Overview,N/A,N/A,N/A,N/A
Bachelorarbeit,255-BAa,Student Work,Fabienne Liptay,German,Bachelor's Thesis,N/A,N/A,N/A,N/A
Bachelorarbeit,255-BAa,Student Work,Daniel Johannes Wiegand,German,Bachelor's Thesis,N/A,N/A,N/A,N/A
Bachelorarbeit,255-BAa,Student Work,Volker Pantenburg,German,Bachelor's Thesis,N/A,N/A,N/A,N/A
Bachelorarbeit,255-BAa,Student Work,Philipp Blum,German,Bachelor's Thesis,N/A,N/A,N/A,N/A
Kolloquium für Masterarbeiten,255-MAa,Colloquium,"Fabienne Liptay, Volker Pantenburg, Daniel Johannes Wiegand, Philosophische Fakultät N.N.-Dozent",German,Master's Thesis,Wednesday,Afternoon,16,18
Der frühe Tonfilm,255j005a,Seminar,Philosophische Fakultät N.N.-Dozent,German,Der frühe Tonfilm,Monday,Morning,10,13
Narrative der Radioaktivität,255j006a,Seminar,Lysa Sibylle Babylonia Constantinides Tank,German,Narrative der Radioaktivität,Wednesday,Morning,10,13
Japan und die Vielfalt der filmischen Kunst: Einblicke in das japanische Kino des 20. und,Jahrhunderts255j007a,Seminar,Nadine Soraya Vafi,German,Japan und die Vielfalt der filmischen Kunst: Einblicke in das japanische Kino des 20.,Monday,Afternoon,14,18
Queeres Kino,255j008a,Seminar,Simone Winkler,German,Queeres Kino,Tuesday,Afternoon,14,18
Exkursion an die Internationalen Kurzfilmtage Winterthur,255j009a,Field Trip,Jan Sahli,German,Exkursion an die Internationalen Kurzfilmtage Winterthur,N/A,N/A,N/A,N/A
Exkursion ans Stummfilmfestival im Filmpodium,255j010a,Field Trip,Daniel Johannes Wiegand,German,Exkursion ans Stummfilmfestival im Filmpodium,N/A,N/A,N/A,N/A
Praktische Filmkritik – Produktion von Video-Essays,255j011a,Exercise Group,Michael Baute,German,Praktische Filmkritik – Produktion von Video-Essays,Friday,Afternoon,15,18
Atelier avec Ursula Meier (Réalisatrice/Scénariste),255j012a,Other,"Matthias Brütsch, Ursula Meier",French,Atelier avec Ursula Meier (Réalisatrice/Scénariste),Friday,Afternoon,14,18
Praktikum extern,255j013a,Practical Training,Milos Lazovic,German,Praktikum extern,N/A,N/A,N/A,N/A
Kino und Animismus,255j014a,Seminar,Jelena Rakin,German,Kino und Animismus,Monday,Afternoon,14,18
Alles fake? Filme zwischen Dokumentar- und Spielfilm,255j015a,Seminar,Philipp Blum,German,Alles fake? Filme zwischen Dokumentar- und Spielfilm,Thursday,Morning,10,13
Kino und Atmung. Von Windmaschinen und anderen kinematografischen Luftnummern,255j016a,Seminar,Linda Waack,German,Kino und Atmung. Von Windmaschinen und anderen kinematografischen Luftnummern,Tuesday,Morning,10,13
Farbe im Film,255j021a,Colloquium,Philosophische Fakultät N.N.-Dozent,German,Farbe im Film,Friday,Morning,10,13
Schmerzphysiologie,Z_KFS3.2,Course,"Michael Meier, Aleksandra Zumbrunn",German,"Individual Examination Bachelor 3.1, theoretical, dental and medical Basics",N/A,N/A,N/A,N/A
Neurophysiologie und Biomechanik des Kausystems,Z_KFS3.3,Course,Vera Colombo,German,"Individual Examination Bachelor 3.1, theoretical, dental and medical Basics",N/A,N/A,N/A,N/A
Myoarthropathien und Orofaziale Schmerzen,ZKFS_M2,Course,"Manuela Brenz, Nenad Lukic, Alexandra Noemi Lüber, Aleksandra Zumbrunn",German,"Individual Examination Master 2.1, theoretical, dental and medical Basics",N/A,N/A,N/A,N/A
Psychologie,ZPSY_M2,Course,"Manuela Brenz, Patrick Meyenberger",German,"Individual Examination Master 2.1, theoretical, dental and medical Basics",N/A,N/A,N/A,N/A
Fondamenti di analisi testuale e critica letteraria (gruppo 1),410-006a,Exercise Group,Elena Maria Moro,Italian,Introduction to Textual Analysis and Literary Criticism,Thursday,Afternoon,12,13
Fondamenti di analisi testuale e critica letteraria (gruppo 2),410-006a,Exercise Group,Tamara Guglielmi,Italian,Introduction to Textual Analysis and Literary Criticism,Thursday,Afternoon,16,18
Masterarbeit,598-MAa,Student Work,N/A,German,Master's Thesis,N/A,N/A,N/A,N/A
Masterarbeit,599-MAa,Student Work,N/A,German,Master's Thesis,N/A,N/A,N/A,N/A
"""Digital History"" - neue Methoden für die Geschichtswissenschaft?",600-001a,Seminar,Christine Natalie Grundig,German,Methods and Theories,Thursday,Afternoon,12,13
"Lordship, kingship and empire in the central middle ages",600-001a,Seminar,Max Lieberman,English,Methods and Theories,Wednesday,Morning,10,12
Allgemeine Didaktik: Lehren und Lernen an Maturitätsschulen,222EinfE,Course,Dominik Petko,German,General Didactics: Teaching and Learning at Upper Secondary Schools,Monday,Afternoon,14,15
Pädagogische Psychologie: Bedingungen und Wirkungen erfolgreichen Lehrens und,Lernens22244m0,Course,Yves Karlen,German,Pädagogische Psychologie: Bedingungen und Wirkungen erfolgreichen Lehrens und,Monday,Afternoon,16,18
"Leistungsmessung und -bewertung: Prüfen, Beurteilen, Bewerten (PBB) / Educational",Measurement22261m0,Course,Doreen Flick-Holtsch,German,Educational Testing and Measurement,Thursday,Afternoon,14,15
Kolloquium für Diplomkandidatinnen und Diplomkandidaten (DK),222DK,Colloquium,"Dominik Petko, Balz Wolfensberger",German,Colloquium for Exam Candidates,Tuesday,Afternoon,16,18
Kolloquium für Diplomkandidatinnen und Diplomkandidaten (DK),222DK-2,Colloquium,"Yves Karlen, Christine Gerloff-Gasser",German,Colloquium for Exam Candidates,Tuesday,Afternoon,16,18
Mündliche Prüfung,600-002a,Independent Study,N/A,German,Oral Exam (Bachelor's),N/A,N/A,N/A,N/A
Bachelorarbeit,600-BAa,Student Work,N/A,German,Bachelor's Thesis,N/A,N/A,N/A,N/A
Masterarbeit,600-MAa,Student Work,N/A,German,Master's Thesis,N/A,N/A,N/A,N/A
"Die athenische Demokratie: Entwicklung, Alltag, Probleme",600-003a,Seminar,Ursula Kunnert,German,Ancient History 1,Thursday,Morning,10,12
Kommunikation im griechischen Hellenismus,600-004a,Seminar,Emanuel Zingg,German,Ancient History 2,Friday,Morning,10,12
Klinischer Kurs in der Diagnostik und Behandlung akuter und chronischer orofazialer,SchmerzenZKFSM2,Exercise Group,"Manuela Brenz, Kathrin Kohout, Nenad Lukic, Lukas Müller, Heiko Thorald Pohl, Gian-Marco Widmer, Aleksandra Zumbrunn",German,Clinical Course in Orofacial Pain,N/A,N/A,N/A,N/A
Storia letteraria dal Seicento alla contemporaneità,410-010a,Exercise Group,Paola Brülisauer-Casella,Italian,Italian Literature: from the Seicento to the Present Day,Thursday,Afternoon,12,13
Nel mondo della ricerca,410-012a,Other,Tatiana Crivelli Speciale,Italian,In the World of Research,N/A,N/A,N/A,N/A
La letteratura concentrazionaria italiana,410-014a,Seminar,Tatiana Crivelli Speciale,Italian,Modern and Contemporary Literature: Texts and Tools,Thursday,Afternoon,12,13
"Competenze integrate in linguistica, gruppo 1",410-501a,Independent Study,Michele Loporcaro,Italian,Integrated Skills in Linguistics,N/A,N/A,N/A,N/A
"Competenze integrate in linguistica, gruppo 2",410-501a,Independent Study,Francesco Gardani,Italian,Integrated Skills in Linguistics,N/A,N/A,N/A,N/A
"Competenze integrate in letteratura, gruppo 1",410-502a,Independent Study,Tatiana Crivelli Speciale,Italian,Integrated Skills in Literature,N/A,N/A,N/A,N/A
"Competenze integrate in letteratura, gruppo 2",410-502a,Independent Study,Johannes Bartuschat,Italian,Integrated Skills in Literature,N/A,N/A,N/A,N/A
Grundlagen des Rechts,IUS_AD27,Colloquium,"José Luis Alonso, Andreas Thier",German,Grundlagen des Rechts. Kolloquium für Doktorierende und Habilitierende,N/A,N/A,N/A,N/A
Qualifikationsarbeit ohne Veranstaltung bei Prof. Dr. Dominik Petko,222QAOVP,Seminar,Dominik Petko,German,Term paper supervised by Prof. Dr. Dominik Petko,N/A,N/A,N/A,N/A
Qualifikationsarbeit ohne Veranstaltung bei Prof. Dr. Sascha Schneider,222QASch,Seminar,Sascha Schneider,German,Qualifikationsarbeit ohne Veranstaltung bei Prof. Dr. Sascha Schneider,N/A,N/A,N/A,N/A
Naturwissenschaftsdidaktische Grundlagen 3: Lehren mit Alltagsvorstellungen,090MAFD1,Seminar,Kai Niebert,German,Principles of Science Education 3: Students Conceptions in Science Education,Tuesday,Evening,18,20
Fachdidaktisches Forschungsseminar,090MAFDF,Seminar,Kai Niebert,German,Research in Science Education,N/A,N/A,N/A,N/A
SWRW research colloquium: Social scientific study of religions,55SF009,Seminar,Dorothea Lüddeckens,German,SWRW Research colloquium: Social- scientific study of religions,N/A,N/A,N/A,N/A
Research colloquium: Systematic- theoretical study of religion\s,53SF009,Seminar,Rafael Walthert,German,STRW Research colloquium: Systematic- theoretical study of religion\s,N/A,N/A,N/A,N/A
Master’s Day 1: Introducing the Master’s Programmes in the Study of Religions,58LM001,Other,"Dorothea Lüddeckens, Christoph Uehlinger, Rafael Walthert",German,Master’s Day 1: Introducing the Master’s Programmes in the Study of Religions,N/A,N/A,N/A,N/A
Block course: Introduction to social- scientific approaches to the study of religion\s,41LM001,Block Course,"Dorothea Lüddeckens, Rafael Walthert",German,Introduction to social-scientific approaches to the study of religion\s,N/A,N/A,N/A,N/A
"Independent study: Hinduism, Zoroastrianism and Buddhism in contemporary societies",41LM003,Independent Study,Dorothea Lüddeckens,German,"Hinduism, Zoroastrianism and Buddhism in contemporary societies",N/A,N/A,N/A,N/A
"Independent study: Judaism, Christianity and Islam in contemporary societies",41LM004,Independent Study,Rafael Walthert,German,"Judaism, Christianity and Islam in contemporary societies",N/A,N/A,N/A,N/A
Independent study: Current theories on society and religion,42LM003,Independent Study,Rafael Walthert,German,Current theories on society and religion,N/A,N/A,N/A,N/A
Independent study: Theories of society and religion in Asia and Middle East,42LM004,Independent Study,Rafael Walthert,German,Theories of society and religion in Asia and Middle East,N/A,N/A,N/A,N/A
Independent study: Debates and challenges in Muslim societies and communities,43LM002,Independent Study,Rafael Walthert,German,Debates and Challenges in Muslim Societies and Communities,N/A,N/A,N/A,N/A
Independent study: Women in Islam,43LM003,Independent Study,Jill Gioia Marxer,German,Women in Islam,N/A,N/A,N/A,N/A
Independent study: Digital religion,43LM004,Independent Study,Jill Gioia Marxer,German,Digital religion,N/A,N/A,N/A,N/A
"From Religious Studies into the Profession, Outside and Inside the University",43LM008,Seminar,Dorothea Lüddeckens,German,"From Religious Studies into the Profession, Outside and Inside the University",Monday,Afternoon,16,18
Blockcourse: Social science Research projects,44LM001,Block Course,Dorothea Lüddeckens,German,Social science Research projects,N/A,N/A,N/A,N/A
"PT Lecture: Digital Religion(s): Methods, Technologies, and Futures",24SV015,Course,Bethany Victoria Lois Singler,English,"Basis Module: Religion, Lecture",Thursday,Afternoon,16,18
Lingua italiana (C2),410-503a,Exercise Group,Paola Brülisauer-Casella,Italian,Italian Language (C2),Thursday,Afternoon,16,19
Contatti con il mondo scientifico,410-504a,Other,Tatiana Crivelli Speciale,Italian,Contacts with the Scientific World,N/A,N/A,N/A,N/A
Stage esteso,410-505a,Practical Training,Tatiana Crivelli Speciale,Italian,Extended Internship,N/A,N/A,N/A,N/A
Stage,410-506a,Practical Training,Tatiana Crivelli Speciale,Italian,Internship,N/A,N/A,N/A,N/A
Tesi di Bachelor,410-BAa,Student Work,N/A,Italian,Bachelor's Thesis,N/A,N/A,N/A,N/A
Tesi di Master,410-MAa,Student Work,N/A,Italian,Master's Thesis,N/A,N/A,N/A,N/A
Mémoire de Bachelor,390-BAa,Student Work,N/A,French,Bachelor's Thesis,N/A,N/A,N/A,N/A
Memoire de Master,390-MAa,Student Work,N/A,French,Master's Thesis,N/A,N/A,N/A,N/A
Operative Bilder in Film und anderen Medien,255j022a,Colloquium,Pascal Dominik Maslon,German,Operative Bilder in Film und anderen Medien,Tuesday,Afternoon,14,15
"Feministische Filmtheorie: Repräsentation, Geschlecht, Affekt",255j023a,Colloquium,Caroline Rahel Schöbi,German,"Feministische Filmtheorie: Repräsentation, Geschlecht, Affekt",Thursday,Morning,10,12
Die Römer am Nil - Ägypten als römische Provinz,600-005a,Seminar,Michael Alexander Speidel,German,Ancient History 3,Monday,Morning,10,12
"Machenschaften, Manöver und Manipulation - das Ende der römischen Republik",600-006a,Seminar,Felix Klaus Maier,German,Ancient History 4,Wednesday,Morning,10,12
Gruppe 01: Eigentum,600-007a,Seminar,"Hannah Catherine Davies, Salome Egloff",German,Introductory Course I,Monday,Morning,10,12
"Gruppe 02: ""Kreuzzüge"" - Die Eroberung ferner Welten",600-007a,Seminar,"Linda Luise Eichenberger, Frank Schubert",German,Introductory Course I,Tuesday,Morning,10,12
"Gruppe 03: Wissen, Politik und Umweltkatastrophen: Globale Perspektiven auf historische",Krisen.600-007a,Seminar,"Jonas Manuel Rüegg, Philip Zimmermann","German, English",Introductory Course I,Tuesday,Afternoon,14,15
"Gruppe 04: Kindheit, Familie und Gesellschaft",600-007a,Seminar,"Sabrina Melanie Vogt, Susanne Weiss",German,Introductory Course I,Thursday,Afternoon,14,15
Gruppe 05: Frauen in der Geschichtsschreibung,600-007a,Seminar,"Nicola Roland Blum, Zanele Ntombikayise Leu","German, English",Introductory Course I,Tuesday,Afternoon,14,15
"Gruppe 06: Lateinamerika: kolonial, imperial, global",600-007a,Seminar,"Olivier Pierre Laurent Keller, Julian Angel Miguez",German,Introductory Course I,Monday,Morning,8,9
Gruppe 07: Alle Macht dem Volk! Oder doch nicht? – Demokratie von der Antike bis in die,Gegenwart600-007a,Seminar,"Jakob Valentin Odenwald, Riccarda Schmid",German,Introductory Course I,Wednesday,Afternoon,14,15
Gruppe 08: Making the Metropolis: Stadtgesellschaften in der Antike und Neuzeit,600-007a,Seminar,"Thomas Franz Wittmann, Nadine Stephanie Zberg",German,Introductory Course I,Monday,Afternoon,14,15
Gruppe 09: Frei- und Unfreiheit,600-007a,Seminar,"Riccardo Enzo Rossi, Luise Henriette Sigron",German,Introductory Course I,Monday,Afternoon,14,15
Gruppe 10: Imperial Frontiers,600-007a,Seminar,"Omar El Manfalouty, Ashoka Vardhan Manchala",English,Introductory Course I,Tuesday,Morning,8,9
Gruppe 11: Diasporagemeinden im Mittelmeerraum,600-007a,Seminar,"Laurent Daniel Marie Burrus, Omar El Manfalouty",German,Introductory Course I,Wednesday,Afternoon,14,15
Gruppe 12: Herrschaft und Wirtschaft,600-007a,Seminar,"Robert Barnea, Niklaus Andreas Remund",German,Introductory Course I,Wednesday,Morning,10,12
Einführungsvorlesung Herbst,600-008a,Course,"Francisca Loetz, Roberto Zaugg",German,Introductory Lecture Fall,Wednesday,Afternoon,16,18
Sociolinguistica dell’italiano,410j036a,Course,Francesco Gardani,Italian,Italian sociolinguistics,Monday,Morning,10,12
All’opera: poesia in forma di libretto,410j030a,Course,Tatiana Crivelli Speciale,Italian,At the Opera: Poetry in the Form of a Libretto,Thursday,Afternoon,14,15
"I carolingi e gli arturiani: cantari, poemi e romanzi cavallereschi",410j031a,Course,Franca Strologo,Italian,Charlemagne and King Arthur: tales of chivalry,Thursday,Morning,10,12
"L'età delle ""guerre d'Italia"": dall'«Innamorato» al «Furioso»",410j032a,Exercise Group,Franca Strologo,Italian,"The Era of the ""Wars of Italy"": From the ""Innamorato"" to ""Furioso""",Tuesday,Afternoon,14,15
L'Italia dialettale prima del Quattrocento. Un'introduzione,410j033a,Course,"Stefano Cristelli, Mario Wild",Italian,The dialects of Italy before 1400. An introduction,Tuesday,Morning,10,12
La poetica: trattati antichi e riflessione moderna,410j034a,Course,Johannes Bartuschat,Italian,Poetics : pre-modern and early-modern treatises and contemporary approaches,Wednesday,Afternoon,12,13
Mappare l'Italoromanzo antico: laboratorio di geolinguistica storica,410j035a,Seminar,"Stefano Cristelli, Mario Wild",Italian,Mapping ancient Italo-Romance: a laboratory of historical geolinguistics,Monday,Afternoon,16,18
La sestina: storia di un genere metrico,410j577a,Seminar,Johannes Bartuschat,Italian,The sestina: history of a metrical form,Thursday,Afternoon,12,13
Partecipazione attiva a congressi,410j576a,Colloquium,Michele Loporcaro,Italian,Taking Part in a Scientific Convention,N/A,N/A,N/A,N/A
Fundamentos de la Narratología (grupo 1),427-001a,Seminar,Adriana Lopez-Labourdette,Spanish,Fundamental Principles of Literary Analysis,Monday,Afternoon,14,15
Fundamentos de la Narratología (grupo 1),427-001a,Seminar,Philosophische Fakultät N.N.-Dozent,Spanish,Fundamental Principles of Literary Analysis,Wednesday,Morning,10,12
Lengua Española (B2),427-003a,Language Course,Maria Carmen Munoz Macia Moll,Spanish,Spanish Language (B2),Tuesday,Morning,11,12
"Análisis Discursivo de Textos Literarios Españoles: prosa, poesía y teatro del siglo XX",427-004a,Seminar,Itziar Lopez Guil,Spanish,Analysis of Spanish Literary Texts,Monday,Afternoon,12,13
Curso Preparatorio para el Examen de Lecturas de Literatura Española,427-006a,Exercise Group,Chiara Licci,Spanish,Readings of Spanish Literature,Wednesday,Afternoon,12,13
Leituras de Literatura em Português,427-008a,Independent Study,Joana Faro Serafim,Portuguese,Readings of Portuguese Literature,N/A,N/A,N/A,N/A
Geographies of Difference,GEO232.1,Course,Hanna Hilbrandt,English,GEO 232 Human Geography III (Geographies of Difference),Tuesday,Afternoon,14,15
Current challenges in plant-soil systems,GEO463.1,Lecture with Practical Exercises,Michael W.I. Schmidt,English,GEO 463 Current challenges in plant-soil systems,Thursday,Morning,10,12
"Gruppe 1, Geographies of Difference: Seminar group ""Krieg und Frieden""",GEO232.2,Seminar,Benedikt Korf,German,GEO 232 Human Geography III (Geographies of Difference),Tuesday,Afternoon,14,15
"Gruppe 2, Geographies of Difference: Seminar group ""Global Agriculture, Food and",GEO232.2,Seminar,"Chitrangada Choudhury, Math.-naturwiss. Fakultät N.N.-Dozent",English,GEO 232 Human Geography III (Geographies of Difference),Tuesday,Afternoon,14,15
"Gruppe 3, Geographies of Difference: Seminar group ""Urban In-/Exclusion""",GEO232.2,Seminar,Julie Yunyi Ren,English,GEO 232 Human Geography III (Geographies of Difference),Tuesday,Afternoon,14,15
Grundlagen Fernerkundung,GEO233.1,Course,"Andreas Hüni, Mathias Kneubühler, Claudia Röösli, Hendrik Wulf","German, English",GEO 233 Remote Sensing and Geographic Information Science III (Basics of Remote,Wednesday,Afternoon,14,15
"Übungen zu Grundlagen Fernerkundung, Gruppe 1a",GEO233.2,Exercise Group,"Andreas Hüni, Mathias Kneubühler, Claudia Röösli, Hendrik Wulf","German, English",GEO 233 Remote Sensing and Geographic Information Science III (Basics of Remote,Thursday,Afternoon,14,15
"Übungen zu Grundlagen Fernerkundung, Gruppe 2a",GEO233.2,Exercise Group,"Andreas Hüni, Mathias Kneubühler, Claudia Röösli, Hendrik Wulf",German,GEO 233 Remote Sensing and Geographic Information Science III (Basics of Remote,Friday,Afternoon,12,13
"Übungen zu Grundlagen Fernerkundung, Gruppe 3a",GEO233.2,Exercise Group,"Andreas Hüni, Mathias Kneubühler, Claudia Röösli, Hendrik Wulf",German,GEO 233 Remote Sensing and Geographic Information Science III (Basics of Remote,Friday,Afternoon,14,15
Geomorphologie und Glaziologie,GEO231.1,Course,"Andreas Vieli, Isabelle Gärtner",German,GEO 231 Physical Geography III (Geomorphology and Glaziology),Wednesday,Morning,10,12
"Übungen zu Physische Geographie III, Gruppe 1",GEO231.2,Exercise Group,Andreas Vieli,German,GEO 231 Physical Geography III (Geomorphology and Glaziology),Wednesday,Afternoon,16,18
"Übungen zu Physische Geographie III, Gruppe 2",GEO231.2,Exercise Group,Andreas Vieli,German,GEO 231 Physical Geography III (Geomorphology and Glaziology),Friday,Morning,8,9
"Übungen zu Physische Geographie III, Gruppe 3",GEO231.2,Exercise Group,Andreas Vieli,German,GEO 231 Physical Geography III (Geomorphology and Glaziology),Friday,Morning,10,12
"Übungen zu Grundlagen Fernerkundung, Gruppe 1b",GEO233.2,Exercise Group,"Andreas Hüni, Mathias Kneubühler, Claudia Röösli, Hendrik Wulf",German,GEO 233 Remote Sensing and Geographic Information Science III (Basics of Remote,Thursday,Afternoon,14,15
"Übungen zu Grundlagen Fernerkundung, Gruppe 2b",GEO233.2,Exercise Group,"Andreas Hüni, Mathias Kneubühler, Claudia Röösli, Hendrik Wulf",German,GEO 233 Remote Sensing and Geographic Information Science III (Basics of Remote,Friday,Afternoon,12,13
"Übungen zu Grundlagen Fernerkundung, Gruppe 3b",GEO233.2,Exercise Group,"Andreas Hüni, Mathias Kneubühler, Claudia Röösli, Hendrik Wulf",German,GEO 233 Remote Sensing and Geographic Information Science III (Basics of Remote,Friday,Afternoon,14,15
Research Colloquium Political Geography for MSc and Phd Students,GEODIPL,Colloquium,"Benedikt Korf, Asebe Regassa Debelo",German,GEO 511 Master Thesis,N/A,N/A,N/A,N/A
Vertiefung Humangeographie: Forschungsseminar A Vorlesung,GEO361.1,Lecture with Practical Exercises,"Norman Backhaus, Annina Helena Michel",English,GEO 361 Advanced Human Geography Va (Project seminar A),Tuesday,Morning,10,13
Methoden der Fernerkundung,GEO371.1,Course,"Alexander Damm-Reiser, Gerrit Kuhlmann, Felix Morsdorf, Claudia Röösli, David Small, Hendrik Wulf","German, English",GEO 371 Remote Sensing and Geographic Information Science V (Remote Sensing,Thursday,Morning,8,9
Übungen zu Methoden der Fernerkundung (Gruppe 1),GEO371.2,Exercise Group,"Alexander Damm-Reiser, Gerrit Kuhlmann, Felix Morsdorf, Claudia Röösli, David Small, Hendrik Wulf",German,GEO 371 Remote Sensing and Geographic Information Science V (Remote Sensing,Thursday,Morning,10,12
Übungen zu Methoden der Fernerkundung (Gruppe 2),GEO371.2,Exercise Group,"Alexander Damm-Reiser, Gerrit Kuhlmann, Felix Morsdorf, Claudia Röösli, David Small, Hendrik Wulf",German,GEO 371 Remote Sensing and Geographic Information Science V (Remote Sensing,Thursday,Afternoon,16,18
Vertiefung Geographische Informationswissenschaft,GEO372.1,Course,"Ross Stuart Purves, Math.-naturwiss. Fakultät N.N.-Dozent","German, English",GEO 372 Advanced Geographic Information Science V,Monday,Morning,10,12
Übungen zu Vertiefung Geographische Informationswissenschaft (Gruppe 1),GEO372.2,Exercise Group,"Ross Stuart Purves, Math.-naturwiss. Fakultät N.N.-Dozent",German,GEO 372 Advanced Geographic Information Science V,Monday,Afternoon,14,15
Übungen zu Vertiefung Geographische Informationswissenschaft (Gruppe 2),GEO372.2,Exercise Group,"Ross Stuart Purves, Math.-naturwiss. Fakultät N.N.-Dozent",German,GEO 372 Advanced Geographic Information Science V,Tuesday,Afternoon,14,15
Current Themes in Earth System Science,ESS401.1,Lecture with Practical Exercises,"Jan Martin Rudolf Seibert, Maria J. Santos",English,ESS 401 Current Themes in Earth System Science,Thursday,Morning,8,9
Spectroscopy of the Earth System,GEO442.1,Course,"Alexander Damm-Reiser, Andreas Hüni, Mathias Kneubühler, Daniel Odermatt, Daniel Schläpfer",German,GEO 442 Specialization in Remote Sensing: Spectroscopy of the Earth System,Wednesday,Morning,8,9
"Spectroscopy of the Earth System, Exercises",GEO442.2,Exercise Group,"Alexander Damm-Reiser, Andreas Hüni, Mathias Kneubühler, Daniel Odermatt, Daniel Schläpfer",German,GEO 442 Specialization in Remote Sensing: Spectroscopy of the Earth System,Wednesday,Morning,10,12
SAR and LIDAR,GEO443.1,Course,"Felix Morsdorf, Peter Brotzer, Emiliano Casalini, Elias Mendez Dominguez, David Small",English,GEO 443 Specialisation in Remote Sensing: SAR and LIDAR,Tuesday,Morning,8,9
Grundzüge und Sphären,GEO111.1,Course,"Michael W.I. Schmidt, Jan Martin Rudolf Seibert, Andreas Vieli, Maria J. Santos, Markus Egli",German,GEO 111 Physical Geography I (Basics and spheres),Monday,Afternoon,12,13
"Übungen zu Grundzüge und Sphären, Gruppe 1",GEO111.2,Exercise Group,"Michael W.I. Schmidt, Jan Martin Rudolf Seibert, Andreas Vieli, Maria J. Santos, Markus Egli",German,GEO 111 Physical Geography I (Basics and spheres),Monday,Afternoon,15,17
