Event Name,Event Code,Event Type,Instructor,Course Languages,Component of Module,Weekday,Daytime,Start Time,End Time
"Quantitative Methoden: Schwerpunkt eigene Erhebungen, Gruppe B",226-023a,Lecture with Practical Exercises,Markus Roos,German,Quantitative Methods: Emphasis on Own Surveys,Friday,Morning,8,9
"Quantitative Methoden: Schwerpunkt eigene Erhebungen, Gruppe C",226-023a,Lecture with Practical Exercises,Tessa Consoli,German,Quantitative Methods: Emphasis on Own Surveys,Friday,Morning,10,12
Forschungspraktikum,226l001a,Praktikum,N/A,German,Research Internship,N/A,N/A,N/A,N/A
Thematische Lektüre,226l002a,Selbststudium mit Leistungsnachweis,N/A,German,Subject-Specific Reading,N/A,N/A,N/A,N/A
Thematische Lektüre in Gruppen,226l003a,Selbststudium mit Leistungsnachweis,N/A,German,Subject-Specific Reading in Groups,N/A,N/A,N/A,N/A
Thematische schriftliche Arbeit,226l004a,Selbststudium mit Leistungsnachweis,N/A,German,Subject-Specific Paper,N/A,N/A,N/A,N/A
"Summer School HS24 ""Language""",330l418a,Selbststudium mit Leistungsnachweis,Annemarie Mertens-Dietrich,German,"Summer School 2024 ""Language""",N/A,N/A,N/A,N/A
Summer School HS24,330l419a,Selbststudium mit Leistungsnachweis,Annemarie Mertens-Dietrich,German,Summer School 2024,N/A,N/A,N/A,N/A
Xiandai Hanyu Yufa 2 (Vorlesung in chinesischer Sprache),280l039a,Course,Xiaobin Hu,Chinese,Grammar of Modern Chinese 2 (Lecture in Chinese),Friday,Morning,9,9
Abschlussprüfung,226-501a,Selbststudium mit Leistungsnachweis,N/A,German,Final Exam,N/A,N/A,N/A,N/A
(Wiederholungsprüfung) Abschlussprüfung,226-501a,Repetition exam (same semester),N/A,German,Final Exam,N/A,N/A,N/A,N/A
Praxisorientierte Semesterarbeit,640-517a,Selbststudium mit Leistungsnachweis,Carola Jäggi,German,Practice-Oriented Term Paper,N/A,N/A,N/A,N/A
Externes Berufspraktikum BA Archäologien 3 ECTS,640l202a,Praktikum,Carola Jäggi,German,Professional Traineeship BA Archaeologies 3 ECTS,N/A,N/A,N/A,N/A
Vorstudie Masterarbeit Mittelalterarchäologie,640l701a,Selbststudium mit Leistungsnachweis,Carola Jäggi,German,Master's Thesis: pre-study in Medieval Archaeology,N/A,N/A,N/A,N/A
Handel in der griechischen und römischen Antike,322-001a,Exercise Group,Ruth E. Harder,German,Basic Knowledge of Ancient Studies,Friday,Afternoon,16,18
Grundlagenlektüre Altertumswissenschaften,322-002a,Selbststudium mit Leistungsnachweis,"Corinna Reinhardt, Andreas Victor Walser",German,Basic Modern Readings in Ancient Studies,N/A,N/A,N/A,N/A
Grosse Ba-Seminararbeit,322-003a,Selbststudium mit Leistungsnachweis,N/A,German,"Term Paper (Long, BA Seminar)",N/A,N/A,N/A,N/A
"Forschungsseminar (Beginn HS 2024), Teil I",226-513a,Seminar,"Isabelle Duss, Bettina Kunz",German,Research Seminar,Friday,Morning,10,13
Research Seminar BBLS Banking &amp; Finance (S) HS24,DOEC1155,Doktorandenseminar,Per Östberg,English,Research Seminar BBLS Banking &amp; Finance (S) HS24,Friday,Afternoon,12,13
Mitarbeit in Forschungsprojekt bei Datenaufbereitung und - analyse,226-514a,Praktikum,N/A,German,Assistance in Research Project: Data Processing and Data Analysis,N/A,N/A,N/A,N/A
Mitarbeit in Forschungsprojekt bei Planung und Erhebung,226-515a,Praktikum,N/A,German,Assistance in Research Project: Planning and Data Collection,N/A,N/A,N/A,N/A
Kleine Ba-Seminararbeit,322-004a,Selbststudium mit Leistungsnachweis,N/A,German,"Term Paper (Short, BA Seminar)",N/A,N/A,N/A,N/A
Externes Berufspraktikum MA Archäologien 3 ECTS,640l703a,Praktikum,Carola Jäggi,German,Professional Traineeship MA Archaeologies 3 ECTS,N/A,N/A,N/A,N/A
Externes Berufspraktikum MA MAA 3 ECTS,640l704a,Praktikum,Carola Jäggi,German,Professional Traineeship MA MAA 3 ECTS,N/A,N/A,N/A,N/A
Exkursionen zur Einführung in das Studium der Archäologien,682-001a,Field Trip,"Iris Regula Hutter, Martin Mohr, Fabio Wegmüller",German,Introduction to the study of Archaeologies,N/A,N/A,N/A,N/A
Basiswissen Prähistorische Archäologie,682-002a,Seminar,Fabio Wegmüller,German,Basics in Prehistoric Archaeology,Friday,Afternoon,14,15
Individuelle Projektarbeit historische Ereignisse und Entwicklungen,322-501a,Selbststudium mit Leistungsnachweis,N/A,German,Individual Project Work on Historic Events and Developments,N/A,N/A,N/A,N/A
Individuelle Projektarbeit Literaturen und ihre Sprachen,322-502a,Selbststudium mit Leistungsnachweis,N/A,German,Individual Project Work on Literatures and their Languages,N/A,N/A,N/A,N/A
Individuelle Projektarbeit materielle Kulturen,322-503a,Selbststudium mit Leistungsnachweis,N/A,German,Individual Project Work on Material Cultures,N/A,N/A,N/A,N/A
Vertiefungslektüre Altertumswissenschaften,322-504a,Selbststudium mit Leistungsnachweis,"Corinna Reinhardt, Andreas Victor Walser",German,Advanced Modern Readings in Ancient Studies,N/A,N/A,N/A,N/A
Fachüberblick Altertumswissenschaften,322-505a,Selbststudium mit Leistungsnachweis,N/A,German,Overview of Ancient Studies,N/A,N/A,N/A,N/A
Fachüberblick mit Fokus Literaturen und ihre Sprachen,322-506a,Selbststudium mit Leistungsnachweis,N/A,German,Overview with a Focus on Literatures and their Languages,N/A,N/A,N/A,N/A
Fachüberblick mit Fokus materielle Kulturen,322-507a,Selbststudium mit Leistungsnachweis,N/A,German,Overview with a Focus on Material Cultures,N/A,N/A,N/A,N/A
Fachüberblick mit Fokus historische Ereignisse und Entwicklungen,322-508a,Selbststudium mit Leistungsnachweis,N/A,German,Overview with a Focus on Historic Events and Developments,N/A,N/A,N/A,N/A
Fachüberblick mit Fokus Religionen und philosophische Traditionen,322-509a,Selbststudium mit Leistungsnachweis,N/A,German,Overview with a Focus on Religions and Philosophical Traditions,N/A,N/A,N/A,N/A
Individuelle Projektarbeit Religionen und philos. Traditionen,322-510a,Selbststudium mit Leistungsnachweis,N/A,German,Individual Project Work on Religions and Philos. Traditions,N/A,N/A,N/A,N/A
Masterarbeit,322-MAa,Master Paper,N/A,German,Master's Thesis,N/A,N/A,N/A,N/A
Thematische Lektüre Inklusive Pädagogik,226l521a,Selbststudium mit Leistungsnachweis,N/A,German,Subject-Specific Reading Inclusive Education,N/A,N/A,N/A,N/A
Thematische Lektüre in Gruppen Inklusive Pädagogik,226l520a,Selbststudium mit Leistungsnachweis,N/A,German,Subject-Specific Reading in Groups Inclusive Education,N/A,N/A,N/A,N/A
Thematische schriftliche Arbeit Inklusive Pädagogik,226l522a,Selbststudium mit Leistungsnachweis,N/A,German,Subject-Specific Paper Inclusive Education,N/A,N/A,N/A,N/A
Kernbereich Medieninhalte &amp; Mediennutzung,254-022a,Course,"Thomas N. Friemel, Linards Udris",German,Core Area: Media Content &amp; Media Use,Friday,Afternoon,12,13
Dämonische Versuchungen in der ägyptischen Wüste: Athanasius' Vita des Antonius,322l016a,Colloquium,"Stefan Krauter, Andreas Victor Walser",German,Colloquium Antiquity and Christianity,Friday,Morning,10,12
Masterprüfung Archäologische Kulturwissenschaften: Klassische Archäologie,682-508a,Selbststudium mit Leistungsnachweis,Corinna Reinhardt,German,Master's examination Archaeological Culture Studies,N/A,N/A,N/A,N/A
Masterprüfung Archäologische Kulturwissenschaften: Mittelalterarchäologie,682-508a,Selbststudium mit Leistungsnachweis,Carola Jäggi,German,Master's examination Archaeological Culture Studies,N/A,N/A,N/A,N/A
Masterprüfung Archäologische Kulturwissenschaften: Prähistorische Archäologie,682-508a,Selbststudium mit Leistungsnachweis,Philippe Della Casa,German,Master's examination Archaeological Culture Studies,N/A,N/A,N/A,N/A
"Prophylactic Measures, Herd Health, Swine Medicine",.470_pr,Lecture with Practical Exercises,"Ulrich T. Bleul, Heinrich Bollwein, Thomas Heinrich Echtermann, Christian Gerspach, Dolf Kümmerlen, Karl Nuss, Sophie Ramsauer, Colin Schwarzwald, Barbara Willi Andris, Julia van Spijk",German,"Prophylactic Measures, Herd Health, Swine Medicine, Poultry",N/A,N/A,N/A,N/A
Varieties of Economic History (Fortsetzung aus FS24),599-504a,Seminar,N/A,"German, English",Varieties of Economic History,N/A,N/A,N/A,N/A
"Grammophon, Film, MP3: Einführung in die Mediengeschichte (Fortsetzung aus FS24)",600-001a,Seminar,N/A,German,Methods and Theories,N/A,N/A,N/A,N/A
The feud in the middle ages (Fortsetzung aus FS24),600-001a,Seminar,N/A,English,Methods and Theories,N/A,N/A,N/A,N/A
Kassandra's World. Geschichte und Fiktion in Assassin's Creed Odyssey (Fortsetzung aus FS24),600-033a,Seminar,N/A,German,Ancient History 5,N/A,N/A,N/A,N/A
Die grossen Kriege Roms und ihr Beitrag zu Aufstieg und Niedergang des Imperium Romanum (Fortsetzung aus FS24),600-034a,Seminar,N/A,German,Ancient History 6,N/A,N/A,N/A,N/A
Antike Geschichte digital erleben (Fortsetzung aus FS24),600-035a,Seminar,N/A,German,Ancient History 7,N/A,N/A,N/A,N/A
Griechen und Barbaren: Die Weltgeschichte Herodots (Fortsetzung aus FS24),600-036a,Seminar,N/A,German,Ancient History 8,N/A,N/A,N/A,N/A
Wissenskulturen im Spätmittelalter. Schwerpunkt Schweiz (Fortsetzung aus FS24),600-041a,Seminar,N/A,German,Medieval History 5,N/A,N/A,N/A,N/A
"Heilige, Wunder und Mirakel im frühen Mittelalter (Fortsetzung aus FS24)",600-042a,Seminar,N/A,German,Medieval History 6,N/A,N/A,N/A,N/A
Denn sie lieben die Freiheit so sehr - Die Entstehung der Kommunen im mittelalterl_ropa (Fortsetzung aus FS24),600-043a,Seminar,N/A,German,Medieval History 7,N/A,N/A,N/A,N/A
"Geld, Geist und Gewalt. Inner- und transalpiner Kontakt und Austausch im Spätmittelalter (Fortsetzung aus FS24)",600-044a,Seminar,N/A,German,Medieval History 8,N/A,N/A,N/A,N/A
Rote Ukraine: Sowjetische Geschichte aus ukrainischer Perspektive (Fortetzung aus FS24),600-045a,Seminar,N/A,German,Modern History 13,N/A,N/A,N/A,N/A
"Konsum, Politik und Geschlecht in der Schweiz nach 1945 (Fortsetzung aus FS24)",600-046a,Seminar,N/A,German,Modern History 14,N/A,N/A,N/A,N/A
"Massengräber, Gräuelbilder und Zeugenaussagen: Forensik und Massengewalt_dert (Fortsetzung aus FS24)",600-047a,Seminar,N/A,"German, English",Modern History 15,N/A,N/A,N/A,N/A
Art as a Means of Historical Inquiry (Fortsetzung aus FS24),600-048a,Seminar,N/A,German,Modern History 16,N/A,N/A,N/A,N/A
Bis aufs Blut: Reformation/en in Europa (Fortsetzung aus FS24),600-049a,Seminar,N/A,German,Modern History 17,N/A,N/A,N/A,N/A
Das Recht auf den eigenen Körper. Frauenbewegung und die Initiative für den straflose_ruch(Fortsetzung aus FS24),600-050a,Seminar,N/A,German,Modern History 18,N/A,N/A,N/A,N/A
Die Schweiz am Ende des Kalten Krieges (provisorischer Titel) (Fortsetzung aus FS24),600-051a,Seminararbeit,N/A,German,Modern History 19,N/A,N/A,N/A,N/A
"""An apple a day keeps the doctor away"": Zur Verwissenschaftlichung der Ernährung im 19. und 20. Jh (Fortsetzung aus FS24)",600-052a,Seminar,N/A,German,Modern History 20,N/A,N/A,N/A,N/A
Mapping Pacific History (Fortsetzung aus FS24),600-053a,Seminar,N/A,German,Modern History 21,N/A,N/A,N/A,N/A
Crises of Globalization (Fortsetzung aus FS24),600-054a,Seminar,N/A,English,Modern History 22,N/A,N/A,N/A,N/A
Mediterrane Hafenstädte als Migrationsknotenpunkte der Vormoderne (Fortsetzung aus FS24),600-503a,Seminar,N/A,German,Migration History of the Modern Era,N/A,N/A,N/A,N/A
Family History and Global History (Fortsetzung aus FS24),600-505a,Seminar,N/A,English,Perspectives of Global History,N/A,N/A,N/A,N/A
"Wissen, Recht und Gelehrsamkeit im frühen Mittelalter (Fortsetzung aus FS24)",600-512a,Seminar,N/A,German,Politics and Societies in the Medieval Period,N/A,N/A,N/A,N/A
Ablagerungen mittelalterlicher Diskriminierungspraktiken im Archiv (Fortsetzung aus FS24),600-514a,Seminar,N/A,German,Social History and Economic History of the Medieval Period,N/A,N/A,N/A,N/A
Interviews - mündliche Quellen in der Geschichtswissenschaft (Fortsetzung aus FS24),600-516a,Seminar,N/A,German,Methods and Theories,N/A,N/A,N/A,N/A
Menschheitsgeschichte und die Frage der Ungleichheit (Fortsetzung aus FS24),600-516a,Seminar,N/A,German,Methods and Theories,N/A,N/A,N/A,N/A
Geschichte des Neoliberalismus (Fortsetzung aus FS24),600-601a,Seminar,N/A,German,Social History and Economic History of the Modern World,N/A,N/A,N/A,N/A
Diktatoren und Tyrannen in der antiken Welt (Fortsetzung aus FS24),602-501a,Seminar,Anne Kolb,German,Politics and Societies in the Ancient World,N/A,N/A,N/A,N/A
"Mensch, Natur und Umwelt in der Antike (Fortsetzung aus FS24)",602-502a,Seminar,Felix Maier,German,Cultural History of the Ancient World,N/A,N/A,N/A,N/A
Gegenwart der Vergangenheit: Geschichtspolitik im östlichen Europa seit 1989/91 (Fortsetzung aus FS24),612-503a,Seminar,Peter Collmer,German,"Politics, Cultures and Societies in Eastern Europe 2",N/A,N/A,N/A,N/A
Exercise Computational Probability and Simulation,FIM101.2,Exercise Group,N/A,English,FIM 101 Computational Probability and Simulation,Friday,Morning,10,12
"Klinischer Kurs Innere Medizin, im Spital Muri",KUR416MU,Exercise Group,Chris Heimgartner,German,"Clinical Courses III: Gynecology &amp; Obstetrics or Pediatrics, Family Medicine,",N/A,N/A,N/A,N/A
Variation in Spoken Language,440l521a,Seminar,Hans Martin Lehmann,English,Variation in Spoken Language,Friday,Afternoon,12,13
Short Internship: Library Exhibition (Partner Institution: UB Anglistik),440l522a,Praktikum,Olivia Tjon-A-Meeuw,English,Short Internship: Library Exhibition (Partner Institution: UB Anglistik),N/A,N/A,N/A,N/A
Master Thesis Linguistics (Zehentner),440-MAa,Master Paper,N/A,English,Master's Thesis,N/A,N/A,N/A,N/A
Bachelor Thesis Linguistics (Moretti),440-BAa,Bachelor Paper,N/A,English,Bachelor's Thesis,N/A,N/A,N/A,N/A
Master Thesis Linguistics (Moretti),440-MAa,Master Paper,N/A,English,Master's Thesis,N/A,N/A,N/A,N/A
Bachelor Thesis Literature (Gutbrodt),440-BAa,Bachelor Paper,N/A,English,Bachelor's Thesis,N/A,N/A,N/A,N/A
Master Thesis Literature (Gutbrodt),440-MAa,Master Paper,N/A,English,Master's Thesis,N/A,N/A,N/A,N/A
Bachelor Thesis Literature (Verstl),440-BAa,Bachelor Paper,N/A,English,Bachelor's Thesis,N/A,N/A,N/A,N/A
Master Thesis Literature (Castelli),440-MAa,Master Paper,N/A,English,Master's Thesis,N/A,N/A,N/A,N/A
(Wiederholungsprüfung) Lectura da basa,431-001a,Repetition exam (same semester),Rico Franc Valär,Rhaeto-Romanic,Introductive Reading,N/A,N/A,N/A,N/A
(Wiederholungsprüfung) Lectura approfundada – Litteratura,431-004a,Repetition exam (same semester),Rico Franc Valär,Rhaeto-Romanic,Rhaeto-Romanic Literature,N/A,N/A,N/A,N/A
(Wiederholungsprüfung) Lectura approfundada – Linguistica,431-005a,Repetition exam (same semester),Rico Franc Valär,Rhaeto-Romanic,Advanced Reading – Linguistics,N/A,N/A,N/A,N/A
(Wiederholungsprüfung) Vertiefende Lektüre,431-007a,Repetition exam (same semester),Rico Franc Valär,Rhaeto-Romanic,Advanced Reading,N/A,N/A,N/A,N/A
Anatomie Tutorat,HUB2032,Tutorat,N/A,German,Praktika 2.SJ HS,N/A,N/A,N/A,N/A
Virologie,KUR3095,Exercise Group,N/A,German,"Laboratory Courses: Immunology, Laboratory Medicine/Clinical Chemistry, Medical",N/A,N/A,N/A,N/A
"Klinischer Kurs Neurologie und Neurochirurgie, im Klinik Lengg",KUR416f,Klinischer Kurs,N/A,German,"Clinical Courses III: Gynecology &amp; Obstetrics or Pediatrics, Family Medicine,",N/A,N/A,N/A,N/A
"Klinischer Kurs Neurologie und Neurochirurgie, im Spital Linth",KUR416f,Klinischer Kurs,N/A,German,"Clinical Courses III: Gynecology &amp; Obstetrics or Pediatrics, Family Medicine,",N/A,N/A,N/A,N/A
"Klinischer Kurs Neurologie und Neurochirurgie, im Neurologie am See",KUR416f,Klinischer Kurs,N/A,German,"Clinical Courses III: Gynecology &amp; Obstetrics or Pediatrics, Family Medicine,",N/A,N/A,N/A,N/A
"Klinischer Kurs Neurologie und Neurochirurgie, im Praxis für Neurologie Zug",KUR416f,Klinischer Kurs,N/A,German,"Clinical Courses III: Gynecology &amp; Obstetrics or Pediatrics, Family Medicine,",N/A,N/A,N/A,N/A
"Klinischer Kurs Neurologie und Neurochirurgie, im Praxis Neurologie am Untertor",KUR416f,Klinischer Kurs,N/A,German,"Clinical Courses III: Gynecology &amp; Obstetrics or Pediatrics, Family Medicine,",N/A,N/A,N/A,N/A
"Klinischer Kurs Neurologie und Neurochirurgie, im Praxis Neuroteam AG Aarau",KUR416f,Klinischer Kurs,N/A,German,"Clinical Courses III: Gynecology &amp; Obstetrics or Pediatrics, Family Medicine,",N/A,N/A,N/A,N/A
"Klinischer Kurs Ophthalmologie, im Augenklinik Zürich West",KUR416g,Exercise Group,N/A,German,"Clinical Courses III: Gynecology &amp; Obstetrics or Pediatrics, Family Medicine,",N/A,N/A,N/A,N/A
"Klinischer Kurs Ophthalmologie, im hiho Augenpraxis",KUR416g,Exercise Group,N/A,German,"Clinical Courses III: Gynecology &amp; Obstetrics or Pediatrics, Family Medicine,",N/A,N/A,N/A,N/A
"Klinischer Kurs Ophthalmologie, im Talacker Augen Zentrum Zürich",KUR416g,Exercise Group,N/A,German,"Clinical Courses III: Gynecology &amp; Obstetrics or Pediatrics, Family Medicine,",N/A,N/A,N/A,N/A
"Klinischer Kurs Innere Medizin, im Klinik Hirslanden Zürich",KUR416e,Exercise Group,"Lars Asmis, Sandro Baumgartner, Oliver Gämperli, Helen Kovari, Roger Lussmann, Claudine Meindl-Fridez, Andreas Piecyk, Panagiotis Samaras, Andreas Serra, Jonas Zeitz, Michael Zürrer",German,"Clinical Courses III: Gynecology &amp; Obstetrics or Pediatrics, Family Medicine,",N/A,N/A,N/A,N/A
"Klinischer Kurs Innere Medizin, im See Spital Horgen",KUR416e,Exercise Group,Sebastian Braun,German,"Clinical Courses III: Gynecology &amp; Obstetrics or Pediatrics, Family Medicine,",N/A,N/A,N/A,N/A
Chirurgische Visite im Kantonsspital Münsterlingen,CHI6010,Exercise Group,Pietro Renzulli,German,"Clinical Courses V: Anesthesiology and Resuscitation, Surgery, Dermatology, Internal",N/A,N/A,N/A,N/A
Chirurgische Visite im Kantonsspital Schaffhausen,CHI6010,Exercise Group,"Waldemar Bartkowicki, Rainer Brydniak, Stefan Kees, Nils Kerstholt, Severin Meili, Stefan Preusser, Peter Sandera, Folco Solimene, Gregoire Thürig, Kujtim Veseli, Alexander Volck",German,"Clinical Courses V: Anesthesiology and Resuscitation, Surgery, Dermatology, Internal",N/A,N/A,N/A,N/A
"Internistischer Gruppenunterricht -stationär, im Kantonsspital Olten",MED6020,Kurs,N/A,German,"Clinical Courses V: Anesthesiology and Resuscitation, Surgery, Dermatology, Internal",N/A,N/A,N/A,N/A
Gletscherarchäologie,683l015a,Praktikum,Rouven Turck,German,Gletscherarchäologie,N/A,N/A,N/A,N/A
Master Thesis Linguistics (Matley),440-MAa,Master Paper,N/A,English,Master's Thesis,N/A,N/A,N/A,N/A
Bachelor Thesis Literature (Matley),440-BAa,Bachelor Paper,N/A,English,Bachelor's Thesis,N/A,N/A,N/A,N/A
Lektürekanon in westlichen und ostasiatischen Sprachen,642-501a,Selbststudium mit Leistungsnachweis,Ewa Machotka,German,Essential Readings in Western and East Asian Languages,N/A,N/A,N/A,N/A
Forschung in Ökonomie: Schriftliche Arbeit,599-505a,Selbststudium mit Leistungsnachweis,Ulrich Woitek,German,Research in Economics: Paper,N/A,N/A,N/A,N/A
Bachelor Thesis Linguistics (Haerter),440-BAa,Bachelor Paper,N/A,English,Bachelor's Thesis,N/A,N/A,N/A,N/A
Bachelor Thesis Linguistics (Rossmanith),440-BAa,Bachelor Paper,N/A,English,Bachelor's Thesis,N/A,N/A,N/A,N/A
Bachelor Thesis Literature (Kradolfer),440-BAa,Bachelor Paper,N/A,English,Bachelor's Thesis,N/A,N/A,N/A,N/A
Bachelor Thesis Literature (Robe),440-BAa,Bachelor Paper,N/A,English,Bachelor's Thesis,N/A,N/A,N/A,N/A
Bachelor Thesis Literature (Michoux),440-BAa,Bachelor Paper,N/A,English,Bachelor's Thesis,N/A,N/A,N/A,N/A
Master Thesis Literature (Michoux),440-MAa,Master Paper,N/A,English,Master's Thesis,N/A,N/A,N/A,N/A
Nicht-(Indo-)Europäische Sprache,272k033a,Selbststudium mit Leistungsnachweis,Lena Zipp,"German, English",Non-(Indo-)European Language,N/A,N/A,N/A,N/A
Bachelor Thesis Literature (Schmoll),440-BAa,Bachelor Paper,N/A,English,Bachelor's Thesis,N/A,N/A,N/A,N/A
Archiving the Internet Age (Fortsetzung aus FS24),598-503a,Exercise Group,Martin Dusinberre,English,History Digitized World,N/A,N/A,N/A,N/A
She said. Politik der Autorinnen seit 2010,255k512a,Seminar,N/A,German,She said. Politik der Autorinnen seit 2010,N/A,N/A,N/A,N/A
Digitale Methoden in der Filmwissenschaft,255k011a,Seminar,N/A,German,Digitale Methoden in der Filmwissenschaft,N/A,N/A,N/A,N/A
Auf und ab: Berge im Schweizer Film,255k010a,Seminar,N/A,German,Auf und ab: Berge im Schweizer Film,N/A,N/A,N/A,N/A
History Lessons: Filmisches Entwerfen und Spekulieren,255k002a,Seminar,N/A,German,History Lessons: Filmisches Entwerfen und Spekulieren,N/A,N/A,N/A,N/A
Stimmen im Film,255k001a,Seminar,N/A,German,Stimmen im Film,N/A,N/A,N/A,N/A
"Speculative Turn? Theorien, Literaturen und Medien des Spekulativen",506k108a,Seminar,N/A,German,"Speculative Turn? Theories, Literatures and Media of the Speculative",N/A,N/A,N/A,N/A
Folk Horror,506k107a,Seminar,N/A,German,Folk Horror,N/A,N/A,N/A,N/A
Lokale Nahrungskulturen,506k003a,Seminar,N/A,German,Local Food: Tracing a Trend,N/A,N/A,N/A,N/A
Arbeit,506k002a,Seminar,N/A,German,Cultures of Work. Ethnographic and Theoretical Approaches,N/A,N/A,N/A,N/A
Visuelle Anthropologie - populäre Bilder erkennen und verstehen,506k001a,Seminar,N/A,German,Visual Anthropology,N/A,N/A,N/A,N/A
Einführung in die musikalische Analyse,760-006a,Seminar,N/A,German,Introduction to Musical Analysis,N/A,N/A,N/A,N/A
Biochemisches Praktikum I für die Life Sciences,BCH213,Praktikum,"Christine Berger Sprecher, Séverine Lobet, Cristina Manatschal",German,BCH 213 Practical course in Biochemistry,Friday,Afternoon,13,15
Biochemisches Praktikum I für die Life Sciences,BCH213,Praktikum,"Christine Berger Sprecher, Séverine Lobet, Cristina Manatschal",German,BCH 213 Practical course in Biochemistry,N/A,N/A,N/A,N/A
Allgemeines Staatsrecht,120WM14,Course,"Thomas Gächter, Michael Meier, Jürg Tiefenthal",German,General Theory of State From a Legal Perspective,Friday,Morning,8,9
"Klinischer Kurs Innere Medizin, im Spital Bülach",KUR416e,Exercise Group,"Laura Victoria Campos Monserrat, Manuel Fischler, Sarah François, Mehmet Tuncay Gündüz, Yvonne Hollenstein, Raphael Monsch, Lukas Schilliger, Alf Schmidt",German,"Clinical Courses III: Gynecology &amp; Obstetrics or Pediatrics, Family Medicine,",N/A,N/A,N/A,N/A
"Klinischer Kurs Innere Medizin, im Kantonsspital Baden",KUR416CE,Exercise Group,"Linda Berney-Meyer, Anja Bohr, Clemens B. Caspar, Tudor Cosma, Petra Ferrari Pedrini, Veronika Gerhards, Erwin Grüter, Patrick Järgen, Nadine Meyer-Lippuner, Meng Monfregola, Jonas Noser, Janko Rakic, Stephan Sademach, Oliver Alexander Schmidlin, Anina Vinzens, Benedikt Johannes Wiggli",German,"Clinical Courses III: Gynecology &amp; Obstetrics or Pediatrics, Family Medicine,",N/A,N/A,N/A,N/A
"Klinischer Kurs Innere Medizin, im Stadtspital Triemli",KUR416V,Exercise Group,"Evelyne Ajdler-Schäffler, Sarah Albrecht, Mattia Arrigo, Valérie Bernays, Michael Bigger, Levin Bolt, Sabine Dinges-Dahm, Gregor Fahrni, Giorgia Garzoli, Christoph Gubler, Florian Hildenbrand, Daniel Hofer, Katharina Hoppe, Lars Christian Huber, Sebastian Kraus, Sebastian Kölmel, Irene Laube, Pascal Locher, Bernhard Morell, Fritz Ruprecht Murray, Corina Omlin, Benjamin Preiswerk, Kristina Reggel-Dapoto, Julia Reusch, Adrian Schibli, Adrian Emanuel Schmidt, Dieter Scholtze, Patrick Sidler, Elisabeth Simons, Nana Song, Riccardo Steffen, Cédric Steinmann, Melina Stüssi-Helbling, Frans Olivier The, Nathalie Ulmer, Nina Vadasz, Adriana Wirth, Bernd Yuen, Armin Zink",German,"Clinical Courses III: Gynecology &amp; Obstetrics or Pediatrics, Family Medicine,",N/A,N/A,N/A,N/A
