Event Name,Event Code,Event Type,Instructor,Course Languages,Component of Module,Weekday,Daytime,Start Time,End Time
Fondamenti di linguistica diacronica e dialettologia,410-004a,Seminar,Federica Breimaier,Italian,Introduction to Diachronic Linguistics and Dialectology,Monday,Afternoon,14,15
Epigenetics,BIO243,Course,"Célia Baroux, Ueli Grossniklaus, Raffaella Santoro, Sara Simonini",German,BIO 243 Epigenetics,Monday,Afternoon,15,17
DNA metabolism and cancer,BIO257,Course,"Pavel Janscak, Massimo Lopes, Enni Markkanen, Hanspeter Nägeli, Lorenza Penengo, Alessandro Sartori",English,BIO 257 DNA metabolism and cancer,Monday,Morning,10,12
"Translational cancer research: new technologies, mouse models and clinical approaches",BIO242,Course,"Bernd Bodenmiller, Lubor Borsig, Onur Boyman, Sven Hillinger, Viktor H. Kölzer, Mitchell Paul Levesque, Gerhard Rogler, Manuel Stucki, Andreas Wicki",English,"BIO 242 Translational cancer research: new technologies, mouse models and clinical",Monday,Afternoon,13,15
Lessicografia ed etimologia italo- romanze: i dialetti meridionali,410l032a,Seminar,Michele Loporcaro,Italian,Italo-Romance lexicography and etymology: southern Italian dialects,Monday,Afternoon,16,18
«Züri brännt»: die 1980er-Jugendunruhen aus kommunikationsgeschichtlicher Perspektive,360-544a,Seminar,Daniel Knuchel,German,Change and variation: functional aspects,Monday,Afternoon,16,18
Inorganic Chemistry I: Main Group Chemistry - Exploring Elemental Diversity,CHE201.1,Lecture with Practical Exercises,"Roland K.O. Sigel, Felix Hubertus Zelder","German, English",CHE 201 Inorganic Chemistry I: Main Group Chemistry - Exploring Elemental Diversity,Monday,Morning,8,9
Inorganic Chemistry III: Synthesis and Reactivity of Elements from across the Periodic Table,CHE303.1,Lecture with Practical Exercises,Jason Philip Holland,English,CHE 303 Inorganic Chemistry III: Synthesis and Reactivity of Elements from across,Monday,Morning,8,9
Molecular and Cellular Neurobiology,BME322,Course,"Christian Grimm, Theofanis Karayannis, Aiman Samir Saab, Shiva Tyagarajan, Bruno Weber",English,BME 322 Molecular and Cellular Neurobiology,Monday,Afternoon,13,14
Physiology and anatomy I,BME235,Course,"Giovanni Camici, Isabelle Maria Anna Frey-Wagner, Johannes Loffing, Gerhard Rogler, Isabel Rubio Aliaga, Carsten Alexander Wagner, Roland H. Wenger",German,BME 235 Physiology and anatomy I,Monday,Morning,10,12
Scientific writing and publishing,BME410,Lecture with Practical Exercises,"Christian Grimm, Thierry Hennet",English,BME 410 Scientific writing and publishing,Monday,Afternoon,16,18
Metabolism and Nutrition,BME317,Lecture with Practical Exercises,"Christina Boyle, Daniel Gero, Christelle Le Foll, Thomas Lutz, Jérôme Robert",English,BME 317 Metabolism and Nutrition,Monday,Afternoon,15,17
Basics in human toxicology,BME324,Course,"Michael Arand, Anne Marowsky",English,BME 324 Basics in human toxicology,Monday,Afternoon,15,17
Glycosylation,BME316,Course,"Lubor Borsig, Thierry Hennet, Timothy Gerard Keys, Vivianne Irène Otto",English,BME 316 Glycosylation,Monday,Afternoon,13,14
Frontiers in Animal Behaviour,BIO331,Course,"Damien Farine, Anna Lindholm Krützen, Stefan Lüpold, Marta Manser",English,BIO 331 Frontiers in Animal Behaviour,Monday,Morning,10,12
Current Research in Evolutionary Ecology and Genetics of Natural Populations,BIO607,Seminar,Lukas Keller,English,BIO 607 Current Research in Evolutionary Ecology and Genetics of Natural,Monday,Afternoon,13,14
Environmental Policy of the EU,EEE264,Course,Tamaki Ohmura,English,EEE 264 Environmental Policy of the EU,Monday,Afternoon,12,13
Einführung in die synchrone Sprachwissenschaft,360-212a,Sprachkurs,Stefan Savic,German,Scandinavian Languages: Comparative Language Studies,Monday,Afternoon,14,15
Deutsch verstehen und sprechen; B1,_D_Zvesp,Sprachkurs,Miriam Vorbrugg,German,Deutsch verstehen und sprechen; B1,Monday,Morning,11,13
Basic German 1; A1,_D_GA11,Sprachkurs,Petra Blöchlinger,German,German 1: A1.1,Monday,Afternoon,16,17
Basic German 1; A1,_D_GA11,Sprachkurs,Sabine Buchmann Llanaj,German,German 1: A1.1,Monday,Morning,10,11
Basic German 1; A1,_D_ZGA11,Sprachkurs,Sabine Buchmann Llanaj,German,German 1: A1.1,Monday,Afternoon,12,13
Highspeed German 1 + 2: A1,_D_ZHI12,Sprachkurs,"Lea Gass, Melanie Kutz",German,Highspeed German 1 + 2: A1,Monday,Evening,18,19
Basic German 3; A2,_D_ZGA21,Sprachkurs,Petra Blöchlinger,German,German 3: A2.1,Monday,Afternoon,12,13
Highspeed German 3 + 4: A2,_D_ZHI34,Sprachkurs,"Petra Blöchlinger, Anja Gredig",German,Highspeed German 3 + 4: A2,Monday,Afternoon,12,13
"Basic German 4; A2: Vocabulary, speakin",_D_GA22,Sprachkurs,Anja Gredig,German,German 4: A2.2,Monday,Morning,10,11
"Basic German 4; A2: Listening, reading,",_D_ZGA22,Sprachkurs,Lea Gass,German,German 4: A2.2,Monday,Afternoon,12,13
German 5; A2-B1: Einstieg ins Niveau B1,_D_GA2B1,Sprachkurs,Sabine Buchmann Llanaj,German,German 5: A2.2/B1.1,Monday,Afternoon,16,17
German 5; A2-B1: Einstieg ins Niveau B1,_D_ZGA2B,Sprachkurs,Miriam Vorbrugg,German,German 5: A2.2/B1.1,Monday,Afternoon,16,17
Español B1: Inicial,_Sp_B1I,Sprachkurs,Joaquin Ruano Cespedes,Spanish,Español B1: Inicial,Monday,Evening,18,19
Español A1,_Sp_A1,Sprachkurs,Joaquin Ruano Cespedes,Spanish,Español A1,Monday,Afternoon,12,13
Español A1,_Sp_A1,Sprachkurs,Joaquin Ruano Cespedes,Spanish,Español A1,Monday,Afternoon,16,17
Swedish I A1,_SWE_I,Sprachkurs,Franziska Kreis,German,Swedish I A1,Monday,Afternoon,16,18
Group Seminar: Current Research,BIO710,Colloquium,Thomas Wicker,German,BIO 710 Group seminar,Monday,Morning,11,12
Fachdidaktik Deutsch II (Weber),090De2,Seminar,Christine Weber,German,Subject Didactics German II,Monday,Morning,10,12
Fachdidaktik Deutsch II (Wampfler),090De2,Seminar,Philippe Wampfler,German,Subject Didactics German II,Monday,Morning,10,12
Fachdidaktik Deutsch III: Leistungsbeurteilung,090De3,Seminar,Christine Weber,German,Subject Didactics German III (3 ECTS),Monday,Morning,8,9
Professionelle Fähigkeiten im Journalismus,254l124a,Seminar,Juliane Lischka,German,Professional Skills in Journalism,Monday,Morning,10,12
Politische Informationen und Digitale Plattformen,254l511a,Course,Jakob Ohme,German,Political Information and Digital Platforms,Monday,Afternoon,12,13
Français B1 : Mise à niveau,_F_MB1,Sprachkurs,Cyril Destefani,French,Français B1 : Mise à niveau,Monday,Afternoon,12,13
Français B2 : Mise à niveau,_F_MB2,Sprachkurs,Cyril Destefani,French,Français B2 : Mise à niveau,Monday,Evening,18,19
Français A2-B1 : Cours de base,_F_CAB,Sprachkurs,Cyril Destefani,French,Français A2-B1 : Cours de base,Monday,Afternoon,16,17
Fachdidaktik Geographie I (Rafflenbeul),090Geo1,Seminar,Julia Rafflenbeul Herren,German,Subject Didactics Geography I,Monday,Morning,10,12
Fachdidaktik Geographie I (Hesske),090Geo1,Seminar,Stefan Hesske,German,Subject Didactics Geography I,Monday,Morning,10,12
Basic German 3; A2,_D_GA21,Sprachkurs,Stefanie McKenna,German,German 3: A2.1,Monday,Afternoon,16,17
Theoretical Astrophysics,AST512.1,Course,Robert Feldmann,English,AST 512 Theoretical Astrophysics,Monday,Morning,10,12
Exercises Theoretical Astrophysics,AST512.2,Exercise Group,Robert Feldmann,English,AST 512 Theoretical Astrophysics,Monday,Afternoon,13,14
Introduction to Astrobiology,AST201.1,Course,"Florian Kehl, Jennifer Wadsworth",English,AST 201 Introduction to Astrobiology,Monday,Afternoon,13,14
Praktikum Einsatz der Computersimulation in den Naturwissenschaften I,ESC201.2,Praktikum,Stefan Schafroth,English,ESC 201 Introduction to Computer Simulations I,Monday,Afternoon,14,17
Phonetic Data Analysis,521-010a,Seminar,Dieter Andreas Studer,English,Phonetic Data Analysis,Monday,Morning,10,12
Statistik 1 (Teil 1),200-001a,Course,Marina Haller,German,"Introduction to Statistics and Emotional, Motivational and Social Psychology",Monday,Afternoon,14,15
Emotionspsychologie,200-001b,Course,Andrea Beatrix Horn Wintsch,German,"Introduction to Statistics and Emotional, Motivational and Social Psychology",Monday,Morning,8,9
Fachdidaktik Physik I,090Phy1,Seminar,Andrea Michael Oettli,German,Subject Didactics Physics I,Monday,Afternoon,14,15
Fachdidaktik Religion III: Einsatz von Spielfilmsequenzen im Fach Religion,090Rel3,Seminar,Karel Hanke,German,Subject Didactics Religion III (3 ECTS),Monday,Morning,8,9
"Seminar: Bioethics, Biolaw and Emerging Technologies",120BA-2,Seminar,Roberto Andorno,English,Bachelor's Thesis,Monday,Morning,8,17
Machine Learning for Natural LanguageProcessing 1,521-505a,Tutorat,Simon Clematide,English,Machine Learning for Natural Language Processing 1,Monday,Afternoon,16,18
Machine Learning for Natural LanguageProcessing 1,521-505a,Course,Simon Clematide,English,Machine Learning for Natural Language Processing 1,Monday,Afternoon,14,15
Artificial Intelligence for Language Accessibility,521-532a,Lecture with Practical Exercises,Sarah Ebling,English,Artificial Intelligence for Language Accessibility,Monday,Morning,10,12
Mathematische Grundlagen der Computerlinguistik 2,521l001a,Lecture with Practical Exercises,"Lena Sophia Bolliger, Marius Huber",English,Mathematical Foundations of Computational Linguistics 2,Monday,Afternoon,12,13
"Seminar: Bioethics, Biolaw and Emerging Technologies",90MA-2,Seminar,Roberto Andorno,English,Master's Thesis,Monday,Morning,8,17
Intermediate Python Programming,DSI_IPP,Course,Alberto Bacchelli,English,Intermediate Python Programming,Monday,Morning,9,12
Einführung in die Rechtswissenschaft Gruppe 1,60PM1-1,Course,Hans-Ueli Vogt,German,Introduction to Law,Monday,Afternoon,12,13
Einführung in die Rechtswissenschaft Gruppe 2,60PM1-1,Course,Matthias Mahlmann,German,Introduction to Law,Monday,Afternoon,14,15
Begleitseminar Einführung Germanistische Linguistik A (Gruppe 1),360-101a,Seminar,Eyal Liron Dolev,German,Introduction to German Linguistics A,Monday,Morning,10,12
Begleitseminar Einführung Germanistische Linguistik A (Gruppe 2),360-101a,Seminar,Xenia Bojarski,German,Introduction to German Linguistics A,Monday,Afternoon,12,13
Good Statistical Practice,STA472,Course,"Reinhard Furrer, Eva Furrer",English,STA 472 Good Statistical Practice,Monday,Afternoon,16,18
Exercises Statistical Modeling,STA121.2,Exercise Group,N/A,English,STA 121 Statistical Modeling,Monday,Afternoon,12,13
Statistical Methods for the Analysis of Microarray and Short-Read Sequencing Data,STA426.2,Exercise Group,"Hubert Rehrauer, Mark D. Robinson",English,STA 426DP Statistical Analysis of High- Throughput Genomic and Transcriptomic Data,Monday,Morning,11,12
Statistical Modeling,STA121.1,Course,Zofia Baranczuk-Turska,English,STA 121 Statistical Modeling,Monday,Morning,10,11
Statistical Analysis of High-Throughput Genomic and Transcriptomic Data,STA426.1,Course,"Hubert Rehrauer, Mark D. Robinson",English,STA 426DP Statistical Analysis of High- Throughput Genomic and Transcriptomic Data,Monday,Morning,9,11
Analysis III,MAT221.1,Course,Corinna Ulcigrai,English,MAT 221 Analysis III,Monday,Afternoon,13,14
Topology,MAT701.1,Course,Joseph Ayoub,English,MAT 701 Topology,Monday,Morning,10,12
Lineare Algebra für die Naturwissenschaften,MAT141.1,Course,Christoph Luchsinger,English,MAT 141 Linear Algebra for Natural Sciences,Monday,Morning,10,12
Analysis I,MAT121.1,Course,Alexander Gorodnik,German,MAT 121 Analysis I,Monday,Afternoon,13,14
Complex Networks Theory and Applications,MAT933.1,Course,N/A,English,MAT 933DP Complex Networks Theory and Applications,Monday,Morning,10,12
Programming,MAT101.1,Course,Gauthier Wissocq,English,MAT 101 Programming,Monday,Morning,8,9
Contemporary Analysis for Ecology,EEE352,Course,Pascal Niklaus,English,EEE 352 Contemporary Analysis for Ecology,Monday,Afternoon,13,14
Einführung in die Neuere deutsche Literaturwissenschaft: Begleitseminar 5,360-104a,Seminar,Urs Giezendanner,German,Introduction to Modern German Literature,Monday,Afternoon,14,15
Primate Evolutionary Biology,BIO201,Course,"Judith Maria Burkart, Kathelijne Koops, Simon William Townsend, Anton Weingrill, Erik Willems",English,BIO 201 Primate Evolutionary Biology,Monday,Afternoon,14,15
Molekulare und klassische Genetik Vorlesung,BIO111.1,Lecture with Practical Exercises,"Konrad Basler, Bernd Bodenmiller, Monika Hediger Niessen, Denise Hengartner",German,BIO 111 Molecular and Classical Genetics,Monday,Morning,8,9
Student Research Retreat in Microbiology and Immunology,BME644,Doktorandenseminar,"Rolf Kümmerli, Salomé Leibundgut-Landmann",English,BME 644 Student Research Retreat in Microbiology and Immunology,Monday,Morning,8,17
Von Affenmenschen und Menschenaffen,BIO214,Course,Hans-Konrad Schmutz,German,BIO 214 Of ape men and man apes,Monday,Morning,10,12
"Evolution of the Human Brain, Cognition, and Language",BIO219,Course,Lucio Vinicius Castilho,English,"BIO 219 Evolution of the Human Brain, Cognition, and Language",Monday,Afternoon,12,13
Anthropological Seminar Series,BIO551,Colloquium,"Judith Maria Burkart, Anton Weingrill",English,BIO 551 Anthropological Seminar Series,Monday,Afternoon,16,17
Hydrological Modelling and Programming,GEO475.2,Lecture with Practical Exercises,"Math.-naturwiss. Fakultät N.N.-Dozent, Jan Seibert, Maria Staudinger, Marc Vis, Massimiliano Zappa",English,GEO 475 Hydrological Modelling and Programming,Monday,Morning,10,12
"FR.S410.2 Linguistique française I, Groupe 2",390x410a,PHZH SEK I Module,Harald Völker,French,French Linguistics I,Monday,Morning,8,9
"FR.S410.1 Linguistique française I, Groupe 1",390x410a,PHZH SEK I Module,Harald Völker,French,French Linguistics I,Monday,Morning,10,12
EN.S410 English Linguistics I,440x410a,PHZH SEK I Module,Annina Seiler Rübekeil,English,EN.S410 English Linguistics I,Monday,Morning,10,12
"GGP.S410.1 Grundkurs Geschichte 1, Gruppe 1",600x410a,PHZH SEK I Module,Andrea Scherer,German,GGP.S410: Basic Course History 1,Monday,Afternoon,14,15
"GGP.S410.3 Grundkurs Geschichte 1, Gruppe 3",600x410a,PHZH SEK I Module,Andrea Scherer,German,GGP.S410: Basic Course History 1,Monday,Afternoon,16,18
Ältere deutsche Literatur – Grundlagen und Methoden (Seminar 1),360-109a,Seminar,Damaris Leimgruber,German,Medieval and Early Modern German Literature - Basics and Methods,Monday,Afternoon,14,15
Geschlechtercodierungen in der Literatur aus der Schweiz,360-113a,Colloquium,Martina Wernli,German,Literature in Switzerland,Monday,Afternoon,14,15
Forschungskolloquium Lehrstuhl Schneider,360l557a,Colloquium,Sabine Schneider,German,Forschungskolloquium Lehrstuhl Schneider,Monday,Afternoon,16,18
Illustrations in Natural History,BIO271,Course,Christian Klug,German,BIO 271 Illustrations in Natural History,Monday,Afternoon,16,17
Evolution and Paleobiology of Plants,BIO265,Lecture with Practical Exercises,Elke Schneebeli,English,BIO 265 Evolution and Paleobiology of Plants,Monday,Afternoon,14,16
Proseminar Theoretische Physik,PHY391.1,Proseminar,Peter Stoffer,German,PHY 391 Proseminar Theoretical Physics,Monday,Morning,10,12
3D Modelling,683l014a,Sonstiges,Philosophische Fakultät N.N.-Dozent,English,Computer Applications,Monday,Afternoon,14,19
Kunst- und Kulturrecht,90GL9-1,Course,Christoph Beat Graber,German,Art Law and Culture,Monday,Afternoon,12,13
"Legal Theory - Law between Neuroscience, Psychology and Behavioral Economics",90GL14-1,Course,Matthias Mahlmann,English,Legal Theory,Monday,Morning,10,12
Typologies of Linguistic Structures,272-518a,Seminar,Stefan Schnell,English,Typologies of Linguistic Structures,Monday,Afternoon,16,18
Linguistic Analysis and Annotation – Practical Application,272-515a,Exercise Group,John Mansfield,English,Linguistic Analysis and Annotation – Practical Application,Monday,Morning,10,12
Gesellschaftsrecht Gruppe 1,120PM4-1,Course,"Lukas Müller, Rolf Sethe",German,Company Law for future notaries,Monday,Afternoon,12,13
Principles of Corporate Law,90CL4-1,Course,"Kern Alexander, David Bertrand Roth",English,Mobility Exam Principles of Corporate Law (MLaw),Monday,Afternoon,14,15
Contract Design I,90WM4-1,Lecture with Practical Exercises,Alexander Stremitzer,English,Contract Design I,Monday,Afternoon,16,18
Strafrecht AT I Gruppe 1,60PM7-1,Course,Gunhild Barbara Godenzi,German,"Criminal Law I, Part 1 (no exam registration)",Monday,Morning,10,12
Strafrecht AT I Gruppe 2,60PM7-1,Course,Felix Bommer,German,"Criminal Law I, Part 1 (no exam registration)",Monday,Morning,10,12
"Nature, Money, Empire: Japanese Moral Philosophy at the Turn of the 19th Century",290l613a,Seminar,Raji Steineck,English,"Nature, Money, Empire: Japanese Moral Philosophy at the Turn of the 19th Century",Monday,Afternoon,16,18
Advanced English for academic purposes,_E_AdvE,Sprachkurs,David Camorani,English,Advanced English for academic purposes,Monday,Afternoon,12,13
Advanced English for academic purposes,_E_AdvE,Sprachkurs,David Camorani,English,Advanced English for academic purposes,Monday,Afternoon,14,15
Advanced writing workshop C1-C2 (7 sessions) (English),_E_AWrW,Sprachkurs,Kimberly Lewis,English,Advanced writing workshop,Monday,Afternoon,12,13
Doctoral and research writing C1-C2 (English),_E_ZWdr,Sprachkurs,Kimberly Lewis,English,Doctoral and research writing,Monday,Afternoon,16,18
Militärstrafrecht,120WM2-1,Course,Stefan Flachsmann,German,Military Criminal Law,Monday,Afternoon,14,15
European Criminal Law,90IL3-1,Course,Lukas Staffler,English,Mobility Exam European Criminal Law (MLaw),Monday,Afternoon,16,18
Advanced writing and speaking C1-C2 (English),_E_AWrSC,Sprachkurs,Kimberly Lewis,English,Advanced writing and speaking C1-C2 (English),Monday,Afternoon,14,15
Literarische Lektüre: Gegenwartsliteratur Japans,290-012a,Exercise Group,Daniela Tan,German,Readings in Japanese Literature,Monday,Afternoon,14,15
Cambridge C2 Proficiency test preparation C1-C2 (English),_E_C2PE,Sprachkurs,Paschal Maher,English,Cambridge C2 Proficiency preparation,Monday,Afternoon,12,13
English for work B2-C1,_E_ZWork,Sprachkurs,Paschal Maher,English,English for work B2-C1,Monday,Afternoon,17,18
Digital Transformation - a Scientific Overview,DSI_DTOR,Seminar,Michael Coors,English,Digital Transformation - a Scientific Overview,Monday,Afternoon,16,18
Teamwork on Digital Transformation Challenges I,DSI_DTC1,Seminar,"Ursula Brack, Markus Christen, Eva Furrer, Titus Mangham-Neupert",English,Teamwork on Digital Transformation Challenges I,Monday,Afternoon,14,15
Kriminaltechnik - Naturwissenschaftliche Forensik und Rechtsmedizin,90WM19-1,Course,"Jörg Arnold, Christian Bogdal, Michael Thali",German,Forensic Science and Medicine,Monday,Afternoon,14,15
Allgemeines Verwaltungsrecht Gruppe 1,120PM6-1,Lecture with Practical Exercises,Alain Griffel,German,"Public Law II, Part 1 (no exam registration)",Monday,Morning,10,12
Europarecht Gruppe 1,120PM7-2,Course,Matthias Oesch,German,"Public International Law/European Law, Part 1 (no exam registration)",Monday,Afternoon,14,15
Bewegungsapparat,.121_bw,Lecture with Practical Exercises,"Giuliano Corte, Mariusz Pawel Kowalewski, Michael Weishaupt",German,Locomotory System,Monday,Morning,8,10
Analytische Hörpraxis,760-004a,Exercise Group,Doris Lanz,German,Analytical Listening,Monday,Afternoon,14,15
"Ovid, Heroides (Proseminar lateinische Literatur)",323l003a,Seminar,Beate Beer,German,"Ovid, Heroides (Proseminar Latin Literature)",Monday,Afternoon,14,15
Angewandte Medien- und Publikumsforschung,254-050a,Course,"Florin Büchel, Mirko Marr",German,Applied Media and Audience Research,Monday,Afternoon,16,18
Angewandte Akustik und Physiologie des Ohres,760l009a,Exercise Group,"Jörg Bohlender, David Bächinger, Dorothe Veraguth",German,Applied acoustics and physiology of the ear,Monday,Morning,10,12
Altitalische Textlektüre (Seminar lateinische Linguistik),323l015a,Seminar,Florian Sommer,German,Italic Texts (Seminar Latin Linguistics),Monday,Afternoon,14,15
PhD Course: Market Design HS24,DOEC1156,Course,Marek G. Pycia,English,PhD Course: Market Design HS24,Monday,Afternoon,16,18
Paläographie I: Die lateinische Schrift vor der Karolingerzeit,324l505a,Exercise Group,Carmen Cardelle,German,Paleography I: The Latin Scripts before the Carolingian Era,Monday,Afternoon,16,18
Current Debates in Social Anthropology,721-500a,Seminar,Johannes Quack,English,Current Debates in Social Anthropology,Monday,Afternoon,14,15
Macroeconomics for Research Students Part I (Ph.D.) (L),DOEC0380,Course,"David Hémous, Florian Scheuer",English,Macroeconomics for Research Students Part I (Ph.D.) (L+E),Monday,Morning,10,12
Macro Reading Group (S),DOEC6125,Doktorandenseminar,"Timo Boppart, Maya Eden, Alessandro Ferrari, David Hémous, Andreas Müller, Florian Scheuer",English,Macro Reading Group (S),Monday,Afternoon,13,14
Introductory Course Neuroscience I (HS),SPV0Y050,Course,"Irmgard Amrein, Csaba Földy, Nathalie Régine Giroud Rickenbacher, Benjamin Grewe, Fritjof Helmchen, Sebastian Jessberger, Theofanis Karayannis, Daniel Ch. Kiper, Martin Müller, Stephan Neuhauss, Tina Fabia Notter, Christopher Pryce, Bruno Weber",English,Introductory Course Neuroscience I,Monday,Afternoon,16,18
Forschungskolloquium über klinische Grundlagenforschung für Doktorierende und Assistierende,BCH0Y030,Colloquium,"Matthias Baumgartner, Alessio Cremonesi, Sean Froese, Cecilia Giunta Meyer, Martin Hersberger, Johannes Häberle, Raphael Morscher, Martin Werner Poms, Marianne Rohrbach, Susanna Sluka, Beat Thöny",German,"Kolloquium Fundamental research in clinical Biochemistry (for doctoral students,",Monday,Morning,9,10
Klinisch-biochemisches Kolloquium,BCH0Y020,Colloquium,"Matthias Baumgartner, Alessio Cremonesi, Francesca Daniela Franzoso, Sean Froese, Cecilia Giunta Meyer, Martin Hersberger, Johannes Häberle, Daniel Konrad, Raphael Morscher, Martin Werner Poms, Marianne Rohrbach, Susanna Sluka, Beat Thöny, Stephan Wüest",German,Kolloquium in clinical Biochemistry,Monday,Afternoon,16,17
Introductory Course in Neuroscience II ( FS),SPV0Y020,Course,"Marc Bolliger, Annette Brühl, Armin Curt, Todd Anthony Hare, Marcus Herdener, Michèle Hubli, Hans-Jürgen Huppertz, Lukas Imbach, Daniel Ch. Kiper, Martin Kurthen, Andreas Luft, Jens Petersen, Boris B. Quednow, Luca Regli, Christian Ruff, Martin Schubert, Dominik Straumann, Philippe Tobler, Konrad Peter Weber",English,Introductory Course in Neuroscience II ( FS),Monday,Afternoon,17,19
Kolloquium über aktuelle Hirnforschung,SPV0Y030,Colloquium,"Csaba Földy, Fritjof Helmchen, Sebastian Jessberger, Theofanis Karayannis, Isabelle Mansuy",German,"Kolloquium über aktuelle Hirnforschung, im Institut",Monday,Afternoon,12,13
Doing Research in Operations Management HS24,DOEC1161,Doktorandenseminar,"Christiane Barz, Oleg Prokopyev, Tarkan Tan",English,Doing Research in Operations Management HS24,Monday,Afternoon,14,15
Demokratie und Erziehung,234-505a,Seminar,Lisa Dillinger,German,Democracy and Education,Monday,Afternoon,16,18
Poliklinische Visite,DER0M040,Kurs,"Florian Anzengruber, Marjam Barysch-Bonderer, Marie-Charlotte Brüggen, Antonio Cozzio, Florentia Dimitriou, Reinhard Dummer, Simone Maria Goldinger, Christian Greis, Emmanuella Guenova, Jürg Hafner, Günther Hofbauer, Laurence Imhof, Lukas Krähenbühl, Isabelle Luchsinger, Ioanna Mangana, Julia-Tatjana Maul, Lara Maul-Duwendag, Barbara Meier-Schiesser, Thierry Nordmann, Martin Raphael Theiler Pang",German,Poliklinische Visite,Monday,Afternoon,12,12
Kolloquium Psychotherapie undPsychosomatik,PSY0M050,Colloquium,"David Briner, Sebastian Euler, Lena Jellestad, Roland von Känel",German,Kolloquium Psychotherapie und Psychosomatik,Monday,Morning,11,12
Psychophysiologie psychotroper Substanzen,PSY0M030,Course,"Simone Grimm, Michael Kometer, Rainer Krähenmann, Katrin Preller",German,Psychophysiologie psychotroper Substanzen,Monday,Afternoon,13,14
Forschungskolloquium für Doktoranden,PSY0M100,Colloquium,Susanne Walitza,German,Forschungskolloquium für Doktoranden,Monday,Afternoon,12,14
Journal Club der Abteilung Virale Immunbiologie des Instituts für Experimentelle Immunologie,IMM17006,Seminar,Christian Münz,German,Journal Club der Abteilung Virale Immunbiologie des Instituts für Experimentelle,Monday,Morning,9,12
Network Science (L+E),22MI0019,Lecture with Practical Exercises,Claudio Tessone,English,Network Science (L+E),Monday,Morning,8,12
Development Economics (E),22BO0119,Exercise Group,Matteo Machiorlatti,English,Development Economics (L+E),Monday,Afternoon,16,18
Chronological Modelling,683l010a,Sonstiges,Eythan Levy,English,Chronological Modelling,Monday,Afternoon,16,18
Corporate Finance (PhD),DFOEC007,Course,"Kjell G. Nyborg, Alexander Wagner",English,Corporate Finance (PhD),Monday,Morning,9,12
PhD Course: Behavioral Economics (L),DOEC0802,Course,Roberto A. Weber,English,PhD Course: Behavioral Economics (L),Monday,Morning,10,12
Faculty Research for Graduate Students (S),DOEC6110,Doktorandenseminar,Wirtschaftswiss. Fakultät N.N.-Dozent,English,Faculty Research for Graduate Students (S),Monday,Afternoon,16,18
Intermediate Statistics (L),22MO0059,Course,Michael Wolf,English,Intermediate Statistics (L+E),Monday,Afternoon,16,18
Economics of Child and Youth Development (S),22MO0229,Seminar,Ulf Zölitz,English,Economics of Child and Youth Development (S),Monday,Afternoon,14,15
Arbeitsmarktökonomik (V) (Laboreconomics),22BO0047,Course,Josef Zweimüller,German,Arbeitsmarktökonomik (V + Ü) (Labor economics),Monday,Afternoon,14,15
Fundamentos de la Narratología (grupo 1),427-001a,Seminar,Roberto Mejias Méndez,Spanish,Fundamental Principles of Literary Analysis,Monday,Afternoon,14,15
Análisis Discursivo de Textos Literarios Españoles: Algunos Minicuentos del Siglo XX,427-004a,Seminar,Itziar Lopez Guil,Spanish,Analysis of Spanish Literary Texts,Monday,Afternoon,12,13
Spracherwerb Schwedisch a,360-206a,Sprachkurs,Anna Schaffner,"German, Swedish",Swedish Language Acquisition,Monday,Morning,10,12
Grundlagen der Sinologie,280-001a,Exercise Group,"Brigit Knüsel Adamec, Rafael Suter",German,Introduction to Sinology,Monday,Morning,10,12
