Event Name,Event Code,Event Type,Instructor,Course Languages,Component of Module,Weekday,Daytime,Start Time,End Time
N/A,N/A,N/A,N/A,N/A,N/A,N/A,N/A,N/A,N/A
Forschungsseminar Protein Engineering,BCH802,Forschungsseminar,Andreas Plückthun,English,N/A,Thursday,Morning,8,12
Research Seminar Protein Dynamics (Progress Report),BCH805,Forschungsseminar,Benjamin Schuler,English,N/A,Monday,Afternoon,13,15
Research seminars,BCH405,Seminar,"Amedeo Caflisch, Raimund Dutzler, Martin Jinek, Ohad Medalia, Andreas Plückthun, Benjamin Schuler",English,BCH 405 Research seminars,Thursday,Afternoon,16,18
Blockcourse: Social science Research projects,44LM001,Block Course,Dorothea Lüddeckens,German,Social science Research projects,N/A,N/A,N/A,N/A
"Marathon Reading of Spenser’s ‘Faerie Queene’ plus one-day symposium at the University of Tampere, Finland",440l524a,Field Trip,Antoinina Bevan Zlatar,English,Marathon Reading of Spenser’s_land [s17],N/A,N/A,N/A,N/A
"Bestandesmedizin, Geflügel",.470_gf,Course,N/A,German,"Prophylactic Measures, Herd Health, Swine Medicine, Poultry",N/A,N/A,N/A,N/A
Bachelorarbeit,255-BAa,Bachelor Paper,N/A,German,Bachelor's Thesis,N/A,N/A,N/A,N/A
Waldarchäologie III,682l109a,Praktikum,"Jonas Miro Blum, Philippe Della Casa, Timo Leonardo Geitlinger, Igor Medaric",German,Short Internship: Forest Archaeology III,N/A,N/A,N/A,N/A
Erkenntnistheorie (Vertiefung) (Bausman),160-512a,Selbststudium mit Leistungsnachweis,William Bausman,German,Epistemology (advanced),N/A,N/A,N/A,N/A
Philosophie der Naturwissenschaften (Bausman),164-503a,Selbststudium mit Leistungsnachweis,William Bausman,German,Philosophy of natural science,N/A,N/A,N/A,N/A
Philosophie der Geistes- und Sozialwissenschaften (Bausman),164-504a,Selbststudium mit Leistungsnachweis,William Bausman,German,Philosophy of the humanities and social sciences,N/A,N/A,N/A,N/A
Onboarding Incomings,200-999a,Sonstiges,N/A,English,Onboarding Incomings,N/A,N/A,N/A,N/A
Bachelor Thesis Literature (Bevan),440-BAa,Bachelor Paper,N/A,English,Bachelor's Thesis,N/A,N/A,N/A,N/A
Bachelor Thesis Linguistics (Seiler),440-BAa,Bachelor Paper,N/A,English,Bachelor's Thesis,N/A,N/A,N/A,N/A
"Klinischer Kurs Innere Medizin, im Kantonsspital Uri",KUR416e,Exercise Group,"Constantine Bloch-Infanger, Astrid Hurni, Daniela Zwierzina",German,"Clinical Courses III: Gynecology &amp; Obstetrics or Pediatrics, Family Medicine,",N/A,N/A,N/A,N/A
Practical course FIT (Field-specific Information Toolbox),OEG1020,Praktikum,Martina Gosteli Eichenberger,German,Practical Course in Biostatistics  /Practical course FIT (Field-specific Information,N/A,N/A,N/A,N/A
Allgemeine Ethik (Surber),160-014a,Selbststudium mit Leistungsnachweis,Regina Surber,German,Normative ethics,N/A,N/A,N/A,N/A
Forschungskolloquium Slavistische Literaturwissenschaft (für Doktorierende),483G405a,Colloquium,Sylvia Sasse,German,Research Colloquium Slavonic Literatures (for PhD Candidates),N/A,N/A,N/A,N/A
Politische Philosophie (Vertiefung) (Gläser),160-510a,Selbststudium mit Leistungsnachweis,Micha Bernhard Gläser,German,Political philosophy (advanced),N/A,N/A,N/A,N/A
Grundlagen des Rechts,IUS_AD27,Colloquium,José Luis Alonso,German,Grundlagen des Rechts. Kolloquium für Doktorierende und Habilitierende,N/A,N/A,N/A,N/A
iPSZürich Lecture,IRM21001,Seminar,Melanie Generali,German,iPSZürich Lecture,N/A,N/A,N/A,N/A
Basiskompetenz Kunstgeschichte Ostasiens,642-003a,Selbststudium mit Leistungsnachweis,N/A,"German, English",Foundation in East Asian Art History,N/A,N/A,N/A,N/A
Bachelor Thesis Linguistics (Studer-Joho),440-BAa,Bachelor Paper,N/A,English,Bachelor's Thesis,N/A,N/A,N/A,N/A
Master Thesis Linguistics (Studer-Joho),440-MAa,Master Paper,N/A,English,Master's Thesis,N/A,N/A,N/A,N/A
Master Thesis Linguistics (Dellwo),440-MAa,Master Paper,N/A,English,Master's Thesis,N/A,N/A,N/A,N/A
Bachelor Thesis Linguistics (Zehentner),440-BAa,Bachelor Paper,N/A,English,Bachelor's Thesis,N/A,N/A,N/A,N/A
Master Thesis Literature (Verstl),440-MAa,Master Paper,N/A,English,Master's Thesis,N/A,N/A,N/A,N/A
Master Thesis Literature (Tjon-A-Meeuw),440-MAa,Master Paper,N/A,English,Master's Thesis,N/A,N/A,N/A,N/A
Bachelor Thesis Literature (Essi),440-BAa,Bachelor Paper,N/A,English,Bachelor's Thesis,N/A,N/A,N/A,N/A
Master Thesis Literature (Essi),440-MAa,Master Paper,N/A,English,Master's Thesis,N/A,N/A,N/A,N/A
Bachelor Thesis Literature (Castelli),440-BAa,Bachelor Paper,N/A,English,Bachelor's Thesis,N/A,N/A,N/A,N/A
Anthropology of Indonesia,721l280a,Seminar,Annuska Derks,English,Anthropology of Southeast Asia,Friday,Afternoon,12,13
In the American Grain: Walt Whitman and Emily Dickinson,440l510a,Seminar,Philip Gerard,English,In the American Grain: Walt Whitman and Emily Dickinson,Friday,Morning,10,12
Statistik 3 (Tutorat),200-500a,Tutorat,Charles Driver,German,Statistics 3,N/A,N/A,N/A,N/A
R Programming Skills,615l514a,Seminar,Benjamin Schlegel,German,R Programming Skills,Friday,Morning,10,12
Direkte Demokratie - Segen oder Fluch?,615l522a,Seminar,Deniz Danaci,German,Direct Democracy - Benefits and Drawbacks,Friday,Afternoon,12,13
Kantonale Wahlen und Abstimmungen,615l524a,Seminar,Tomislaw Milic,German,Elections and Votes in the Swiss Cantons,Friday,Afternoon,14,15
International Climate Policy,615l527a,Seminar,Paula Monica Castro Pareja,English,International Climate Policy,Friday,Morning,10,12
Praktikum,615l550a,Praktikum,N/A,German,Internship,N/A,N/A,N/A,N/A
Praktikum,615l551a,Praktikum,N/A,German,Internship,N/A,N/A,N/A,N/A
Praktikum,615l552a,Praktikum,N/A,German,Internship,N/A,N/A,N/A,N/A
Praktikum,615l553a,Praktikum,N/A,German,Internship,N/A,N/A,N/A,N/A
Praktikum,615l554a,Praktikum,N/A,German,Internship,N/A,N/A,N/A,N/A
Capstone: Developing a Multilateral Negotiation Simulation,615l601a,Seminar,Stefanie Walter,English,Capstone: Developing a Multilateral Negotiation Simulation,N/A,N/A,N/A,N/A
Capstone: Heimat neu erzählen - Alternative nationale Narrative für die Schweiz,615l602a,Seminar,Karsten Donnay,German,Capstone: Retelling Heimat - Alternative national narratives for Switzerland,N/A,N/A,N/A,N/A
Written Paper in Neurolinguistics and Psycholinguistics,272-523a,Selbststudium mit Leistungsnachweis,N/A,"German, English",Written Paper in Neurolinguistics and Psycholinguistics,N/A,N/A,N/A,N/A
Assessed Work Neurolinguistics and Psycholinguistics,272-526a,Praktikum,N/A,"German, English",Assessed Work Neurolinguistics and Psycholinguistics,N/A,N/A,N/A,N/A
Grammar Writing,272-514a,Selbststudium mit Leistungsnachweis,N/A,"German, English",Grammar Writing,N/A,N/A,N/A,N/A
Written Paper in Typological and Documentary Linguistics,272-516a,Selbststudium mit Leistungsnachweis,N/A,"German, English",Written Paper in Typological and Documentary Linguistics,N/A,N/A,N/A,N/A
Schriftliche Arbeit Sprachgeschichte,272-505a,Selbststudium mit Leistungsnachweis,N/A,"German, English",Written Paper in Language Diachrony,N/A,N/A,N/A,N/A
Schriftliche Arbeit Sprachursprung,272-511a,Selbststudium mit Leistungsnachweis,N/A,"German, English",Written Paper in Language Origin,N/A,N/A,N/A,N/A
Schriftliche Arbeit Sprachliche Ontogenese,272-508a,Selbststudium mit Leistungsnachweis,N/A,"German, English",Written Paper in Linguistic Ontogeny,N/A,N/A,N/A,N/A
Forschungspraktikum Mikrobiologie,BIO316,Praktikum,"Leo Eberl, Simona Huwiler, Jakob Pernthaler, Gabriella Pessi, Thomas Posch",German,BIO 316 Reserach Internship in Microbiology,N/A,N/A,N/A,N/A
Biochemistry of reactive oxygen species,CHE24001,Course,"Johanna Buschmann, Damir Kracun",English,Biochemistry of reactive oxygen species,N/A,N/A,N/A,N/A
"(G47) Masterarbeitsgruppe ""Komputationale Modellierung in der Psychologie""",200-901a,Exercise Group,Ven Popov,"German, English",Master's Working Group 1,N/A,N/A,N/A,N/A
"(G47) Forschungskolloquium ""Komputationale Modellierung in der Psychologie""",200-902a,Colloquium,Ven Popov,"German, English",Research Colloquium 1,N/A,N/A,N/A,N/A
"(G47) Masterprüfung ""Komputationale Modellierung in der Psychologie""",200-909a,Selbststudium mit Leistungsnachweis,Ven Popov,"German, English",Master's Exam,N/A,N/A,N/A,N/A
"(G47) Bachelorarbeit ""Komputationale Modellierung in der Psychologie""",200-BAa,Bachelor Paper,Ven Popov,German,Bachelor's Thesis,N/A,N/A,N/A,N/A
"(G47) Masterarbeit ""Komputationale Modellierung in der Psychologie""",200-MAa,Master Paper,Ven Popov,"German, English",Master's Thesis,N/A,N/A,N/A,N/A
Mantelstudium: Ernährungsmedizin,22MAS007,Course,"Luc Biedermann, David Blum, Sascha David, Michael Gagesch, Philipp Gerber, Johannes Häberle, Patrick Pasi, Carsten Posovszky, Katharina Christine Quack Lötscher, Marianne Rohrbach, Paolo M. Suter",German,Elective Module: Nutrition Medicine,N/A,N/A,N/A,N/A
Elective Module: Nutrition and Prevention,24MAS003,Seminar,"Sabine Rohrmann, Nina Steinemann",German,Nutrition and Prevention,N/A,N/A,N/A,N/A
Masterarbeit,615-MAa,Master Paper,N/A,German,Master's Thesis,N/A,N/A,N/A,N/A
Propädeutikum Kunstgeschichte Ostasiens,642-002a,Seminar,Stephanie Santschi,"German, English",Propadeuticum,Friday,Afternoon,14,15
PhD-Kolloquien der einzelnen Lehrstühle,226G830a,Colloquium,N/A,German,Research Colloquia PhD (without Presentation),N/A,N/A,N/A,N/A
Forschungslaboratorium Kulturanalyse 1,360-803a,Selbststudium mit Leistungsnachweis,N/A,German,Research Laboratory for Cultural Analysis 1,N/A,N/A,N/A,N/A
Forschungslaboratorium Kulturanalyse 2,360-804a,Selbststudium mit Leistungsnachweis,N/A,German,Research Laboratory for Cultural Analysis 2,N/A,N/A,N/A,N/A
Kulturanalytisches Forschungskolloquium,360-805a,Colloquium,Philosophische Fakultät N.N.-Dozent,German,PhD Research Colloquium Cultural Analysis,N/A,N/A,N/A,N/A
Masterarbeit,380-MAa,Master Paper,N/A,German,Master's Thesis,N/A,N/A,N/A,N/A
Spin Geometry,MAT782.1,Course,N/A,English,MAT 782 Spin Geometry,Friday,Afternoon,15,17
Eine Woche Hospitation in einer privatenZahnarztpraxis während den Semesterferien,ZPRAX_B,Praxiskurs,N/A,German,Internship Dental Clinic,N/A,N/A,N/A,N/A
Leben Schreiben: Ethnologische undliteraturwiss. Perspektiven,721k758a,Seminar,N/A,German,Writing Lives: Perspectives from Anthr. and Literary Studies,N/A,N/A,N/A,N/A
Schriftliche Arbeit zur Dynamik sprachlicher Vielfalt,272-009a,Selbststudium mit Leistungsnachweis,N/A,"German, English",Written Paper in Dynamics of Linguistic Diversity,N/A,N/A,N/A,N/A
Schriftliche Arbeit zur Indogermanistik,272-010a,Selbststudium mit Leistungsnachweis,N/A,"German, English",Written Paper in Indo-European Linguistics,N/A,N/A,N/A,N/A
Schriftliche Arbeit zu Sprache und kognitiven Prozessen,272-011a,Selbststudium mit Leistungsnachweis,N/A,German,Written Paper in Language and Cognitive Processes,N/A,N/A,N/A,N/A
Schriftliche Arbeit zur Sprachentwicklung,272-012a,Selbststudium mit Leistungsnachweis,N/A,"German, English",Written Paper in Language Development,N/A,N/A,N/A,N/A
Schriftliche Arbeit zu Sprache im Kontext,272-020a,Selbststudium mit Leistungsnachweis,N/A,"German, English",Written Paper in Language in Context,N/A,N/A,N/A,N/A
Projektarbeit,272-520a,Sonstiges,N/A,"German, English",Assessed Work,N/A,N/A,N/A,N/A
Doktoratskolloquium (Dusinberre),600G118a,Colloquium,Martin Dusinberre,German,Doctoral Colloquium (Dusinberre),N/A,N/A,N/A,N/A
Capstone: StatGuide – creating a digital platform for personalized methods education,615l603a,Seminar,"Florian Attinger, Yves Claude Bruchez, Benjamin Schlegel",English,Capstone: StatGuide – creating a digital platform for personalized methods education,N/A,N/A,N/A,N/A
Bachelorarbeit,360-BAa,Bachelor Paper,N/A,German,Bachelor's Thesis,N/A,N/A,N/A,N/A
Masterarbeit,360-MAa,Master Paper,N/A,German,Master's Thesis,N/A,N/A,N/A,N/A
Bachelorarbeit,370-BAa,Bachelor Paper,N/A,German,Bachelor's Thesis,N/A,N/A,N/A,N/A
Masterarbeit,370-MAa,Master Paper,N/A,German,Master's Thesis,N/A,N/A,N/A,N/A
Mechanismen der kindlichen Sprachentwicklung,272-507a,Seminar,N/A,"German, English",Mechanisms in Child Language Development,N/A,N/A,N/A,N/A
Linguistische Theorie in evolutionärer Perspektive,272-510a,Seminar,N/A,"German, English",Linguistic Theory in Evolutionary Perspective,N/A,N/A,N/A,N/A
Statistische Modellierung der Sprachdynamik,272-506a,Exercise Group,N/A,"German, English",Statistical Modeling of Language Dynamics,N/A,N/A,N/A,N/A
Feldforschung: Elizitationstechniken,272-513a,Exercise Group,N/A,"German, English",Field Methods: Elicitation Techniques,N/A,N/A,N/A,N/A
Strukturen in Sprachfamilien und Spracharealen,272-517a,Seminar,N/A,"German, English",Structures in Language Families and Areas,N/A,N/A,N/A,N/A
Sprache und Kognition,272-524a,Seminar,N/A,"German, English",Language and Cognition,N/A,N/A,N/A,N/A
Sprachverarbeitung,272-525a,Seminar,N/A,"German, English",Language Processing,N/A,N/A,N/A,N/A
Forschungskolloquium (Condrau),600-517a,Colloquium,Flurin Condrau,"German, English",Research Colloquium 1,N/A,N/A,N/A,N/A
Forschungskolloquium (Lin),600-517a,Colloquium,Yi-Tang Lin,English,Research Colloquium 1,N/A,N/A,N/A,N/A
Forschungskolloquium (Dusinberre),600-517a,Colloquium,Martin Dusinberre,English,Research Colloquium 1,N/A,N/A,N/A,N/A
Excursion:EastAsianArtCollectionsin the Netherlands,642l031a,Field Trip,Ewa Machotka,"English, German",Excursion:East Asian Art Collections in the Netherlands,N/A,N/A,N/A,N/A
Bachelorarbeit,640-BAa,Bachelor Paper,Bärbel Küster,German,Bachelor's Thesis,N/A,N/A,N/A,N/A
Masterarbeit,640-MAa,Master Paper,N/A,German,Master's Thesis,N/A,N/A,N/A,N/A
Masterarbeit,642-MAa,Master Paper,N/A,German,Master's Thesis,N/A,N/A,N/A,N/A
Masterarbeit,645-MAa,Master Paper,N/A,German,Master's Thesis,N/A,N/A,N/A,N/A
"Klinischer Kurs: Einblick in die Anästhesie am Stadtspital Zürich, Triemli",ANA24001,Kurs,"Nicole Hilber, Eckhard Mauermann",German,Klinischer Kurs: Einblick in die Anästh,N/A,N/A,N/A,N/A
LERU Theology &amp; Religious Studies Group,14SS042,Seminar,Konrad Schmid,English,LERU Theology &amp; Religious Studies Group,N/A,N/A,N/A,N/A
Von van Eyck bis Rubens. Flämische Malerei im räumlichen Kontext,640l047a,Field Trip,David Ganz,German,From van Eyck to Rubens. Flemish painting in a spatial context,N/A,N/A,N/A,N/A
Dialogues on Art and Modernism in Brazil,645l511a,Exercise Group,Charlotte Matter,English,Dialogues on Art and Modernism in Brazil,N/A,N/A,N/A,N/A
KU-UZH Joint Workshop in East Asian ArtHistory 2024,642l032a,Praktikum,Ewa Machotka,English,KU-UZH Joint Workshop in East Asian Art History 2024,N/A,N/A,N/A,N/A
Mantelstudium: Schwerpunkt ChiropraktikI A,MAS1110,Lecture with Practical Exercises,"Mirjam Baechler, Sarah Filliez, Erman Kücük, Tobias Potthoff, Patricia M. Schaller",German,Elective Module: Focus on chiropractic I A,N/A,N/A,N/A,N/A
MCM2a: Röntgen- Grundlagen und Theorie,CPRA224,Course,Tobias Reckling,German,"Chiropractic Courses MCM2a: Chiro Tech, NMS Diagnosis, Clin. Problem Solving,",N/A,N/A,N/A,N/A
Sportmedizin,CPPRA230,Lecture with Practical Exercises,"Stefan Fröhlich, Nora Wieloch",German,"Chiropractic Courses MCM2a: Chiro Tech, NMS Diagnosis, Clin. Problem Solving,",N/A,N/A,N/A,N/A
MCM2a: Klinische Neurologie,CPPRA209,Lecture with Practical Exercises,"Susanne Friedl, Luana Nyirö, Jan Rosner, Yulia Valko",German,"Chiropractic Courses MCM2a: Chiro Tech, NMS Diagnosis, Clin. Problem Solving,",N/A,N/A,N/A,N/A
Mantelstudium: Schwerpunkt ChiropraktikII A,MAS2110,Lecture with Practical Exercises,"Miklos Csato, Eveline Della Casa, Marco Ehrler, Anke Langenfeld Sickendieck",German,Elective Module: Focus on chiropractic II A,N/A,N/A,N/A,N/A
Mantelstudium: Schwerpunkt ChiropraktikIII a,MAS3110,Lecture with Practical Exercises,"Miklos Csato, Eveline Della Casa, Marco Ehrler, Jörg Spörri, Anita Staudenmann",German,Elective Module: Focus on chiropractic III A,N/A,N/A,N/A,N/A
Exkursion ans Stummfilmfestival Zürich,255l019a,Field Trip,Daniel Johannes Wiegand,German,Exkursion ans Stummfilmfestival Zürich,N/A,N/A,N/A,N/A
Bachelor Thesis Literature (Tjon-A-Meeuw),440-BAa,Bachelor Paper,N/A,English,Bachelor's Thesis,N/A,N/A,N/A,N/A
Short Internship: Englischsprachige Bücher einer historischen Kinderbuchsammlung,440l518a,Praktikum,Olivia Tjon-A-Meeuw,German,Short Internship: English Books in a Historical Children's Book Collection (Partner,N/A,N/A,N/A,N/A
Short Internship: Manuscripts and Monks on Wikipedia (Partner Institution: Stiftsbibliothek St. Gallen),440l519a,Praktikum,Nathalie Meyer,English,Short Internship: Manuscripts and Monks on Wikipedia (Partner Institution:,N/A,N/A,N/A,N/A
Advanced Research Internship in the VARIAGE Project,440l520a,Praktikum,Simone Pfenninger,English,Advanced Research Internship in the VARIAGE Project,N/A,N/A,N/A,N/A
Doctoral Colloquium in Corporate Finance,DOEC1190,Doktorandenseminar,Kjell G. Nyborg,English,Doctoral Colloquium in Corporate Finance II (S) HS24,Friday,Afternoon,14,15
(Wiederholungsprüfung) Fondamenti dilinguistica diacronica edialettologia,410-004a,Repetition exam (same semester),Federica Breimaier,Italian,Introduction to Diachronic Linguistics and Dialectology,N/A,N/A,N/A,N/A
Abaelard und Heloise (Mittellateinische Lektüre),324l600a,Exercise Group,N/A,German,Abelard and Heloise (Medieval Latin Reading Class),N/A,N/A,N/A,N/A
Praktikum SKAN,360l140a,Praktikum,Anna Katharina Richter,German,Praktikum SKAN [s80],N/A,N/A,N/A,N/A
"Klinischer Kurs Innere Medizin, im Spital Region Oberaargau",KUR416LT,Exercise Group,"Claudia Brun del Re, Jowita Bruno, Thomas Künzi, Mia Messi, Andreas Oestmann, Alexander Wenemoser",German,"Clinical Courses III: Gynecology &amp; Obstetrics or Pediatrics, Family Medicine,",N/A,N/A,N/A,N/A
"Internistischer Gruppenunterricht - stationär, im Spital Region Oberaargau",MED6020f,Kurs,N/A,German,"Clinical Courses V: Anesthesiology and Resuscitation, Surgery, Dermatology, Internal",N/A,N/A,N/A,N/A
Generative KI und visuelle Kultur,255l522a,Colloquium,Roland Meyer,German,Generative KI und visuelle Kultur,Friday,Afternoon,13,15
Kurse Pathologie IV,PAT6050,Klinischer Kurs,"Albert Baschong, Peter Karl Bode, Beata Bode, Catherine Connolly, Marc Emmenegger, Viktoria Szabina Hadnagy, Hanna Honcharova-Biletska, Chiara Adina Hummel, Johann Kristian Ikenberg, Francesca Maria Melega, Holger Moch, Michael Reinehr, Ugur Sahin-Zaugg, Christina Schnoz, Nadezda Velizheva, Viola Vetter, Paulina Volz, Paul Winkelmann",German,"Clinical Courses V: Anesthesiology and Resuscitation, Surgery, Dermatology, Internal",N/A,N/A,N/A,N/A
Masterarbeit,271-MAa,Master Paper,N/A,German,Master's Thesis,N/A,N/A,N/A,N/A
Einführung in die praktische Philosophie,160-004a,Exercise Group,Aline Rickli,German,Introduction to Practical Philosophy,Friday,Afternoon,14,15
Einführung in die Geschichte der Philosophie,160-009a,Exercise Group,Claire Field,German,Introduction to the history of philosophy,Friday,Morning,8,9
Doktorierendenkolloquium,506G905a,Colloquium,"Silvy Chakkalakal, Moritz Ege, Christine Lötscher, Bernhard Tschofen",German,PhD Colloquium,N/A,N/A,N/A,N/A
Theoretische Philosophie und Geschichte der Philosophie,160-503a,Colloquium,Katia Saporiti,German,Research Colloquium,Friday,Afternoon,14,15
Sozialversicherungsrecht,90WM28-1,Course,"Thomas Gächter, Michael Meier",German,Social Insurance Law,Friday,Morning,10,12
"(G02) Masterarbeitsgruppe ""Entwicklungspsychologie: Erwachsenenalter""",200-901a,Exercise Group,Alexandra M. Freund,"German, English",Master's Working Group 1,N/A,N/A,N/A,N/A
(G04) Masterarbeitsgruppe «Gerontopsychologie»,200-901a,Exercise Group,"Burcu Demiray, Myrto Dolcetti, Andrea Beatrix Horn Wintsch, Zilla Marie Huber, Minxia Luo, Mike Martin, Susan Mérillat, Sandra Oppikofer, Melanie Stahlmann","German, English",Master's Working Group 1,N/A,N/A,N/A,N/A
"(G05) Masterarbeitsgruppe ""Allgemeine Psychologie: Kognition""",200-901a,Exercise Group,Klaus Oberauer,"German, English",Master's Working Group 1,N/A,N/A,N/A,N/A
"(G06) Masterarbeitsgruppe ""Psychologische Methodenlehre, Evaluation und Statistik""",200-901a,Exercise Group,Carolin Strobl,"German, English",Master's Working Group 1,N/A,N/A,N/A,N/A
"(G07) Masterarbeitsgruppe ""Klinische Entwicklungspsychologie""",200-901a,Exercise Group,Lilly Shanahan,"German, English",Master's Working Group 1,N/A,N/A,N/A,N/A
"(G08) Masterarbeitsgruppe ""Methoden der Plastizitätsforschung""",200-901a,Exercise Group,Nicolas Langer,"German, English",Master's Working Group 1,N/A,N/A,N/A,N/A
"(G09) Masterarbeitsgruppe ""Allgemeine Psychologie: Motivation""",200-901a,Exercise Group,"Sebastian Ferdinand Bürgler, Matthias Forstmann, Miriam Pfister, Julia Katharina Schäfer","German, English",Master's Working Group 1,N/A,N/A,N/A,N/A
"(G11) Masterarbeitsgruppe ""Arbeits- und Organisationspsychologie""",200-901a,Exercise Group,"Johanna Bayon, Martin Kleinmann, Barbara Körner, Annika Schmitz-Wilhelmy, Valerie Schröder, Anna Luca Stuart, Nina Wegmann-Beck, Nathalie von Rooy","German, English",Master's Working Group 1,N/A,N/A,N/A,N/A
"(G13) Masterarbeitsgruppe ""Angewandte Sozial- und Gesundheitspsychologie""",200-901a,Exercise Group,"Walter Bierbauer, Timon Elmer, Daniel Hausmann-Thürig, Patrick Höhener, Pascal Küng, Konstantin Schenkel, Karoline Villinger","German, English",Master's Working Group 1,N/A,N/A,N/A,N/A
"(G14) Masterarbeitsgruppe ""Sozialpsychologie""",200-901a,Exercise Group,"Léïla Eisner, Tabea Hässler, Simone Sebben, Robert Tobias, Johannes Ullrich","German, English",Master's Working Group 1,N/A,N/A,N/A,N/A
"(G15) Masterarbeitsgruppe ""Klinische Psychologie mit Schwerpunkt Kinder/Jugendliche und Paare/Familien""",200-901a,Exercise Group,"Guy Bodenmann, Christina Breitenstein, Isabelle Häberling, Elisa Weber, Fabienne Seline Verena Wehrli, Katharina Weitkamp, Natascha Wettstein","German, English",Master's Working Group 1,N/A,N/A,N/A,N/A
"(G16) Masterarbeitsgruppe ""KlinischePsychologie &amp; Psychotherapie""",200-901a,Exercise Group,Ulrike Ehlert,"German, English",Master's Working Group 1,N/A,N/A,N/A,N/A
"(G17) Masterarbeitsgruppe ""Gesundheitspsychologie des Kindes- und Jugendalters""",200-901a,Exercise Group,Markus Andreas Landolt,German,Master's Working Group 1,N/A,N/A,N/A,N/A
"(G18) Masterarbeitsgruppe ""Psychopathologie und Klinische Intervention 1/2""",200-901a,Exercise Group,"Rahel Christina Bachem, David Johannes Eberle, Andreas Maercker, Myriam Thoma, Yucong Wen, Jun Wen","German, English",Master's Working Group 1,N/A,N/A,N/A,N/A
"(G19) Masterarbeitsgruppe ""Klinische Psychologie mit Schwerpunkt Psychotherapieforschung""",200-901a,Exercise Group,"Marie Drüge, Savion Hesse, Louisa Jagmetti, Birgit Watzke, Mariia Weber, Markus Wolf","German, English",Master's Working Group 1,N/A,N/A,N/A,N/A
"(G20) Masterarbeitsgruppe ""Experimentelle Psychopathologie und Psychotherapie""",200-901a,Exercise Group,Birgit Kleim,"German, English",Master's Working Group 1,N/A,N/A,N/A,N/A
"(G25) Masterarbeitsgruppe ""Neurolinguistik""",200-901a,Exercise Group,Philosophische Fakultät N.N.-Dozent,"German, English",Master's Working Group 1,N/A,N/A,N/A,N/A
"(G26) Masterarbeitsgruppe ""Behandlung von Substanzstörungen""",200-901a,Exercise Group,Michael Schaub,"German, English",Master's Working Group 1,N/A,N/A,N/A,N/A
Research Module 3: Fieldwork,721-553a,Selbststudium mit Leistungsnachweis,N/A,"German, English",Research Module 3: Fieldwork,N/A,N/A,N/A,N/A
Research Module 3: Museum Research,721-554a,Praktikum,N/A,"German, English",Research Module 3: Museum Research,N/A,N/A,N/A,N/A
Research Module 3: Extended Literature Research,721-555a,Selbststudium mit Leistungsnachweis,N/A,"German, English",Research Module 3: Extended Literature Research,N/A,N/A,N/A,N/A
"«Bibliothek zur glücklichen Zukunft» – Ethnologie, Engagement, Zürich",721k476a,Seminar,N/A,German,"„Towards a Happy Future"" - Anthropology, Engagement, Zurich",N/A,N/A,N/A,N/A
Praktikum in einem Anwendungsbereich der Ethnologie  Beginn im Frühlingssemester 2024,721k475b,Praktikum,N/A,German,Internship in Applied Social Anthropology,N/A,N/A,N/A,N/A
Praktikum in einem Anwendungsbereich der Ethnologie  Beginn im Herbstsemester 2024,721l475a,Praktikum,N/A,German,Internship in Applied Social Anthropology,N/A,N/A,N/A,N/A
Fallbearbeitung im Öffentlichen Recht Gruppe 1,90PM5-1,Hausarbeit,Oliver Diggelmann,German,Case Studies in Public Law,N/A,N/A,N/A,N/A
Fallbearbeitung im Öffentlichen Recht Gruppe 2,90PM5-1,Hausarbeit,Johannes Reich,German,Case Studies in Public Law,N/A,N/A,N/A,N/A
Fallbearbeitung im Öffentlichen Recht Gruppe 3,90PM5-1,Hausarbeit,Giovanni Biaggini,German,Case Studies in Public Law,N/A,N/A,N/A,N/A
"(G29) Masterarbeitsgruppe ""Forschung in der kli. Bio- und Neuropsychologie""",200-901a,Exercise Group,Boris B. Quednow,"German, English",Master's Working Group 1,N/A,N/A,N/A,N/A
"(G31) Masterarbeitsgruppe ""Neuropsychologie sozialer Kognition""",200-901a,Exercise Group,Hennric Jokeit,"German, English",Master's Working Group 1,N/A,N/A,N/A,N/A
"(G33) Masterarbeitsgruppe ""Forschungsmethoden, Entwicklung und Diversität des Lernens""",200-901a,Exercise Group,Peter Klaver,"German, English",Master's Working Group 1,N/A,N/A,N/A,N/A
"(G36) Masterarbeitsgruppe ""Entwicklung des Gehirns""",200-901a,Exercise Group,Nora M. Raschle,"German, English",Master's Working Group 1,N/A,N/A,N/A,N/A
"(G37) Masterarbeitsgruppe ""Differentielle Psychologie und Diagnostik""",200-901a,Exercise Group,Wiebke Bleidorn,"German, English",Master's Working Group 1,N/A,N/A,N/A,N/A
"(G38) Masterarbeitsgruppe ""Persönlichkeitspsychologie""",200-901a,Exercise Group,Christopher Hopwood,"German, English",Master's Working Group 1,N/A,N/A,N/A,N/A
"(G39) Masterarbeitsgruppe ""Persönlichkeit und psychische Gesundheit im interkulturellen Kontext""",200-901a,Exercise Group,Amber Gayle Thalmayer,"German, English",Master's Working Group 1,N/A,N/A,N/A,N/A
"(G40) Masterarbeitsgruppe ""Current topics in cognitive and behavioral decision research""",200-901a,Exercise Group,Renato Frey,"German, English",Master's Working Group 1,N/A,N/A,N/A,N/A
