Event Name,Event Code,Event Type,Instructor,Course Languages,Component of Module,Weekday,Daytime,Start Time,End Time
Cognitive Issues in GIScience (Exercise),GEO873.2,Lecture with Practical Exercises,"Sara Fabrikant, Math.-naturwiss. Fakultät N.N.-Dozent",English,GEO 873 Cognitive Issues in GIScience,Tuesday,Morning,10,12
Regulation without Law? Law and the Technologies of the Twenty-First Century,90GL19-1,Course,Christoph Beat Graber,English,Regulation without Law? Law and the Technologies of the Twenty-First Century,Tuesday,Afternoon,12,13
Kapitalmarktrecht II,90WM17-1,Lecture with Practical Exercises,"Aline Darbellay Suso, Daniel Dedeyan",German,Law of Capital Markets II,Tuesday,Afternoon,12,13
Indogermanistik,272-008a,Course,Paul Widmer,"German, English",Indo-European Linguistics,Tuesday,Morning,8,9
Strukturierung linguistischer Daten,272-017a,Exercise Group,Taras Zakharko,"German, English",Structuring Linguistic Data,Tuesday,Afternoon,12,13
ISLE Colloquium,272-501a,Colloquium,"Balthasar Bickel, John Mansfield, Martin Meyer, Sabine Stoll, Paul Widmer",English,Master's Thesis Colloquium,Tuesday,Afternoon,16,18
Diversity of Indo-European Languages,272-519a,Seminar,Paul Widmer,"German, English",Diversity of Indo-European Languages,Tuesday,Afternoon,14,15
Evolutionary Neuroscience of Language,272l614a,Seminar,"Martin Meyer, Valeriia Perepelytsia",English,Evolutionary Neuroscience of Language,Tuesday,Morning,10,12
Gesellschaftsrecht Gruppe 2,120PM4-1,Course,Julia Nicolussi,German,"Trade and Business Law I, Part 1 (no exam registration)",Tuesday,Afternoon,16,18
Kolloquium im Gesellschaftsrecht Gruppe 2,120PM4-2,Colloquium,Aline Darbellay Suso,German,"Trade and Business Law I, Part 1 (no exam registration)",Tuesday,Morning,8,9
Handels– und Wirtschaftsrecht II,90PM2-1,Lecture with Practical Exercises,"Andreas Heinemann, Peter Georg Picht, Florent Thouvenin",German,Trade and Business Law II,Tuesday,Morning,10,12
Workshop and Lecture Series on the Law and Economics of Innovation,90WM36-1,Course,"Stefan Bechtold, Andreas Heinemann, Peter Georg Picht",English,Workshop and Lecture Series on the Law and Economics of Innovation,Tuesday,Afternoon,16,18
Internationales Gesellschaftsrecht,90WM12-1,Course,Harald Bärtschi,German,International Company Law,Tuesday,Morning,8,9
Datenschutzrecht,90WM5-1,Course,Florent Thouvenin,German,Data Protection Law,Tuesday,Afternoon,14,15
Klinische Psychologie: Verhaltensmedizin,200-401a,Course,Ulrike Ehlert,German,Clinical Psychology: Behavioral Medicine,Tuesday,Afternoon,14,15
Postdigital religious Education,24SS017,Seminar,N/A,German,PT Seminar Religionspädagogik: Postdigitale religionsbezogene Bildung,N/A,N/A,N/A,N/A
Psychologische Diagnostik,200-501a,Course,André Kretzschmar,German,Psychological Assessment,Tuesday,Morning,10,12
Gesundheitspsychologie,200-502a,Course,Konstantin Schenkel,German,Health Psychology,Tuesday,Afternoon,12,13
Antikchinesisch I,280-020a,Sprachkurs,Wolfgang Behr,German,Classical Chinese I,Tuesday,Afternoon,12,13
Writing and speaking B2-C1 (English),_E_WrSBC,Sprachkurs,David Camorani,English,Writing and speaking B2-C1 (English),Tuesday,Morning,8,9
Writing your master's thesis C1-C2 (English),_E_WM,Sprachkurs,David Camorani,English,Writing your master's thesis C1-C2 (English),Tuesday,Afternoon,12,13
Advanced discussions and vocabulary extension C1-C2 (English),_E_ZAdDC,Sprachkurs,Kimberly Lewis,English,Advanced discussions,Tuesday,Afternoon,14,15
Advanced academic writing C1-C2 (English),_E_AdvWr,Sprachkurs,Kimberly Lewis,English,Advanced academic writing C1-C2 (English),Tuesday,Afternoon,16,17
Writing research papers for publication: Natural science and engineering C1-C2 (English),_E_ZWpNa,Sprachkurs,Kimberly Lewis,English,Writing research papers for publication,Tuesday,Afternoon,12,13
Strafrecht BT I,120PM5-1,Course,Marc Thommen,German,"Criminal Law II, Part 1 (no exam registration)",N/A,N/A,N/A,N/A
Strafrecht BT I,120PM5-1,Course,Marc Thommen,German,"Criminal Law II, Part 1 (no exam registration)",Tuesday,Morning,10,12
Anarchist and Utopian Writing in China Across the Ages,280l514a,Seminar,Wolfgang Behr,English,Anarchist and Utopian Writing in China Across the Ages,Tuesday,Morning,10,12
English for law B2,_E_Law1,Sprachkurs,Paschal Maher,English,Legal English 1,Tuesday,Afternoon,12,13
English language and literature C1-C2,_E_ELLC,Sprachkurs,Michelle Norgate,English,English language and literature C1-C2,Tuesday,Afternoon,16,17
Writing and speaking B2-C1 (English),_E_WrSBC,Sprachkurs,Michelle Norgate,English,Writing and speaking B2-C1 (English),Tuesday,Afternoon,12,13
Discussions and vocabulary building B2 (English),_E_ZDisB,Sprachkurs,Katie Schwendimann,English,Discussions and vocabulary building B2,Tuesday,Afternoon,16,17
TOEFL test preparation B2-C2,_E_TOEF1,Sprachkurs,Katie Schwendimann,English,TOEFL test preparation B2-C2 (semester weeks 1-7) (English),Tuesday,Afternoon,12,13
Academic English C1 (Part1),-E-Ac1,Sprachkurs,Rupert Taylor,English,Academic English C1 (Part1),Tuesday,Morning,8,9
Advanced pronunciation and speaking (semester weeks 1-7),_E_PrAdv,Sprachkurs,Rupert Taylor,English,Advanced pronunciation and speaking (semester weeks 1-7) (English),Tuesday,Afternoon,12,13
Writing your master's thesis: Natural,_E_WMNat,Sprachkurs,Rupert Taylor,English,Writing your master's thesis: Natural,Tuesday,Afternoon,16,17
Nebenstrafrecht,90WM25-1,Course,Marc Théodore Jean-Richard-dit-Bressel,German,Secondary Criminal Law,Tuesday,Afternoon,16,18
Staatsrecht I Gruppe 1,60PM8-1,Course,"Andreas Glaser, Lorenz Langer",German,"Public Law I, Part 1 (no exam registration)",Tuesday,Morning,8,9
Staatsrecht I Gruppe 2,60PM8-1,Course,Giovanni Biaggini,German,"Public Law I, Part 1 (no exam registration)",Tuesday,Morning,10,12
Staatsrecht I Gruppe 3,60PM8-1,Course,Johannes Reich,German,"Public Law I, Part 1 (no exam registration)",Tuesday,Morning,8,9
Allgemeines Verwaltungsrecht Gruppe 2,120PM6-1,Lecture with Practical Exercises,Felix Uhlmann,German,"Public Law II, Part 1 (no exam registration)",Tuesday,Morning,8,9
Öffentliches Verfahrensrecht Gruppe 1,120PM6-2,Course,Alain Griffel,German,"Public Law II, Part 1 (no exam registration)",Tuesday,Afternoon,14,15
Öffentliches Verfahrensrecht Gruppe 2,120PM6-2,Course,Felix Uhlmann,German,"Public Law II, Part 1 (no exam registration)",Tuesday,Afternoon,14,15
Grundlagen der lateinischen Linguistik,323l004a,Seminar,Florian Sommer,German,Basic Latin Linguistics,Tuesday,Afternoon,16,18
"International Organisations - Transforming the Organisations, Transforming Education",226l511a,Seminar,Christian Ydesen,English,"International Organisations - Transforming the Organisations, Transforming Education",Tuesday,Morning,10,12
Musik und Dichtung im 17. Jh.,760l002a,Seminar,Hein Sauer,German,Music and poetry in the 17th century,Tuesday,Afternoon,16,18
Fundamental Probability for Finance (I+II) (L),22MO0058,Course,Marc Paolella,English,Fundamental Probability for Finance (I+II) (L),Tuesday,Morning,10,12
Statistical Foundations for Finance (Mathematical and Computational Statistics with a View Towards Finance,22MO0103,Course,Marc Paolella,English,Statistical Foundations for Finance (Mathematical and Computational Statistics with a,Tuesday,Afternoon,16,18
Real Analysis I (L),22MO0194,Course,Marc Paolella,English,Real Analysis I (L),Tuesday,Afternoon,12,13
Introduction to Measure Theory and Lebesgue Integration (L),22MO0227,Course,Marc Paolella,English,Introduction to Measure Theory and Lebesgue Integration (L),Tuesday,Morning,8,9
Geschichte und Soziologie der Medien,254-055a,Course,Edzard Schade,German,History and Sociology of Media,Tuesday,Morning,10,12
Multivariate Statistics,254-501a,Course,Maud Reveilhac,English,Multivariate Statistics,Tuesday,Afternoon,14,15
It's a (wo)man's world! Archäologische Perspektiven auf Frauen in Griechenland,682l101a,Course,Corinna Reinhardt,German,It's a (wo)man's world! Archaeological perspectives on women in Greece,Tuesday,Morning,10,12
Förderung und Erfassung erwerbsbezogener digitaler Kompetenzen,226l507a,Seminar,Sara Keel,German,Promotion and recording of work-related digital competencies,Tuesday,Afternoon,12,13
Lateinische Sprache im Mittelalter,324-503a,Sprachkurs,Alexander Christian Häberlin,German,Latin Language in the Middle Ages,Tuesday,Morning,10,12
Aquatic Ecology,EEE318,Block Course,"Florian Altermatt, Anita Julianne Narwani, Pieter Spaak",English,EEE 318 Aquatic Ecology,Tuesday,Afternoon,13,17
ME4: Accounting and Economics (L+E),22MO0004,Lecture with Practical Exercises,"Robert F. Göx, Dieter Pfaff",English,ME4: Accounting and Economics (L+E),Tuesday,Afternoon,12,13
Applied Empirical Methods for BusinessAdministration (L+E),22MO0006,Lecture with Practical Exercises,"Sergei Ketkov, Oleg Prokopyev",English,Applied Empirical Methods for Business Administration,Tuesday,Afternoon,16,18
"Forschung und Lehre an der mittelalterlichen Universität: Texte, Autoren, Handschriften",324l512a,Seminar,"Carmen Cardelle, Inga Mai Groote",German,"Research and Teaching at Medieval Universities: Texts, Authors, Manuscripts",Tuesday,Afternoon,14,15
Corporate Finance (L+E),22BO0008,Lecture with Practical Exercises,Zacharias Sautner,German,Corporate Finance (L+E),Tuesday,Morning,8,9
Corporate Finance (L),22MO0008,Course,Zacharias Sautner,English,Corporate Finance (L),Tuesday,Afternoon,14,15
Theorien der Multinationalen Unternehmung (S) (Theories of Multinational Corporation),22BO0059,Seminar,Andreas Scherer,German,Theorien der Multinationalen Unternehmung (S) (Theories of Multinational,Tuesday,Morning,10,12
Doktoranden- und Forschungsseminar (S) HS24 (Research Seminar HS24),DOEC1158,Doktorandenseminar,Andreas Scherer,German,Doktoranden- und Forschungsseminar (S) HS24 (Research Seminar HS24),Tuesday,Afternoon,16,18
Seminar at the Institute of Anatomy,ANA0Y010,Seminar,"Andrew Hall, Soeren Lienkamp, Johannes Loffing, Caroline Maake, Lukas Sommer, Christian Stockmann, Oliver Ullrich, David P. Wolfer",German,Seminar at the Institute of Anatomy,Tuesday,Afternoon,16,17
Introduction to Game Theory (L),22BO0020,Course,Jakub Steiner,English,Introduction to Game Theory (L+E),Tuesday,Afternoon,16,18
Behavioral Theory (L),22MO0081,Course,Jakub Steiner,English,Behavioral Theory (L+E),Tuesday,Morning,10,12
"Unterricht, Didaktik und Lernen: Grundlagen",226-523a,Lecture with Practical Exercises,Vanda Capon-Sieber,German,"Instruction, Didactics, and Learning: Basics",Tuesday,Morning,10,12
Communication Systems Lab Course (PR),22MI0021,Praktikum,Burkhard Stiller,English,Communication Systems Lab Course (PR),Tuesday,Afternoon,14,18
Introduction to Operations Research (L+E),22BO0010,Lecture with Practical Exercises,"Oleg Prokopyev, Tarkan Tan",English,Introduction to Operations Research (L+E),Tuesday,Afternoon,12,15
Elective modules: Informatics for master theses and data analysis,MAS3120,Sonstiges,"Patrick Beeler, Martina Gosteli Eichenberger, Roger Kouyos",German,Elective Module: Informatics for the Masters' thesis and data analysis,Tuesday,Morning,8,12
Elective modules: Psychiatry 1 -   Bioscience methods for the study of   psychiatric disorders,81MAS304,Sonstiges,"Oliver Gero Bosch, Silvia Brem, Simon Foster, Anton Gietl, Edna Grünblatt, Amelie Haugg, Sara Liane Kroll, Andrei Manoliu, Cornelia Marty, Meichun Mohler-Kuo, Christopher Pryce, Boris B. Quednow, Mélisse Colette Jacqueline Robert, Belen Rubio Morell, Hannes Sigrist, Philipp Stämpfli, Anna Werling",German,Elective Module: Psychiatry 1 - Bioscience methods for the study of psychiatric,Tuesday,Morning,8,12
PhD Seminar I,22CL_006,Seminar,"Alisa Berger, Malcolm Kohler, Milo Alan Puhan",English,PhD Seminar I,Tuesday,Afternoon,16,17
Applied Implementation Science in HealthCare,23CR_506,Seminar,"Lauren Clack, Rahel Naef","German, English",Applied Implementation Science in Health Care,Tuesday,Morning,10,12
Guter Unterricht im Spannungsfeld zwischen gesellschaftlichen Anforderungen und Erkenntnissen,226l524a,Seminar,Katriina Vasarik Staub,German,Good schooling in a tension field between societal expectations and empirical,Tuesday,Afternoon,16,18
Theorie und Empirie der Erziehungswissenschaft,234-507a,Lecture with Practical Exercises,Katrin Kraus,German,Theory and Empirics of Educational Science,Tuesday,Afternoon,14,15
Cutting Edge Topics in Immunology and Infection Biology,MIK0S080,Course,"Martin F. Bachmann, Burkhard Becher, Cornelia Halin Winter, Manfred Kopf, Salomé Leibundgut-Landmann, Christian Münz, Annette Oxenius, Daniel Pinschewer, Silke Stertz, Alexandra Trkola, Maries van den Broek",English,Cutting Edge Topics in Immunology and Infection Biology,Tuesday,Afternoon,16,19
"Kernspintomographie und lokale Magnetresonanz-Spektroskopie, Kolloquium",BMT0M030,Colloquium,Klaas Paul Prüssmann,German,"Kernspintomographie und lokale Magnetresonanz-Spektroskopie, Kolloquium",Tuesday,Afternoon,12,14
Klinische Visite,DER0M050,Kurs,"Florentia Dimitriou, Reinhard Dummer, Jürg Hafner, Lukas Krähenbühl, Ioanna Mangana, Julia-Tatjana Maul",German,Klinische Visite,Tuesday,Morning,8,8
Seminar in Klinischer Pharmakologie und Toxikologie (mit dem Schweizerischen Toxikologischen Informationszentrum),MED0M390,Kurs,"Alessandro Emanuele Ceschi, Gerd-Achim Kullak-Ublick, Stefan Weiler",German,Seminar in Klinischer Pharmakologie und Toxikologie (mit dem Schweizerischen,Tuesday,Morning,8,9
"Gynäkologisch-onkologisches Kolloquium, Fallbesprechung (Tumorboard)",GYN0M070,Colloquium,"Matthias Guckenberger, Bernhard Pestalozzi, Zsuzsanna Varga",German,"Gynäkologisch-onkologisches Kolloquium, Fallbesprechung (Tumorboard)",Tuesday,Afternoon,15,16
Klinische Visite in interventioneller Neuroradiologie,RAD0M110,Kurs,"Zsolt Kulcsar, Tilman Schubert",German,Klinische Visite in interventioneller Neuroradiologie,Tuesday,Afternoon,17,18
Probleme der Fahreignung,JUM0M050,Kurs,Michael Thali,German,Probleme der Fahreignung,Tuesday,Afternoon,13,14
Blockchain and Crypto Economics (L&amp;E),22MI0036,Lecture with Practical Exercises,Claudio Tessone,English,Blockchain and Crypto Economics (L&amp;E),Tuesday,Afternoon,12,15
Freshwater Environmental and Ecosystem Modelling,EEE362,Course,Luca Carraro,English,EEE 362 Freshwater Environmental and Ecosystem Modelling,Tuesday,Morning,8,9
Zurich GSE Placement Class (V),DOEC6121,Course,Hans-Joachim Voth,English,Zurich GSE Placement Class (V),Tuesday,Morning,8,9
Ideengeschichte &amp; Wissenschaftsphilosophie (V+Ü) History of Economic Thought (L+E),22BO0057,Lecture with Practical Exercises,"Suzann-Viola Renninger, Ulrich Woitek",German,Ideengeschichte &amp; Wissenschaftsphilosophie (V+Ü) History of Economic Thought,Tuesday,Morning,8,9
Einführung in die empirische Wirtschaftsforschung (V) (Introductory Econometrics),22BO0002,Course,Michael Wolf,German,Einführung in die empirische Wirtschaftsforschung (V+Ü) (Introductory Econometrics),Tuesday,Morning,10,12
Einführung in die empirische Wirtschaftsforschung (Ü) (Introductory Econometrics),22BO0002,Exercise Group,Wirtschaftswiss. Fakultät N.N.-Dozent,German,Einführung in die empirische Wirtschaftsforschung (V+Ü) (Introductory Econometrics),Tuesday,Afternoon,14,15
Econometrics for Policy Analysts (L),22MO0168,Course,David Yanagizawa-Drott,English,Econometrics for Policy Analysts (L+E),Tuesday,Afternoon,14,15
Empirical Microeconomics Seminar (S),DOEC6111,Doktorandenseminar,"Anne Ardila Brenoe, Lorenzo Casaburi, Ana Costa-Ramon, Amanda Dahlstrand, David Dorn, Josef Zweimüller, Ulf Zölitz",English,Empirical Microeconomics Seminar (S),Tuesday,Afternoon,12,13
ME1: Personnel Economics (L+E),22MO0001,Lecture with Practical Exercises,"Uschi Backes-Gellner, Maddalena Davoli",English,ME1: Personnel Economics (L+E),Tuesday,Morning,8,9
Business Economics Research Seminar (S) HS24,DOEC1146,Doktorandenseminar,"Luis Aguiar, Uschi Backes-Gellner, Helmut Max Dietl, Raphael Flepp, Egon Franck, Patrick Lehnert, Martin Natter, Anja Schulze, Carmit Segal, Katarina Zigova",English,Business Economics Research Seminar (S) HS24,Tuesday,Afternoon,12,13
Sinnfluencer,254l102a,Seminar,Anna Schorn,German,Sinnfluencer,Tuesday,Afternoon,14,15
Español B2: Gramática y comunicación,_Sp_B2Gc,Sprachkurs,Joaquin Ruano Cespedes,Spanish,Español B2: Gramática y comunicación,Tuesday,Afternoon,16,17
Zurich Graduate Colloquium,MAT075.1,Colloquium,N/A,English,MAT 075 Zurich Graduate Colloquium,Tuesday,Afternoon,16,18
Grundlagen Fernerkundung,GEO233.1,Course,"Andreas Hüni, Mathias Kneubühler, Elias Mendez Dominguez, Livia Piermattei, Claudia Röösli, Hendrik Wulf","German, English",GEO 233 Remote Sensing and Geographic Information Science III (Basics of Remote,Wednesday,Afternoon,14,15
Geomorphologie und Glaziologie,GEO231.1,Course,"Isabelle Gärtner, Andreas Vieli",German,GEO 231 Physical Geography III (Geomorphology and Glaziology),Wednesday,Morning,10,12
Spectroscopy of the Earth System,GEO442.1,Course,"Alexander Damm-Reiser, Andreas Hüni, Mathias Kneubühler, Math.-naturwiss. Fakultät N.N.-Dozent, Daniel Odermatt, Daniel Schläpfer",English,GEO 442 Specialization in Remote Sensing: Spectroscopy of the Earth System,Wednesday,Morning,8,9
"Spectroscopy of the Earth System, Exercises",GEO442.2,Exercise Group,"Alexander Damm-Reiser, Andreas Hüni, Mathias Kneubühler, Math.-naturwiss. Fakultät N.N.-Dozent, Daniel Odermatt, Daniel Schläpfer",English,GEO 442 Specialization in Remote Sensing: Spectroscopy of the Earth System,Wednesday,Morning,10,12
Earth Perspectives - Introduction to Geographic Information Science and Remote Sensing,GEO113.1,Course,"Alexander Damm-Reiser, Elias Mendez Dominguez, Felix Morsdorf, Livia Piermattei, Robert Weibel, Hendrik Wulf",German,GEO 113 Remote Sensing and Geographic Information Science I (Earth Perspectives),Wednesday,Morning,8,9
"Earth Perspectives Labs, Gruppe 2",GEO113.2,Exercise Group,"Alexander Damm-Reiser, Elias Mendez Dominguez, Felix Morsdorf, Livia Piermattei, Robert Weibel, Hendrik Wulf",German,GEO 113 Remote Sensing and Geographic Information Science I (Earth Perspectives),Wednesday,Afternoon,14,15
Forschungsforum Biogeochemistry and Landscape Dynamics (für Doktorierende),GEOFoBL,Forschungsseminar,"Markus Egli, Michael W.I. Schmidt, Guido Lars Bruno Wiesenberg",English,Research Forum on Biogeochemistry and Landscape Dynamics (for PhD),Wednesday,Afternoon,16,17
Dendro-Ecology,GEO818.1,Lecture with Practical Exercises,Paolo Cherubini,"German, English",GEO 818 Dendro-Ecology,Wednesday,Afternoon,16,18
Retrieving Geographic Information,GEO871.1,Lecture with Practical Exercises,Ross Stuart Purves,English,GEO 871 Retrieving Geographic Information,Wednesday,Afternoon,14,15
"Earth Perspectives Labs, Gruppe 3",GEO113.2,Exercise Group,"Alexander Damm-Reiser, Elias Mendez Dominguez, Felix Morsdorf, Livia Piermattei, Robert Weibel, Hendrik Wulf",German,GEO 113 Remote Sensing and Geographic Information Science I (Earth Perspectives),Wednesday,Afternoon,16,18
Advanced Spatial Analysis I,GEO872.1,Lecture with Practical Exercises,"Peter Ranacher, Takuya Takahashi, Robert Weibel",English,GEO 872 Advanced Spatial Analysis I,Wednesday,Morning,10,12
Vertiefung Humangeographie: Critical Reading and Writing,GEO363.1,Course,"Jennifer Bartmess, Christine Schenk",English,GEO 363 Advanced Human Geography Vc (Critical reading and writing seminar),Wednesday,Morning,9,12
Kristalle und Mineralien,ESS231.1,Lecture with Practical Exercises,N/A,German,N/A,Wednesday,Morning,10,13
Numerical modelling of Ore Forming Hydrothermal Processes,ESS451.1,Course,N/A,German,N/A,Wednesday,Morning,10,12
Advanced geochronology,ESS429.1,Course,N/A,German,N/A,Wednesday,Morning,8,10
"Geophysik I, VL",ESS352.1,Course,N/A,German,ESS 352 Geophysics I,Wednesday,Morning,10,12
Atmosphärenchemie,ESS373.1,Course,N/A,German,ESS 373 Atmospheric Chemistry,Wednesday,Morning,8,10
Atmosphärenphysik,ESS374.1,Course,N/A,German,ESS 374 Atmospheric Physics,Wednesday,Morning,10,12
Wettersysteme,ESS383.1,Course,N/A,German,ESS 383 Weather Systems,Wednesday,Afternoon,14,16
"GGP.S420 Geographie Grundkurs I, Gruppe C",GEO900.1,PHZH SEK I Module,"Holger Frey, Sara Landolt, Andreas Linsbauer",German,GGP.S420 Basics in Geography I,Wednesday,Morning,8,9
"GGP.S420 Geographie Grundkurs I, Gruppe D",GEO900.1,PHZH SEK I Module,"Holger Frey, Sara Landolt, Andreas Linsbauer",German,GGP.S420 Basics in Geography I,Wednesday,Morning,10,12
Research Colloquium in Economic Geography for MSc and Phd Students,GEO511.8,Colloquium,"Xavier Balaguer Rasillo, Christian Berndt","German, English",GEO 511 Master Thesis,Wednesday,Afternoon,16,18
Research Colloquium in Social and   Cultural Geography for MSc and   PhdStudents,GEO511.6,Colloquium,"Ifigeneia Dimitrakou, Hanna Hilbrandt",German,GEO 511 Master Thesis_Beg_Okt,Wednesday,Afternoon,16,18
Geochronologie I,GEO343.1,Lecture with Practical Exercises,"Paolo Cherubini, Marcus Christl, Markus Egli, Dmitry Tikhomirov","German, English",GEO 343 Geochronology,Wednesday,Afternoon,14,15
Earth System Observations and Analyses,ESS417.1,Lecture with Practical Exercises,"Alexander Damm-Reiser, Math.-naturwiss. Fakultät N.N.-Dozent",English,ESS 417 Earth System Observations and Analyses,Wednesday,Afternoon,14,15
"Geobiologie, Uebungen",ESS236.1,Course,N/A,German,ESS 236 Geobiology,Wednesday,Afternoon,16,17
Analyzing the plant-soil system: theory,ESS841.1,Seminar,"Meredith Christine Schuman, Guido Lars Bruno Wiesenberg",English,ESS 841 Analyzing the plant-soil system,Wednesday,Afternoon,12,13
Inhaltsregulierung auf Internet- Plattformen,254l107a,Seminar,Florian Saurwein-Scherer,German,Content moderation on Internet platforms,Wednesday,Afternoon,14,15
Religionen und religiöse Diskurse in der digitalen Öffentlichkeit,254l118a,Seminar,Rebekka Sarah Rieser,German,Religions and religious debates in the digital public sphere,Wednesday,Morning,10,12
Data Analysis and Visualization for Communication Science,254l113a,Seminar,Morley Weston,English,Data Analysis and Visualization for Communication Science,Wednesday,Evening,18,20
Einführung in das wissenschaftliche Arbeiten (Ü) (Introduction to scientific working),22BO0004,Exercise Group,Deborah Kistler,German,Einführung in das wissenschaftliche Arbeiten (Ü) (Introduction to scientific working),Wednesday,Morning,8,9
Einführung in das wissenschaftliche Arbeiten (Ü) (Introduction to scientific working),22BO0004,Exercise Group,Deborah Kistler,German,Einführung in das wissenschaftliche Arbeiten (Ü) (Introduction to scientific working),Wednesday,Morning,8,9
Einführung in das wissenschaftliche Arbeiten (Ü) (Introduction to scientific working),22BO0004,Exercise Group,Deborah Kistler,German,Einführung in das wissenschaftliche Arbeiten (Ü) (Introduction to scientific working),Wednesday,Morning,8,9
Einführung in das wissenschaftliche Arbeiten (Ü) (Introduction to scientific working),22BO0004,Exercise Group,Deborah Kistler,German,Einführung in das wissenschaftliche Arbeiten (Ü) (Introduction to scientific working),Wednesday,Morning,8,9
Einführung in das wissenschaftliche Arbeiten (Ü) (Introduction to scientific working),22BO0004,Exercise Group,Deborah Kistler,German,Einführung in das wissenschaftliche Arbeiten (Ü) (Introduction to scientific working),Wednesday,Morning,10,12
Einführung in das wissenschaftliche Arbeiten (Ü) (Introduction to scientific working),22BO0004,Exercise Group,Deborah Kistler,German,Einführung in das wissenschaftliche Arbeiten (Ü) (Introduction to scientific working),Wednesday,Morning,10,12
Einführung in das wissenschaftliche Arbeiten (Ü) (Introduction to scientific working),22BO0004,Exercise Group,Deborah Kistler,German,Einführung in das wissenschaftliche Arbeiten (Ü) (Introduction to scientific working),Wednesday,Morning,10,12
Einführung in das wissenschaftliche Arbeiten (Ü) (Introduction to scientific working),22BO0004,Exercise Group,Deborah Kistler,German,Einführung in das wissenschaftliche Arbeiten (Ü) (Introduction to scientific working),Wednesday,Afternoon,14,15
Einführung in das wissenschaftliche Arbeiten (Ü) (Introduction to scientific working),22BO0004,Exercise Group,Deborah Kistler,German,Einführung in das wissenschaftliche Arbeiten (Ü) (Introduction to scientific working),Wednesday,Afternoon,14,15
Einführung in das wissenschaftliche Arbeiten (Ü) (Introduction to scientific working),22BO0004,Exercise Group,Deborah Kistler,German,Einführung in das wissenschaftliche Arbeiten (Ü) (Introduction to scientific working),Wednesday,Afternoon,14,15
Politik im Netz: Digitale Kommunikationsstrategien,254l115a,Seminar,Pamina Syed Ali,German,Politics on the Internet: Digital communication strategies,Wednesday,Morning,10,12
Fächerübergreifend Unterrichten,U,Seminar,"Christine Gerloff-Gasser, Balz Wolfensberger",German,Interdisciplinary Teaching,Wednesday,Morning,10,12
Strategic CEO Communication &amp; Socio- Political Advocacy,254l117a,Seminar,Markos Mpadanes,English,Strategic CEO Communication &amp; Socio- Political Advocacy,Wednesday,Afternoon,12,13
Fitspiration in den sozialen Medien,254l119a,Seminar,Isa Vos,German,Fitspiration in den sozialen Medien,Wednesday,Afternoon,12,13
Swedish I A1,_SWE_I,Sprachkurs,Franziska Kreis,German,Swedish I A1,Wednesday,Morning,10,12
Swedish II A2.1,_SWE_II,Sprachkurs,Franziska Kreis,German,Swedish II A2.1,Wednesday,Afternoon,12,13
Russian I A1.1,_RUS_I,Sprachkurs,Daniel Henseler,German,Russian I A1.1,Wednesday,Afternoon,12,13
Russian I A1.1,_RUS_I,Sprachkurs,Daniel Henseler,German,Russian I A1.1,Wednesday,Evening,18,20
Russian V A2.2+,_RUS_V,Sprachkurs,Daniel Henseler,German,Russian V A2.2+,Wednesday,Afternoon,16,18
"Exercices pratiques, groupe 1",390-002a,Exercise Group,Marie Burkhardt,French,Modern Literature: Theories and Practices,Wednesday,Morning,10,12
Exercices de rédaction universitaire,390-014a,Exercise Group,Marie Burkhardt,French,Academic Writing (French),Wednesday,Afternoon,12,13
